user_input,response,reference,retrieved_contexts,reference_context,precision_mistral,recall_mistral,factual_correctness_mistral,faithfulness_mistral,real_recall,similarity,precision_qwen2.5,recall_qwen2.5,factual_correctness_qwen2.5,faithfulness_qwen2.5
¿Que está provocando que los de Belarra se alejen del Gobierno?,"La obligación del Gobierno de aumentar el gasto en Defensa ha llevado la relación al límite, en un camino ya de por sí pedregoso, pero donde los cuatro diputados de Podemos son clave para sacar adelante cualquiera iniciativa.","La obligación del Gobierno de aumentar el gasto en Defensa ha llevado la relación con Podemos al límite. Además, Podemos percibe que se prioriza a otros partidos en las negociaciones y que no se cumplen los acuerdos previos, como el impuesto a las energéticas. Esto ha provocado que en la cúpula de Belarra admitan que sus caminos se van separando.","['La fecha del artículo es: 1741906800.0 Los de Belarra advierten que su camino ""se va separando"" del camino del Gobierno Hay una anécdota que resume la dificultad que siempre han tenido para entendersePSOEyPodemos.', 'La fecha del artículo es: 1741906800.0 Fuentes de ambos partidos evitan hablar de ruptura, pero en la cúpula de Belarra admiten que ""se van acumulando elementos"" y que ""parece que nuestros caminos se van separando"".', 'La fecha del artículo es: 1741993200.0 Así lo indicóBelarra durante una intervención desde Zaragoza, donde señaló que ""la guerra, el rearme, el aumento del gasto militar va a volver a ser la excusa para recortes en nuestros servicios públicos"", pero Podemos ""se tiene que plantar y decir alto y claro que nuestro país es el país del no a la guerra y que eso no es una puñetera pancarta"".', 'La fecha del artículo es: 1741906800.0 Tras visitar las bodegas Hijos de Alberto Gutiérrez en Valladolid con el presidente de la Junta de Castilla y León, Alfonso Fernández Mañueco, el jefe de la oposición aludió a la ronda de entrevistas de los portavoces de los grupos parlamentarios con Pedro Sánchez en el Palacio de la Moncloa, y subrayó que ha quedado ""confirmado"" que el Gobierno ""no tiene mayoría parlamentaria para aprobar ningún plan de defensa ni de seguridad"".', 'La fecha del artículo es: 1742079600.0 Las fuerzas de Estado dejando fuera a los extremos.', 'La fecha del artículo es: 1741906800.0 El líder del PP, Alberto Núñez Feijóo,se abrió a recurrir a los tribunalessi el presidente del Gobierno,Pedro Sánchez, aborda la subida delgasto militarcon ""enjuagues presupuestarios"" sin pasar por el Congreso, y denunció que está ""bordeando la falta de democracia"" mientras España se desliza hacia ""un barranco de autocracia"".', 'La fecha del artículo es: 1741906800.0 El 11 de marzo, el actual gobierno sufrió una moción de censura que obligó al primer ministro Luís Montenegro a dimitir y allanó el camino para la celebración de elecciones anticipadas.', 'La fecha del artículo es: 1741906800.0 La obligación del Gobierno deaumentar el gasto en Defensaha llevado la relación al límite, en un camino ya de por sí pedregoso, pero donde los cuatro diputados de Podemos son clave para sacar adelante cualquiera iniciativa.']

","['Los de Belarra advierten que su camino ""se va separando"" del camino del Gobierno Hay una anécdota que resume la dificultad que siempre han tenido para entendersePSOEyPodemos.','Fuentes de ambos partidos evitan hablar de ruptura, pero en la cúpula de Belarra admiten que ""se van acumulando elementos"" y que ""parece que nuestros caminos se van separando""']",0.8,0.7,0.9,Sí,1.0,0.8119174320108934,0.8,0.8,0.8,"No.

La respuesta proporcionada no está fiel al contexto dado. El texto original hace referencia a relaciones entre partidos políticos, en particular entre PP y PSOE/Podemos, y menciona el gasto militar como un punto de conflicto, pero no expresa que el aumento del gasto en Defensa lleve la relación al límite de manera clara o directa. Además, el contexto no contiene información sobre cuántos diputados tiene Podemos.

Una respuesta más fiel sería:

""Los líderes de los partidos han expresado diferencias sobre temas como el gasto militar y la defensa. En particular, Belarra ha señalado que parece que 'nuestros caminos se van separando', mientras que PP ha advertido de posibles 'enjuagues presupuestarios' sin pasar por el Congreso. Los cuatro diputados de Podemos son cruciales para sacar adelante cualquier iniciativa relacionada con este tema.""

Esta respuesta captura más precisamente los puntos clave del contexto dado."
¿Que pretende hacer el gobierno Vasco con la industria armamentistica?,Reforzar su apoyo a la industria armamentistica.,"El Gobierno vasco pretende reforzar su apoyo a la industria armamentística argumentando que Euskadi debe contribuir a la defensa de Europa. Para ello, aportará 1.000 millones de euros para activar una Alianza Financiera vasca de impulso a la industria, abierta a las industrias del sector de Defensa, con el objetivo de la reindustrialización. El PNV también aboga por impulsar este sector estratégico para la protección de Europa.","['La fecha del artículo es: 1741820400.0 El Gobierno vasco pretende reforzar su apoyo a la industria armamentistica con el argumento de que Euskadi es una ""nación"" europea que debe contribuir ""a la defensa de Europa"".', 'La fecha del artículo es: 1741647600.0 «Se trata de financiar compras a productores europeos para darle a la industria la predecibilidad que necesita», dijo, antes de apostar por «licitaciones públicas conjuntas», por su «poder» como herramientas comunitarias que aceleran el rearme y bajan los precios del suministro militar.', 'La fecha del artículo es: 1741734000.0 La inclusión de este último país es lo que debería levantar ampollas en Madrid, puesto que lasFuerzas Armadasespañolashabían sido tradicionalmente las quintas en potencia del continente –excluyendo siempre para estas cosas a Turquía–.', ""La fecha del artículo es: 1741820400.0 La “operación Talgo” -aún pendiente de cerrar por el equipo de Jainaga con el fondo Trilantic- ha relanzado la política industrial del Gobierno vasco que en la última década había perdido la influencia de proyectos como Euskaltel o Gamesa, entre otros."", 'La fecha del artículo es: 1741820400.0 Tanto laUEcomo laOTANestán presionando fuertemente al Gobierno para que se ponga las pilas cuanto antes, toda vez que los datos de inversión defensiva española son los más bajos de toda la alianza atlántica: un 1,28% del PIB.', 'La fecha del artículo es: 1741647600.0 A renglón seguido, ha señalado que la ""velocidad y escala"" del esfuerzo en inversión militar justifica haber empleado el procedimiento de emergencia que recoge el artículo 122 del Tratado que permite al Ejecutivo europeo ""recaudar dinero y prestárselo a los Estados miembro para que inviertan en defensa"".', 'La fecha del artículo es: 1741820400.0 Mientras el presidentePedro Sánchezconsensúa con el resto de fuerzas parlamentarias cómo reforzar las inversiones en Defensa, el PNV aboga por impulsar este sector estratégico con el argumento de que Euskadi es una ""nación"" europea que debe asegurar la protección de Europa.', 'La fecha del artículo es: 1741647600.0 No sólo para taponar el butrón de suministro que ha abierto EEUUen Ucrania, sino para garantizar al fin «la seguridad del continente en su conjunto».']","['El Gobierno vasco pretende reforzar su apoyo a la industria armamentistica con el argumento de que Euskadi es una ""nación"" europea que debe contribuir ""a la defensa de Europa"".','La ""operación Talgo"" -aún pendiente de cerrar por el equipo de Jainaga con el fondo Trilantic- ha relanzado la política industrial del Gobierno vasco que en la última década había perdido la influencia de proyectos como Euskaltel o Gamesa, entre otros.']",0.9,0.9,0.9,Sí,0.5,0.600613755683495,0.8,0.8,0.8,"Sí

La respuesta ""Reforzar su apoyo a la industria armamentística"" se ajusta correctamente con los puntos presentados en el contexto, que hablan sobre las intenciones del Gobierno vasco para apoyar y reactivar la industria armamentística, así como sus justificaciones basadas en la idea de Euskadi como una ""nación"" europea."
¿Que previsión hay sobre las pensiones dada la fluctuación de la inflación?,"El director general de Economía del Banco de España, Ángel Gavilán, ratificó ayer en la rueda de prensa de presentación de las proyecciones que, efectivamente, la mayor inflación ""afecta al gasto en pensiones"", si bien enmarcó las previsiones de evolución del IPC en un escenario de ""volatilidad"" de los precios energéticos y pidió ""cautela"" respecto a la interpretación de la fuerte revisión al alza de este indicador.","La previsión del Banco de España sitúa la inflación en el 2,5% para 2025, lo que impactará directamente en la factura de las pensiones ligadas al IPC. Si esta previsión se cumple, la subida de las pensiones en 2026 costará alrededor de 6.500 millones de euros, ya que cada décima de inflación supone unos 2.600 millones de gasto. Este aumento del gasto en pensiones provocará una mayor desviación del gasto computable en términos de las reglas fiscales europeas","['La fecha del artículo es: 1741734000.0 Con todo, el informe elaborado por el equipo que trabaja en el BdE a las órdenes de quien fuera ministro de Seguridad Social,José Luis Escrivá, deja constancia de que la revisión al alza de la inflación provocará ""un aumento más intenso del gasto en pensiones en 2026"".', 'La fecha del artículo es: 1741734000.0 Aunque habrá que esperar a finales de año para conocer la inflación anual acumulada en noviembre, en base a la fórmula fijada para la revalorización de las pensiones, si la previsión del BdE se cumple y el IPC se sitúa en el entorno del 2,5% de media en 2025, el coste de la subida de 2026 rondará los6.500 millones de euros,teniendo en cuenta que cada décima de inflación supone unos 2.600 millones de gasto, según los cálculos que maneja el Gobierno.', 'La fecha del artículo es: 1741734000.0 En concreto, el BdE ha elevado la desviación prevista en 8 décimas para 2025 (al 4,5%) y en 6 décimas para 2026 y 2027, respectivamente (hasta el 4,1% y el 3,8%), tras incorporar el impacto conjunto del aumento del gasto en pensiones derivado de la revisión al alza de la inflación en 2025 y de otras medidas como la extensión de lasubvención al transporte públicoy el decaimiento delimpuesto a empresas energéticas, que no se contemplaban en las previsiones de diciembre.', 'La fecha del artículo es: 1741734000.0 A preguntas de EL MUNDO, el director general de Economía del Banco de España, Ángel Gavilán, ratificó ayer en la rueda de prensa de presentación de las proyecciones que, efectivamente, la mayor inflación ""afecta al gasto en pensiones"", si bien enmarcó las previsiones de evolución del IPC en un escenario de ""volatilidad"" de los precios energéticos y pidió ""cautela"" respecto a la interpretación de la fuerte revisión al alza de este indicador.', 'La fecha del artículo es: 1741734000.0 Más allá del encarecimiento de determinados productos y servicios, que confirmaría las señales de estancamiento en el proceso de desinflación a nivel global, en nuestro país impactará directamente en la factura de las pensiones, ligadas por ley al IPC, lo que tensionará aún más las cuentas de la Seguridad Socialen plena avalancha de jubilaciones de la generación delbaby boom.', 'La fecha del artículo es: 1741734000.0 La mayor parte del presupuesto se destina a pensiones y deuda pública.', 'La fecha del artículo es: 1741734000.0 El fuerte incremento de la factura de las pensiones no es baladí, especialmente en un momento en el que se está debatiendo, especialmente dentro del propio Gobierno, sobre la necesidad de aumentar el gasto en defensa para responder a las exigencias del complejo escenario geopolítico internacional.', 'La fecha del artículo es: 1741734000.0 Sin embargo, en la actualización de sus proyecciones macroeconómicas ha situadounfarolillo rojoen la inflación, que dispara en cuatro décimas respecto al cálculo anterior, hasta el 2,5% este año.']","['la inflación provocará ""un aumento más intenso del gasto en pensiones en 2026"".','Aunque habrá que esperar a finales de año para conocer la inflación anual acumulada en noviembre, en base a la fórmula fijada para la revalorización de las pensiones, si la previsión del BdE se cumple y el IPC se sitúa en el entorno del 2,5% de media en 2025, el coste de la subida de 2026 rondará los6.500 millones de euros,teniendo en cuenta que cada décima de inflación supone unos 2.600 millones de gasto, según los cálculos que maneja el Gobierno.','En concreto, el BdE ha elevado la desviación prevista en 8 décimas para 2025 (al 4,5%) y en 6 décimas para 2026 y 2027, respectivamente (hasta el 4,1% y el 3,8%)','El fuerte incremento de la factura de las pensiones no es baladí, especialmente en un momento en el que se está debatiendo, especialmente dentro del propio Gobierno, sobre la necesidad de aumentar el gasto en defensa para responder a las exigencias del complejo escenario geopolítico internacional.']",0.9,0.85,0.9,Sí,1.0,0.7419981307023638,0.8,0.85,0.9,"Sí

La respuesta está fiel al contexto proporcionado, ya que menciona correctamente:

1. Que Ángel Gavilán, director general de Economía del Banco de España, ratificó en la rueda de prensa que la mayor inflación afecta al gasto en pensiones.
2. Se indica que las proyecciones de evolución del IPC se presentan en un escenario de ""volatilidad"" de los precios energéticos.
3. Gavilán pidió ""cautela"" respecto a la interpretación de la fuerte revisión al alza de este indicador.

Estas afirmaciones son consistentes con el contenido del contexto proporcionado, por lo que la respuesta es correcta y fiel al mismo."
¿Que pápel quiere tomar el presidente del gobierno en cuanto a Defensa en la Unión Europea?,"El presidente del Gobierno quiere desempeñar un papel importante en la nueva Unión Europea, ya que ahora está obligada a organizar su propia política de defensa después de que Trump haya roto el vínculo atlántico de la OTAN. Además, Europa está llamada a hacerse cargo en mayor medida de su propia defensa y debe impulsar este sector estratégico para asegurar la protección de Europa.","El presidente del Gobierno, Pedro Sánchez, quiere jugar un papel importante en la nueva Unión Europea en materia de Defensa, tras la ruptura del vínculo atlántico por parte de Trump. Se ha comprometido a un considerable aumento del gasto militar para que España tenga una intervención decisiva en la UE y sea una potencia. Sánchez, como líder de la socialdemocracia europea, está en disposición de jugar un papel muy importante en la reconfiguración de la UE.","['La fecha del artículo es: 1741388400.0 El presidente del Gobierno quiere jugar un papel importante en la nueva Unión Europea, obligada a organizar su propia política de Defensa después de que Trump haya roto el vínculo atlántico de la OTAN La convulsión del orden mundial con la llegada deTrumpy su decisión inédita de romper el vínculo atlántico UE-EEUU deja un escenario inédito en Europa, obligada a improvisar decisiones trascendentales para una desarrollar una política de Defensa almargen del aliado americano.', 'La fecha del artículo es: 1741734000.0 El PSOE confía en que la vicepresidenta mantenga las costuras de Sumar y no ponga en peligro los compromisos con Europa y la OTAN Está por definir el grado que alcanza, pero en el Gobierno se ha abierto una disputa, refriega, gresca... a cuenta del aumento del gasto en Defensa al que está obligado España y sobre el que presionan, para que se haga de manera pronta, tanto laComisión Europeacomo laOTAN.', 'La fecha del artículo es: 1741561200.0 Los presidentes de laComisión Europeay elConsejo Europeoredoblarán su apuesta por un refuerzo del gasto en defensa para apoyar a Kiev, pocos días después del anuncio de la suspensión de la ayuda militar estadounidense al país invadido por Rusia.', 'La fecha del artículo es: 1741820400.0 El líder del PP apremiará al presidente del Gobierno a cumplir los compromisos con la Alianza Atlántica y afeará la insistencia en la deuda mancomunada: ""No va a ocurrir"" Pedro Sánchezrecibe este jueves aAlberto Núñez Feijóoen el Palacio de La Moncloa para informarle sobre los acuerdos del Consejo Europeo en materia de defensa, pero sin visos de una entente a corto plazo sobre el enorme incremento del gasto militar que debe acometer España.', 'La fecha del artículo es: 1741820400.0 Mientras el presidentePedro Sánchezconsensúa con el resto de fuerzas parlamentarias cómo reforzar las inversiones en Defensa, el PNV aboga por impulsar este sector estratégico con el argumento de que Euskadi es una ""nación"" europea que debe asegurar la protección de Europa.', 'La fecha del artículo es: 1741647600.0 Según el comunicado, Sumar aboga por ""avanzar en soberanía europea para ir superando la dependencia en esta materia de la OTAN y de EEUU y de su complejo militar e industrial"".', 'La fecha del artículo es: 1741215600.0 El presidente húngaro no quiere ni oír hablar del envío de más ayuda militar a Ucrania y, como uno de los grandes seguidores de Trump en el continente europeo, se mostró partidario de que la Unión Europea se quede al margen del conflicto bélico y se encomiende a las negociaciones de paz que quiere abrir el presidente estadounidense, que está presionando a Ucrania retirándole la ayuda militar y la inteligencia.', 'La fecha del artículo es: 1741647600.0 Frente a los eurodiputados, ha defendido su plan de rearme, que recibió el aval de los líderes europeos en la cumbre extraordinaria del pasado jueves.']","['El presidente del Gobierno quiere jugar un papel importante en la nueva Unión Europea','un escenario inédito en Europa, obligada a improvisar decisiones trascendentales para una desarrollar una política de Defensa almargen del aliado americano.']",0.9,0.9,0.9,Sí,1.0,0.7372355571026834,0.8,0.95,0.9,"Sí

La respuesta proporcionada es fiel al contexto dado, ya que toma en cuenta:

1. La necesidad de la UE de organizar su propia política de defensa debido a las acciones de Trump.
2. El deseo del presidente del Gobierno español de jugar un papel importante en esta situación.
3. La importancia de reforzar el gasto militar para proteger a Europa.

Sin embargo, la respuesta podría haber sido más concisa y directamente basada en el contexto proporcionado, pero no contiene información incorrecta o imprecisión."
Dame información sobre el submarino S-81 Isaac Peral,El submarino S-81 Isaac Peral es un submarino de la clase S-80 operado por la Armada Española y fue el primero en ser entregado a la armada.,"El submarino S-81 Isaac Peral es un submarino de última generación de la Armada española, el primero de la clase S-80, construido en España con tecnología avanzada. España se encuentra entre los diez países con capacidad para diseñar y construir submarinos. Este submarino está equipado con modernos sistemas de control, capacidad de lanzar misiles y torpedos, y se espera que entre en plena operatividad pronto.","['La fecha del artículo es: 1739487600.0 Sala de mando y control del submarino S81 Isaac Peral de la Armada.', 'La fecha del artículo es: 1739487600.0 Escalera de subida desde el interior del submarino S81 Isaac Peral a la escotilla.', 'La fecha del artículo es: 1739487600.0 Submarino S81 Isaac Peral de la Armada española.', 'La fecha del artículo es: 1740092400.0 El submarino S-81 Isaac Peral de la Armada española, en plena navegaciónMinisterio de Defensa  21/02/2025Actualizada  04:30 El submarino S-81 Isaac Peral de la Armada española, el primero de la nueva clase S-80, está listo para entrar en «alta disponibilidad», según ha informado el Ministerio de Defensa.', 'La fecha del artículo es: 1739574000.0 La Armada quiere introducir al S-81 Isaac Peral en uno de losdespliegues que el LHD Juan Carlos I y su grupo de combate Dédalo van a realizar en el Mar Mediterráneodurante este año.', 'La fecha del artículo es: 1739487600.0 El Isaac Peral ultima el periodo de evaluación y certificación para que en pocas semanas pase a Alta Disponibilidad y empiece a realizar misiones El acceso principal al submarinoS-81 Isaac Perales una escotilla situada en la proa del barco.', 'La fecha del artículo es: 1739487600.0 El S81 Isaac Peral es el primer submarino de la clase S80 con el que cuenta la Armada.', 'La fecha del artículo es: 1739487600.0 Los marineros del submarino S81 Isaac Peral de la Armada comparten camarotes mixtos con seis literas.']","['Escalera de subida desde el interior del submarino S81 Isaac Peral a la escotilla.','El submarino S-81 Isaac Peral de la Armada española, el primero de la nueva clase S-80, está listo para entrar en «alta disponibilidad»','Como esta unidad no lo lleva todavía (no se montará de serie hasta el S83), lleva unos pesos en los laterales para compensar la ausencia de ese sistema y que no afecte a la estabilidad del submarino.']",0.95,0.95,0.9,Sí,0.6666666666666666,0.896796648472896,0.8,0.8,0.9,"Sí

Esta respuesta parece ser fiel al contexto proporcionado, ya que:

1. Se menciona que el submarino S-81 Isaac Peral pertenece a la clase S-80.
2. Se indica que es el primero de esta clase entregado a la Armada Española.

Sin embargo, hay un pequeño detalle que no se refleja en la respuesta dada: la fecha 1739487600.0 aparece repetida varias veces en diferentes frases del contexto, lo cual podría ser una anotación interna o un error de formato y no afecta al contenido informativo sobre el submarino S-81 Isaac Peral.

Por lo demás, la respuesta es precisa según los datos proporcionados en el contexto."
¿Qué ha anunciado Suecia con respecto a sus planes de enviar recursos a Ucrania?,Suecia anunció que enviará otros 18 sistemas avanzados de artillería Archer y cinco sistemas de radar contra-batería ARTHUR a Ucrania.,Suecia ha anunciado sus planes de enviar 18 avanzados sistemas de artillería Archer y cinco sistemas de radar contra-batería ARTHUR a Ucrania. Esta decisión marca una escalada significativa en la ayuda militar sueca a Kiev en medio del conflicto con Rusia. Se espera que las entregas comiencen en 2026 para los Archer y en 2025 para los radares.,"['La fecha del artículo es: 1741906800.0 Esta decisión, anunciada en el día de hoy, marca una escalada significativa en la ayuda militar de Suecia a Ucrania, destinada a reforzar la capacidad del país para contrarrestar el fuego de artillería ruso.', 'La fecha del artículo es: 1741906800.0 La decisión de Suecia de proporcionar esta ayuda refleja una tendencia más amplia de apoyo occidental a Ucrania, aunque viene acompañada de consideraciones internas.', 'La fecha del artículo es: 1734303600.0 El objetivo de este observatorio escuantificar la ayuda real que están recibiendolos ucranianos, que unas veces es anunciada de forma individual por los países aliados, en otras son las instituciones que la financian las que la hacen pública y, en otras ocasiones, es el propioGobierno deUcraniael que confirma su recepción sin que haya mediado anuncio previo por parte del país u organismo que la hace efectiva.', 'La fecha del artículo es: 1741906800.0 La donación de 18 más a Ucrania dejará a Suecia con 24 en servicio activo, un equilibrio que, según los oficiales, mantiene la seguridad nacional al tiempo que ayuda a un aliado.', 'La fecha del artículo es: 1741906800.0 La medida subraya el compromiso de Suecia de mejorar las capacidades defensivas de Ucrania en una guerra que se ha prolongado hasta su tercer año, destacando un esfuerzo internacional más amplio para proporcionar a Kiev armamento sofisticado.', 'La fecha del artículo es: 1741906800.0 La decisión de enviar estos ocho primeros obuses se tomó tras meses de deliberaciones en Estocolmo, en las que el ministro de Defensa sueco, Pål Jonson, destacó su importancia para la movilidad y precisión de Ucrania en el campo de batalla.', 'La fecha del artículo es: 1729634400.0 ""TenemoscontratosconUcrania, pero también con países que compran equipamiento para luego ponerlo a disposición de Ucrania"", ha explicado Sourisse, que también ha destacado que otra parte de ese armamento fabricado en los dos últimos años ha ido a parar a cubrir lasnuevasnecesidadesdelospaíseseuropeos.', 'La fecha del artículo es: 1741906800.0 Suecia ha anunciado sus planes de enviar otros 18 sistemas avanzados de artillería Archer a Ucrania, junto con cinco sistemas de radar contra-batería ARTHUR, como parte de su apoyo continuado a Kiev en medio del conflicto con Rusia.']","['Esta decisión, anunciada en el día de hoy, marca una escalada significativa en la ayuda militar de Suecia a Ucrania','La decisión de Suecia de proporcionar esta ayuda refleja una tendencia más amplia de apoyo occidental a Ucrania','La donación de 18 más a Ucrania dejará a Suecia con 24 en servicio activo, un equilibrio que, según los oficiales, mantiene la seguridad nacional al tiempo que ayuda a un aliado.']",0.8,0.7,0.9,Sí,1.0,0.928039192912171,0.8,0.8,0.9,"Sí

La respuesta proporcionada es fiel al contexto dado, ya que refleja correctamente los detalles importantes:

1. Suecia anunció el envío de otros 18 sistemas avanzados de artillería Archer a Ucrania.
2. Se mencionan también cinco sistemas de radar contra-batería ARTHUR.
3. Esto se da en el contexto del apoyo continuado a Ucrania durante el conflicto con Rusia.

Esta información coincide perfectamente con los puntos clave presentados en el contexto proporcionado, por lo que la respuesta es correcta y fiel al mismo."
