user_input,response,reference,retrieved_contexts,reference_context,precision_mistral,recall_mistral,factual_correctness_mistral,faithfulness_mistral,real_recall,similarity,precision_qwen2.5,recall_qwen2.5,factual_correctness_qwen2.5,faithfulness_qwen2.5
Que grupos contribuyen a la aparición de una ciberguerra por parte de Rusia,"En un artículo de 2023 elaborado por el Centro Criptológico Nacional (CCN-CERT), se menciona que siete grupos de ciberguerra rusos operan contra Ucrania. Estos grupos están asociados al Servicio Federal de Seguridad (FSB) ruso y son considerados como algunos de los más sofisticados. El artículo también señala que la guerra en Ucrania ha tenido un profundo impacto en las operaciones del ciberespacio, no solo por las campañas involucradas directamente en el conflicto, sino también por la utilización de la temática en numerosas campañas de phishing.","El Centro Criptológico Nacional (CCN-CERT) señala una creciente hostilidad en el ciberespacio por parte de grupos prorrusos. Se han detectado grupos como Sandworm (Unidad 74455 del GRU), APT28 (Fancy Bear, Unidad 26165 del GRU), Gamaredon (unidad 64829 del FSB), APT29 (asociado al SVR ruso) y Turla (asociado al FSB ruso) involucrados en ciberguerra. Estos grupos han llevado a cabo acciones que van desde ciberataques destructivos y espionaje hasta operaciones de influencia contra Ucrania.","['La fecha del artículo es: 1699830000.0 El Centro Criptológico Nacional señala siete grupos de ciberguerra rusos operan contra UcraniaKindelán  Madrid13/11/2023Actualizada  12:02 ElCentro Criptológico Nacional (CCN-CERT)ha elaborado un extenso y detallado informe denominado«Ciberamenzas y tendencias», que en su edición de 2023 efectúa un profundo análisis de las ciberamenazas nacionales e internacionales, marcadas en gran medida por la guerra enUcraniaa raíz de la invasión por parte deRusia.', 'La fecha del artículo es: 1699830000.0 Ciberataque, foto de archivoAFP  Este grupo, asociado al Servicio Federal de Seguridad (FSB) ruso, es considerado como uno de los más sofisticados.', 'La fecha del artículo es: 1699830000.0 Asimismo, apunta a que la citada invasión rusa «ha tenido un profundo impacto en las operaciones del ciberespacio, no solo por las campañas involucradas directamente en el conflicto, sino también por la utilización de la temática en numerosas campañas de phishing».', 'La fecha del artículo es: 1699830000.0 Todo apunta, según el CCN, a que se trata de launidad dedicada al ciberespaciocomo dominio de las operaciones combinadas rusas.', 'La fecha del artículo es: 1735426800.0 Muchos expertos lo consideran un polvorín, con un incremento sostenido de las provocaciones rusas en los últimos meses.  ', 'La fecha del artículo es: 1741388400.0 Cada uno asumirá un «trozo» de esa seguridad colectiva ante la «amenaza existencial» que representa la agresión de Rusia sobre Ucrania y el giro de Estados Unidos con respecto a esta guerra desde el regreso de Donald Trump a la Casa Blanca.', 'La fecha del artículo es: 1740351600.0 Se trata de dartierras a Rusia a cambio de la paz.', 'La fecha del artículo es: 1742079600.0 Explicó que en Rusia los líderes de inteligencia han terminadodibujando escenarios ficticios para evitar represalias, lo que llevó a la falsa creencia de que el «supuesto segundo Ejército del mundo» podría conquistar Ucrania fácilmente.']","['El Centro Criptológico Nacional señala siete grupos de ciberguerra rusos operan contra UcraniaKindelán','En este sentido, el informe reseña una «creciente hostilidaden el campo del ciberespacio por parte degrupos prorrusos»','Asimismo, apunta a que la citada invasión rusa «ha tenido un profundo impacto en las operaciones del ciberespacio, no solo por las campañas involucradas directamente en el conflicto, sino también por la utilización de la temática en numerosas campañas de phishing».']",0.8,0.85,0.9,Sí,0.6666666666666666,0.7054326474879484,0.8,0.8,0.85,"Sí

La respuesta proporcionada parece ser fiel al contexto dado, ya que menciona correctamente:

1. Que siete grupos de ciberguerra rusos operan contra Ucrania.
2. Que estos grupos están asociados con el FSB ruso y son considerados como uno de los más sofisticados.
3. Que la guerra en Ucrania ha tenido un impacto en las operaciones del ciberespacio, incluyendo campañas de phishing.

Aunque hay información adicional en el contexto que no se refleja en la respuesta dada (como la fecha específica y otros detalles sobre expertos y escenarios ficticios), la respuesta mantiene una consistencia con los aspectos principales del informe citado."
Que es ElEscuadrón de Zapadores Paracaidistas (EZAPAC),"El Escuadrón de Zapadores Paracaidistas (EZAPAC) es la unidad de élite por excelencia del Ejército del Aire y el Espacio, encargado de liderar y coordinar operaciones especiales y misiones tácticas paracaidistas. Es una unidad altamente capacitada en el uso del paracaidismo como método de inserción en escenarios de alta exigencia y ha demostrado su preparación operativa en ejercicios como el SAO C, donde han participado unidades de Operaciones Especiales. Además, el EZAPAC cuenta con un entrenamiento especializado para sus para-rescatadores (PJ) en lanzamientos al agua junto con embarcaciones, simulando misiones de rescate de pilotos en caso de eyección o emergencia en alta mar.","El Escuadrón de Zapadores Paracaidistas (EZAPAC) es la unidad de élite por excelencia del Ejército del Aire y del Espacio, certificada por la OTAN para misiones de máxima dificultad. Ubicada en la base aérea de Alcantarilla (Murcia), está adiestrada para misiones de alto riesgo y recientemente ha incorporado el micro-UAV Black Hornet 3 para inteligencia. Su curso de ingreso es uno de los más exigentes de las Fuerzas Armadas.","['La fecha del artículo es: 1741734000.0 Escuadrón de Zapadores Paracaidistas (EZAPAC) ha liderado el ejercicio SAO C del Ejército del Aire y del EspacioEjercito del Aire y del Espacio  12/03/2025Actualizada  04:30 ElEscuadrón de Zapadores Paracaidistas (EZAPAC)ha concluido con éxito elejercicio SAO C, un intenso programa de entrenamiento paracaidista táctico que se desarrolló del 10 al 28 de febrero, según ha informado elEjército del Aire y del Espacio.', 'La fecha del artículo es: 1740178800.0 ElEscuadrón de Zapadores Paracidistas(EZAPAC) es la unidad de élite por excelencia del Ejército del Aire y el Espacio.', 'La fecha del artículo es: 1741734000.0 El EZAPAC ha liderado el entrenamiento táctico paracaidista de unidades de Operaciones EspecialesEjército del Aire y del Espacio  El Ejército del Aire ha subrayado que el ejercicio SAO C ha reforzado la preparación operativa de las unidades participantes, «consolidando al EZAPAC como una de las unidades de élite más capacitadas a nivel nacional e internacional en el uso del paracaidismo como método deinserciónen escenarios de alta exigencia».', 'La fecha del artículo es: 1738364400.0 Una de las unidades más recientes en experimentarlos e incorporarlos ha sido elEscuadrón de Zapadores Paracaidistas (EZAPAC)del Ejército del Aire y del Espacio, la unidad de operaciones especiales de esta institución.', 'La fecha del artículo es: 1738364400.0 La EZAPAC es una unidad de élite del Ejército del Aire localizada en labase aérea de Alcantarilla(Murcia) y adiestrada para las misiones más arriesgadas comogolpes de mano,neutralización de objetivos,rescate de pilotos en territorio hostil,ataques aéreos a tierra, y combate en áreas densamente pobladas.', 'La fecha del artículo es: 1740178800.0 Prueba de adaptación al medio acuático de aspirantes a boinas verdes del Ejército del Aire y del EspacioEjército del Aire y del Espacio  22/02/2025Actualizada  04:30 Marchas forzadas con cargas pesadas; fase de adaptación al medio acuático; saltos en paracaídas; prácticas de desarrollo del combatiente, incluidas maniobras nocturnas; exigentes ejercicios de tiro... son solo algunas de las durísimas pruebas que conlleva el riguroso proceso de selección y formación delEscuadrón de Zapadores Paracaidistas(EZAPAC),unidad de élitedel Ejército del Aire y del Espacio.', 'La fecha del artículo es: 1741734000.0 El EZAPAC también realizó un entrenamiento especializado para sus para-rescatadores (PJ), conlanzamientos al aguajunto con embarcaciones, simulando misiones derescate de pilotosen caso de eyección o emergencia en alta mar.', 'La fecha del artículo es: 1716588000.0 EFE   25/05/2024Actualizada  17:02 El salto en paracaídas de dos miembros de la patrulla acrobática del Ejército del Aire con la bandera de España ha sido uno de los momentosmás emocionantesy esperados del desfile por el Día de las Fuerzas Armadas en Oviedo este sábado.']","['ElEscuadrón de Zapadores Paracidistas(EZAPAC) es la unidad de élite por excelencia del Ejército del Aire y el Espacio.','Marchas forzadas con cargas pesadas; fase de adaptación al medio acuático; saltos en paracaídas; prácticas de desarrollo del combatiente, incluidas maniobras nocturnas; exigentes ejercicios de tiro... son solo algunas de las durísimas pruebas que conlleva el riguroso proceso de selección y formación delEscuadrón de Zapadores Paracaidistas(EZAPAC)']",0.8,0.7,0.9,Sí,1.0,0.9137270855122188,0.8,0.8,0.9,"Sí

La respuesta proporcionada es fiel al contexto dado, mencionando correctamente:
- Quién es el Escuadrón de Zapadores Paracaidistas (EZAPAC)
- Que es la unidad de élite del Ejército del Aire y el Espacio
- Su capacidad en operaciones especiales paracaidistas
- Su participación en ejercicios como SAO C
- El entrenamiento especializado para sus para-rescatadores

Todos estos puntos se corresponden con la información proporcionada en el contexto."
¿Qué es el Q-SLAM-40?,"Q-SLAM-40 es un sistema dron merodeador desarrollado por una empresa española, Arquimea. Es operable en entornos sin GPS en modo de vuelo pilotado y tiene un solo uso y es el más ligero del mercado.","El Q-SLAM-40 es un sistema dron merodeador desarrollado por la empresa española Arquimea. Está diseñado para operaciones de corto alcance de protección, vigilancia, reconocimiento o evaluación de daños. Una de sus ventajas es la rapidez de su despliegue y su difícil detección debido a su pequeño tamaño y silencioso motor.","['La fecha del artículo es: 1735858800.0 Q-SLAM-40 es un sistema dron merodeador desarrollado por una empresa española, ArquimeaKindelán  Fuerzas Armadas 03/01/2025Actualizada  04:30 Q-SLAM-40es un sistemadron merodeadordesarrollado por una empresa española, Arquimea.', 'La fecha del artículo es: 1735858800.0 Así es Q-SLAM-40, el dron merodeador que fabrica EspañaKindelán  Una de sus ventajas es larapidez de su despliegue.', 'La fecha del artículo es: 1735858800.0 Armada española Adolfo Garrido Q-SLAM-40 es operable en un entornosin GPSen modo de vuelo pilotado.', 'La fecha del artículo es: 1736722800.0 De un solo uso y el más ligero del mercado, el C-90 es un desarrollo propio presentado en 1983 para destruir carros de combate y objetivos reforzados (bunkers, etc.) que se ha mantenido actualizado por la constante inversión en I+D de la empresa.', 'La fecha del artículo es: 1737673200.0 Bajo el mar, la apuesta está en lossubmarinos S-80, que montaNavantia.', 'La fecha del artículo es: 1737327600.0 Un A400M delAla 31ha llevado a cabo, por primera vez, un ejercicio de lanzamiento de bengalas sobre el polígono de tiro deBardenas Reales.', 'La fecha del artículo es: 1737327600.0 Un A400M del Ala 31 ha llevado a cabo, por primera vez, un ejercicio de lanzamiento de bengalas sobre el polígono de tiro de Bardenas RealesEjército del Aire y del Espacio  20/01/2025Actualizada  14:15 El A400M es un gigante del aire, un avión de transporte militar turbohélice de cuatro motores que se ha convertido en una pieza clave para el Ejército del Aire y del Espacio.', 'La fecha del artículo es: 1737673200.0 El primero es el de la adquisición de 25Eurofighterpara sustituir losF-18, que alcanzarán su vida útil en 2035.']","['Q-SLAM-40 es un sistema dron merodeador desarrollado por una empresa española,','Q-SLAM-40 es operable en un entornosin GPSen modo de vuelo pilotado.']",0.8,0.65,0.9,Sí,1.0,0.9261435282755204,0.8,0.8,0.8,"No.

La respuesta proporcionada contiene elementos correctos pero también incluye información que no se encuentra en el contexto dado, lo cual hace que no sea completamente fiel a la información proporcionada. Específicamente:

1. La parte sobre ""Es operable en entornos sin GPS en modo de vuelo pilotado"" y ""tiene un solo uso y es el más ligero del mercado"" se refiere al C-90, no a Q-SLAM-40.

2. La información correcta debería ser que Q-SLAM-40 tiene una ventaja en la rapidez de su despliegue, como se menciona en el contexto proporcionado.

3. Se ha mezclado información relevante del C-90 con Q-SLAM-40, lo cual no es preciso.

Una respuesta más fiel al contexto sería:

""Q-SLAM-40 es un sistema dron merodeador desarrollado por una empresa española, Arquimea. La ventaja principal de este sistema es la rapidez de su despliegue."""
