user_input,response,reference,retrieved_contexts,reference_context,precision_mistral,recall_mistral,factual_correctness_mistral,faithfulness_mistral,real_recall,similarity,precision_qwen2.5,recall_qwen2.5,factual_correctness_qwen2.5,faithfulness_qwen2.5
Que modelo quiere el ejercito del aire para sustituir a los F18,"En el artículo se menciona un programa llamado ""Avión sustituto del AV-8B y C-15M"" que busca reemplazar los aviones Harrier AV-8B de la Armada y los cazas F18 del Ejército del Aire y el Espacio. Sin embargo, no se especifica cuál es el modelo exacto deseado por el ejército para sustituir a estos aviones.","El Ejército del Aire está considerando el F35 como una opción para sustituir a parte de sus cazas F18, pero también está abierto a otras opciones como el Dassault Rafale francés o el KF-21 Boramae surcoreano. El Ejército del Aire busca un avión que cumpla con las características necesarias para sustituir a los F18, y también está explorando opciones de entrenadores avanzados. El Jefe del Estado Mayor del Aire (JEMA) ha declarado que la situación estaría controlada hasta casi el 2035 con los programas de adquisición ya en marcha.","['La fecha del artículo es: 1733180400.0 Para el resto de esas unidades por sustituir, existe un programa denominado ""Avión sustituto del AV-8B y C-15M"", es decir, para sustituir a los cazas Harrier AV-8B de la Armada y al resto de cazas F18 del Ejército del Aire y el Espacio, con una bolsa económica asociada de 6.500 millones.', 'La fecha del artículo es: 1733180400.0 Loscazas F18del Ejército del Aire y el Espacio empiezan a atisbar el final de su vida operativo y, como es lógico, se ha comenzado a diseñar el plan demodernización del ala de combate.', 'La fecha del artículo es: 1734649200.0 Para el resto de esas unidades por sustituir, existe un programa dentro del departamento de Margarita Robles denominado ""Avión sustituto del AV-8B y C-15M"", es decir, para sustituir a los cazas Harrier AV-8B de la Armada y al resto de cazas F18 del Ejército del Aire y el Espacio.', 'La fecha del artículo es: 1741474800.0 HürjetKindelán  HürjetKindelán  La respuesta reside en que desde el Ejército del Aire y del Espacio se ve al avión de entrenamiento Hürjet bien posicionado para sustituir a losNorthrop/CASA F-5M, que opera laEscuela de Caza y Ataqueen Talavera la Real (Badajoz).', 'La fecha del artículo es: 1733958000.0 Hace menos de diez días, durante un encuentro con medios de comunicación, el mismo en el que se avanzó que elEjército del Aire contempla opciones más allá del F-35 para sustituir a una parte de sus cazas F18, el Jefe del Estado Mayor del Aire (JEMA), general del Aire Francisco Braco, ya avanzó que la hipótesis principal de la investigación del accidente se estaba centrando en un colisión frontal con un ave de grandes dimensiones.', 'La fecha del artículo es: 1741474800.0 Ejército del Aire Alonso Palacios|Infografía: Kindelán Tal y como informó El Debate, los planes del Ejército del Aire es dar de baja los F-5BM biplaza alrededor del año 2030 cuando debería estar plenamente operativo y en servicio su sustituto.', 'La fecha del artículo es: 1734735600.0 Es por ello que los responsables del Ejército del Aire y el Espacio llevan tiemposondeando el mercado para ver qué aeronave podría sustituira estos F5 Northrop, una vez que quedó descartada la posibilidad de diseñar un nuevo avión desde cero por falta de tiempo.', 'La fecha del artículo es: 1735426800.0 Sin embargo, algunos expertos afirman que el Ejército del Aire español necesitaríaal menos 24 unidadesdel Hürjet para sustituir a los F-5 (AE-9 designación española), de los que la española CASA -posteriormente integrada dentro de Airbus- llegó a fabricar bajo licencia 70 unidades, modernizándolos después a laversión F-5BM.']
","['Este martes, el Ejército del Aire se ha abierto a buscar una opción más allá del caza estadounidense.','Ante esta situación, el Gobierno puede optar por tres opciones.','Para el resto de esas unidades por sustituir, existe un programa dentro del departamento de Margarita Robles denominado ""Avión sustituto del AV-8B y C-15M"", es decir, para sustituir a los cazas Harrier AV-8B de la Armada y al resto de cazas F18 del Ejército del Aire y el Espacio.']",0.8,0.75,0.9,Sí,0.3333333333333333,0.7234568692052762,0.8,0.8,0.8,"No

Explicación:

La respuesta original no es completamente fiel al contexto proporcionado, ya que omite ciertos detalles importantes. Menciona el programa ""Avión sustituto del AV-8B y C-15M"", pero no menciona que este programa tiene una asociada bolsa económica de 6.500 millones ni que abarca tanto a los Harrier como a los F18.

Además, la respuesta original también omite información relevante sobre el Hürjet Kindelán y sus planes para sustituir a los F-5M en la Escuela de Caza y Ataque. 

Por lo tanto, aunque la respuesta contiene parte de la información correcta, no es completamente fiel al contexto completo proporcionado."
Qué relación tiene Andalucía con los proyectos de defensa,"Andalucía está desempeñando un papel estratégico en el presente y futuro de la industria de defensa a nivel nacional y europeo. La región cuenta con un importante peso en este sector, ya que el 30% de la facturación agregada se encuentra en Andalucía. Además, dispone de centros tecnológicos y activos industriales como Airbus, Indra o AirTech.","Andalucía tiene un papel fundamental en la industria de defensa, tanto a nivel nacional como europeo. La región busca participar en todos los proyectos clave del sector y cuenta con instalaciones industriales y tecnológicas, además de una sólida red de empresas que contribuyen al desarrollo de sistemas innovadores para la defensa. La Junta de Andalucía está comprometida con el crecimiento de la industria de defensa como motor económico y tecnológico.","['La fecha del artículo es: 1733266800.0 El papel de Andalucía en el ámbito de la defensa no es nuevo, pero sus esfuerzos porliderar en este sector estratégicocobran especial relevancia en el contexto actual.', 'La fecha del artículo es: 1733266800.0 ""Andalucía quiere estar en todos los proyectos clave"", señaló, remarcando el compromiso de la Junta de Andalucía con el crecimiento de la industria de defensa como motor económico y tecnológico.', 'La fecha del artículo es: 1733266800.0 El consejero de Industria, Energía y Minas de la Junta de Andalucía, Jorge Paradela Gutiérrez, destacó durante el I Foro LiberDefensa el papel fundamental quela región andaluza juega en el presente y futuro de la industria de defensa, tanto a nivel nacional como europeo.', 'La fecha del artículo es: 1733266800.0 ""Andalucía tiene un peso en el presente y el futuro de la industria de defensa a nivel nacional y europeo"", afirmó, poniendo en valor la capacidad estratégica de la comunidad autónoma para participar en los grandes proyectos del sector.', 'La fecha del artículo es: 1733180400.0 Paradelaha comunicado que a pesar de que ""Europa está viviendo un momento de incertidumbre, Andalucía tiene un peso en el presente y el futuro de la industria de defensa a nivel nacional y europeo"",ya que el 30% de la facturación agregada está en Andalucía, además de contar con centros tecnológicos y activos industriales como Airbus, Indra o AirTech.', 'La fecha del artículo es: 1733180400.0 🔴#DIRECTOdel I Foro Liberdefensa: expertos del sector analizan los principales puntos de interés sobre la industria de Defensa en el actual contexto geopolítico y económico.', 'La fecha del artículo es: 1733180400.0 Puntos destacados de la intervención: La dualidad de la tecnología FCAS Acuerdo entre empresas e instituciones Otro de los puntos destacados fue lacreación de la reciente dirección general de la industria de defensa, la inversión en defensa y la importancia del proyecto FCAS, ""un programa de Gobierno, nacional"".', 'La fecha del artículo es: 1733180400.0 El bloque sobre cohesión territorial subraya que, en tiempos de recesión económica, la defensa puede actuar como una herramienta anticíclica, impulsando la actividad económica en diversas regiones y creando empleo estable en sectores clave como la ingeniería y la tecnología, ya que como ha indicado Martínez: ""Genera un empleo de muchísima calidad– ingenieros, técnicos especialistas– y estable"".']
","['El consejero de Industria, Energía y Minas de la Junta de Andalucía, Jorge Paradela Gutiérrez, destacó durante el I Foro LiberDefensa el papel fundamental quela región andaluza juega en el presente y futuro de la industria de defensa, tanto a nivel nacional como europeo.','El papel de Andalucía en el ámbito de la defensa no es nuevo, pero sus esfuerzos porliderar en este sector estratégicocobran especial relevancia en el contexto actual.']",0.95,0.9,0.95,Sí,1.0,0.9186949686848287,0.8,0.85,0.9,"Sí

La respuesta proporcionada es fiel al contexto dado, ya que refleja correctamente los siguientes puntos:

1. El papel estratégico de Andalucía en el sector de la defensa.
2. La intención de liderar y participar en proyectos clave.
3. El 30% de facturación agregada del sector está ubicado en Andalucía.
4. La presencia de centros tecnológicos e industrias relevantes como Airbus, Indra o AirTech.

No hay elementos en la respuesta que no estén respaldados por el contexto dado, y tampoco se incluyen datos incorrectos o innecesarios."
Que problemas tiene ATME con su convenio con Desokupa,"ATME no acepta las presiones del Ministerio de Defensa sobre este asunto y mantiene su convenio con Desokupa, incluso con tribunales de por medio si hace falta.","La Asociación de Tropa y Marinería Española (ATME) tiene un conflicto con el Ministerio de Defensa por un convenio de formación firmado con Desokupa. El Ministerio exige la anulación del acuerdo argumentando falta de legitimidad y nulidad del objeto del convenio, mientras que ATME se niega a ceder ante las presiones y ha contratado un bufete de abogados para defender su postura. ATME argumenta que el convenio se enmarca dentro de sus objetivos y beneficia a sus asociados.","['La fecha del artículo es: 1734562800.0 El departamento deMargarita Roblesemitió este miércoles un comunicadoexigiendo a ATME que anulase de forma inmediata su acuerdo con Desokupa.', 'La fecha del artículo es: 1734562800.0 LaAsociación de Tropa y Marinería Española(ATME), una de las asociaciones profesionales de militares en activo con un mayor número de socios –cerca de los 4.000– y con representación en el Consejo de las Fuerzas Armadas (COPERFAS), ha anunciado este jueves que no admite las presiones del Ministerio de Defensa y que va a mantener su convenio con la mencionada empresa, incluso con tribunales de por medio si hace falta.', 'La fecha del artículo es: 1738796400.0 La misma ha sido anunciada en las últimas horas por laAsociación de Tropa y Marinería Española(ATME), una de las asociaciones profesionales con representación en el Consejo de Personal de lasFuerzas Armadas(COPERFAS) y que está enfrentada con el Ministerio de Defensa a cuenta de su polémico acuerdo de formación con la empresa Desokupa.', 'La fecha del artículo es: 1734476400.0 En un escueto comunicado, el departamento que dirigeMargarita Roblesdice que ""la asesoría jurídica del Ministerio de Defensa ha emitido un informe por el que queda demostrada lanulidad del acuerdo de servicios formativosentre la Asociación de Tropa y Marinería Española (ATME) y Desokupa, por falta de legitimidad de la asociación y por el propio objeto del acuerdo"".', 'La fecha del artículo es: 1734562800.0 ""La asesoría jurídica del Ministerio de Defensa ha emitido un informe por el que queda demostrada lanulidad del acuerdo de servicios formativosentre ATME y Desokupa, por falta de legitimidad de la asociación y por el propio objeto del acuerdo"", decía el comunicado.', 'La fecha del artículo es: 1739833200.0 Tendrán que aprobarlo con elPP», señalan fuentes de la formación abertzale, que en la aprobación de los últimosPresupuestos Generales del Estado(PGE)-en 2022- se abstuvo en la votación de la partida destinada a incrementar el gasto en Defensa junto conERC.', 'La fecha del artículo es: 1734562800.0 ""En el caso que nos ocupa, ATME ha suscrito un convenio con una entidad privada que ofrece una formación a la que puede acceder la totalidad de la ciudadanía, así como anteriormente se han firmado decenas de acuerdos de este tipo.', 'La fecha del artículo es: 1734476400.0 Son precisamente para facilitar económicamente el acceso a estos últimoscursospara lo que laAsociación de Tropa y Marinería Española(ATME), con casi 4.000 afiliados y con representación en el Consejo de Personal de las Fuerzas Armadas (COPERFAS), ha firmado el acuerdo de formación con la empresa.']
","['El departamento deMargarita Roblesemitió este miércoles un comunicadoexigiendo a ATME que anulase de forma inmediata su acuerdo con Desokupa.','""ATME no va a renunciar a ningún acuerdo de los firmadosy que se enmarcan dentro del objeto de esta asociación, dentro de la legalidad, y que redunden en beneficio de sus socios y de la escala de tropa y marinería a la que representa"", mantiene la asociación, que advierte que ""promoverá de forma activa aquellas acciones judiciales que sean pertinentes en respuesta al ataque sufrido a nuestra independencia""']",0.8,0.95,0.9,Sí,0.5,0.7569285661408234,0.8,0.8,0.9,"Sí

La respuesta proporcionada se ajusta correctamente al contexto dado. Se menciona que ATME no acepta las presiones del Ministerio de Defensa y mantiene su convenio con Desokupa, incluso dispuesto a ir a los tribunales si es necesario. Estos puntos son consistentes con la información presentada en el contexto proporcionado."
Que es el proyecto del hub logístico e industrial de Defensa de Aragón,Es un acto para lanzar la creación de un gran 'hub logístico e industrial de Defensa' en Aragón.,"El proyecto del hub logístico e industrial de Defensa en Aragón busca convertir a la región en un centro crucial para la industria de defensa en España. Este proyecto, de carácter público-privado, impulsará un ecosistema del sector en torno a la formación, investigación, emprendimiento, logística, industria e infraestructuras. El Ministerio de Defensa apoya esta iniciativa y se ha comprometido a facilitar la instalación de empresas en la región.","['La fecha del artículo es: 1733871600.0 Un acto para lanzar la creación de ungran ‘hub logístico e industrial de Defensa’ en Aragón.', ""La fecha del artículo es: 1736722800.0 Presentamos recientemente ante elMinisterio de Defensay junto a laDelegación del Gobierno en Aragóny elAyuntamiento de Zaragoza, un proyecto para impulsar un 'hub' de defensa en colaboración con el clúster de aeronáutica y aeroespacial» al entender, dijo, que «Aragón tiene oportunidades por su tradición en materia de defensa» para ser referente en esta materia."", 'La fecha del artículo es: 1733180400.0 #LiberdefensaLD| Jorge Azcón, presidente de Aragón, sobre Zaragoza como punto estratégico.pic.twitter.com/oEzZeVcQUQ La mesa redonda posterior ""La Defensa, eje de crecimiento y empleo"" fue moderada porJavier Arias Borque, periodista yresponsable de Defensa del Grupo Libertad Digital, que analizó cómo ""invertir en industria de defensa no es solo invertir en defensa nacional, sino invertir en riqueza y creación de empleo para nuestro país"", ya que esta industria ofrece un empleo de calidad, por lo que se requiere de una industria adaptada a las nuevas tecnologías que están revolucionando los sistemas militares, así como la necesidad de modernizar y ampliar la capacidad de las Fuerzas Armadas para garantizar la seguridad y competitividad de España dentro de un contexto europeo más tenso.', 'La fecha del artículo es: 1733871600.0 ""Vamos a seguir estrechando el contacto con las industrias, con las empresas que se dedican a fabricar productos de Defensa, para decirles que en Aragón van a tener un sitio idóneo donde poder desarrollar su actividad"", ha explicado Azcón tras su reunión con Robles, y ha puesto como ejemplo a empresas comoInstalaza y Escribano M&E, de las que ha dicho que se les van a ponertodas las facilidades para ampliar sus instalacionesen Zaragoza y Binéfar (Huesca).', 'La fecha del artículo es: 1741215600.0 Armada española | Airbus | Navantia Alonso Palacios|Infografía: Kindelán España contribuye a esta estrategia con unidades enLetonia, Eslovaquiay, ahora, con la Infantería de Marina enRumanía, «demostrando su compromiso con la seguridad colectiva y la defensa del territorio aliado», asegura Defensa.', 'La fecha del artículo es: 1736722800.0 La prueba es el anuncio de que ampliará de forma significativa sus capacidades productivas con la construcción de unanueva fábricaen elantiguo polvorín de Cadrete, una instalación militar situada al noreste de María de Hueva, y al suroeste de laCiudad Deportiva del Real Zaragoza, a unos nueve kilómetros de la capital aragonesa.', 'La fecha del artículo es: 1733871600.0 ElGobierno deAragónquiere aprovechar la fuerte implantación de lasFuerzas Armadasen la región y su situación estratégica en el territorio nacional para convertirse en una ubicación crucial para la industria de Defensa en España.', 'La fecha del artículo es: 1687557600.0 Ejército de Tierra | Ejército del Aire Alonso Palacios Armada española Alonso Palacios|Infografía: Kindelán España también cuenta con el Tigre en sus proyectos estratégicos.']
","['Un acto para lanzar la creación de ungran ‘hub logístico e industrial de Defensa’ en Aragón.','El proyecto aspira a impulsar un ecosistema transversal del sector de la Defensa en la comunidad autónoma, de carácter público-privado, en torno a la formación, investigación, emprendimiento, logística, industria e infraestructuras, contribuyendo a laampliación de la base industrial y tecnológica española de la Defensa y a la de la propia región. Un proyecto que podría generar un importante número de empleo de alta calidad','De hecho, se ha comprometido a visitar en próximas fechas Aragón para, en palabras de Azcón, ""contarle a las industrias de Defensa cuáles son las potencialidades y cuáles son las fortalezas"" de la comunidad.']",0.9,0.8,0.9,Sí,0.3333333333333333,0.8089383186954265,0.8,0.85,0.8,"Sí

La respuesta ""Es un acto para lanzar la creación de un gran 'hub logístico e industrial de Defensa' en Aragón"" es correcta y completamente fiel a la información dada en el contexto proporcionado, ya que se refleja directamente en los datos del artículo con fecha 1733871600.0."
Que ha pasado con los dos buques de guerra rusos que navegaron por aguas cerca de España,"Si hace sólo unas semanas fue lafragata F-83 Numancia la que tuvo que controlar el tránsito de dos buques de guerra rusos por toda la costa española, desde las Islas Baleares hasta la frontera sur con Portugal, ahora le ha tocado el turno a la fragata F-102 Almirante Juan de Borbón.","Una fragata de la Armada Española, la F-102 Almirante Juan de Borbón, controló el tránsito de la fragata ""Almirante Gorshkov"" de la Marina Rusa por la costa norte de España. El control se inició en Pontevedra, tras la misión de un buque portugués, y finalizó cuando una fragata francesa relevó a la española. El destino del buque de reabastecimiento ""Yelnya""no se menciona en los textos.","['La fecha del artículo es: 1741561200.0 Y detrás de ellos,monitorizando y controlandoa ambos buques rusos, ha estado una fragata de la Armada española.', 'La fecha del artículo es: 1734303600.0 El último ejemplo de ello ha tenido lugar en los últimos días, en los que lafragata F-83 Numanciaha estado controlando lanavegación de dos buques de guerra rusosque navegan por aguas próximas a España y a sus áreas de responsabilidad marítima.', 'La fecha del artículo es: 1734562800.0 Si hace sólo unas semanas fue lafragata F-83 Numancia la que tuvo que controlar el tránsito de dos buques de guerra rusos por toda la costa española, desde las Islas Baleares hasta la frontera sur con Portugal, ahora le ha tocado el turno a lafragata F-102 Almirante Juan de Borbón, que ha tenido que controlar eltránsito de una embarcación de la Marina rusa por toda la costa norte española.', 'La fecha del artículo es: 1734562800.0 Fuentes del Estado Mayor de la Defensa han explicado que la embarcación rusa controlada ha sido lafragata ""Almirante Gorshkov"", una de las dos embarcaciones que fueron contraladas en la otra esquina peninsular la pasada semana, pero no han explicado qué ha pasado con elbuque de reabastecimiento ""Yelnya"", la otra de las embarcaciones de la Marina rusa que bordeó la Península por el sur.', 'La fecha del artículo es: 1734303600.0 Esta última, si como todo parece, el destino de los buques rusos es el Mar Báltico, volverá a dar el relevo a una embarcación española a la altura de Galicia.', 'La fecha del artículo es: 1734562800.0 La actividad de los buques de guerra rusos en aguas de responsabilidad española en las últimas semanas está siendo frenética.', 'La fecha del artículo es: 1741561200.0 Defensa Alonso Palacios En los últimos dos años, la presencia de buques de guerra rusos en aguas de interés para España ha experimentado un notable incremento, derivado del conflicto en Ucrania y la reconfiguración de rutas marítimas por parte de la Armada rusa.', 'La fecha del artículo es: 1740178800.0 Armada Alonso Palacios Fuerzas Armadas | Mundo Alfredo Izquierdo Desde el inicio de lainvasión rusa de Ucrania en 2022, el tránsito de buques rusos por el Mediterráneo ha experimentado un aumento significativo.']
","['lafragata F-83 Numancia la que tuvo que controlar el tránsito de dos buques de guerra rusos por toda la costa española','Fuentes del Estado Mayor de la Defensa han explicado que la embarcación rusa controlada ha sido lafragata ""Almirante Gorshkov"", una de las dos embarcaciones que fueron contraladas en la otra esquina peninsular la pasada semana']",0.9,0.85,0.9,Sí,1.0,0.813875284398514,0.8,0.8,0.8,"Sí

La respuesta proporcionada es fiel al contexto dado. Se refiere correctamente a que la fragata F-83 Numancia controló el tránsito de dos buques de guerra rusos por la costa española recientemente, y ahora le ha tocado a la fragata F-102 Almirante Juan de Borbón realizar una misión similar."
