user_input,response,reference,retrieved_contexts,reference_context,precision_mistral,recall_mistral,factual_correctness_mistral,faithfulness_mistral,precision_qwen2.5,recall_qwen2.5,factual_correctness_qwen2.5,faithfulness_qwen2.5,real_recall,similarity
¿Qué ha anunciado Suecia con respecto a sus planes de enviar recursos a Ucrania?,Suecia ha anunciado su plan de enviar 18 sistemas avanzados de artillería Archer y cinco sistemas de radar contra-batería ARTHUR a Ucrania.,Suecia ha anunciado sus planes de enviar 18 avanzados sistemas de artillería Archer y cinco sistemas de radar contra-batería ARTHUR a Ucrania. Esta decisión marca una escalada significativa en la ayuda militar sueca a Kiev en medio del conflicto con Rusia. Se espera que las entregas comiencen en 2026 para los Archer y en 2025 para los radares.,"['La fecha del artículo es: 13/03/2025 Suecia ha anunciado sus planes de enviar otros 18 sistemas avanzados de artillería Archer a Ucrania, junto con cinco sistemas de radar contra-batería ARTHUR, como parte de su apoyo continuado a Kiev en medio del conflicto con Rusia.', 'La fecha del artículo es: 31/03/2025 Suecia ha anunciado su paquete de ayuda militar más sustancial a Ucrania desde que comenzó la invasión a gran escala de Rusia en 2022, prometiendo 1.600 millones de euros para reforzar las capacidades de defensa de Kiev.', 'La fecha del artículo es: 13/03/2025 Esta decisión, anunciada en el día de hoy, marca una escalada significativa en la ayuda militar de Suecia a Ucrania, destinada a reforzar la capacidad del país para contrarrestar el fuego de artillería ruso.', 'La fecha del artículo es: 13/03/2025 La decisión de Suecia de proporcionar esta ayuda refleja una tendencia más amplia de apoyo occidental a Ucrania, aunque viene acompañada de consideraciones internas.', 'La fecha del artículo es: 13/03/2025 La decisión de enviar estos ocho primeros obuses se tomó tras meses de deliberaciones en Estocolmo, en las que el ministro de Defensa sueco, Pål Jonson, destacó su importancia para la movilidad y precisión de Ucrania en el campo de batalla.', 'La fecha del artículo es: 31/03/2025 La decisión de Suecia refleja no solo su creciente alineamiento con la OTAN —tras su ingreso formal en la alianza en marzo de 2024—, sino también su determinación de desempeñar un papel fundamental en el apoyo a Ucrania contra la agresión de Moscú.', 'La fecha del artículo es: 13/03/2025 La medida subraya el compromiso de Suecia de mejorar las capacidades defensivas de Ucrania en una guerra que se ha prolongado hasta su tercer año, destacando un esfuerzo internacional más amplio para proporcionar a Kiev armamento sofisticado.', 'La fecha del artículo es: 13/03/2025 La donación de 18 más a Ucrania dejará a Suecia con 24 en servicio activo, un equilibrio que, según los oficiales, mantiene la seguridad nacional al tiempo que ayuda a un aliado.']
","['Esta decisión, anunciada en el día de hoy, marca una escalada significativa en la ayuda militar de Suecia a Ucrania','La decisión de Suecia de proporcionar esta ayuda refleja una tendencia más amplia de apoyo occidental a Ucrania','La donación de 18 más a Ucrania dejará a Suecia con 24 en servicio activo, un equilibrio que, según los oficiales, mantiene la seguridad nacional al tiempo que ayuda a un aliado.']",0.95,0.85,0.95,Sí,0.8,0.85,0.9,"Sí

La respuesta proporcionada es fiel al contexto dado, ya que menciona correctamente los 18 sistemas avanzados de artillería Archer y los 5 sistemas de radar contra-batería ARTHUR que Suecia ha anunciado para enviar a Ucrania. Además, se refleja la fecha en que esto fue anunciado (13/03/2025).",1.0,0.9507701436961955
Que grupos contribuyen a la aparición de una ciberguerra por parte de Rusia,"Se cree que el grupo asociado al Servicio Federal de Seguridad (FSB) ruso, y otros seis grupos de ciberguerra rusos están implicados en este conflicto. Estos ataques parecen estar dirigidos contra Ucrania como resultado de su invasión por parte de Rusia.","El Centro Criptológico Nacional (CCN-CERT) señala una creciente hostilidad en el ciberespacio por parte de grupos prorrusos. Se han detectado grupos como Sandworm (Unidad 74455 del GRU), APT28 (Fancy Bear, Unidad 26165 del GRU), Gamaredon (unidad 64829 del FSB), APT29 (asociado al SVR ruso) y Turla (asociado al FSB ruso) involucrados en ciberguerra. Estos grupos han llevado a cabo acciones que van desde ciberataques destructivos y espionaje hasta operaciones de influencia contra Ucrania.","['La fecha del artículo es: 12/11/2023 Ciberataque, foto de archivoAFP  Este grupo, asociado al Servicio Federal de Seguridad (FSB) ruso, es considerado como uno de los más sofisticados.', 'La fecha del artículo es: 12/11/2023 El Centro Criptológico Nacional señala siete grupos de ciberguerra rusos operan contra UcraniaKindelán  Madrid13/11/2023Actualizada  12:02 ElCentro Criptológico Nacional (CCN-CERT)ha elaborado un extenso y detallado informe denominado«Ciberamenzas y tendencias», que en su edición de 2023 efectúa un profundo análisis de las ciberamenazas nacionales e internacionales, marcadas en gran medida por la guerra enUcraniaa raíz de la invasión por parte deRusia.', 'La fecha del artículo es: 22/12/2024 Los grupos cibernéticos estatales rusos más conocidos pertenecen a tres agencias de inteligencia rusasKindelán  Madrid23/12/2024Actualizada  04:30 La Federación de Rusia es uno de los «actores» cibernéticos más prolíficos del mundo y dedica importantes recursos a la realización de operaciones cibernéticasa escala global.', 'La fecha del artículo es: 22/12/2024 Así consta en el último informe de «Ciberamenazas y Tendencias 2024», delCentro Criptológico Nacional, que apunta a España como uno de los países más afectados por los ciberataques rusos debido a su apoyo a Ucrania.', 'La fecha del artículo es: 12/11/2023 Asimismo, apunta a que la citada invasión rusa «ha tenido un profundo impacto en las operaciones del ciberespacio, no solo por las campañas involucradas directamente en el conflicto, sino también por la utilización de la temática en numerosas campañas de phishing».', 'La fecha del artículo es: 12/11/2023 Todo apunta, según el CCN, a que se trata de launidad dedicada al ciberespaciocomo dominio de las operaciones combinadas rusas.', 'La fecha del artículo es: 22/12/2024 De acuerdo con investigaciones llevadas a cabo por organismos gubernamentales y entidades privadas, «los actores cibernéticos estatales rusos más conocidos pertenecen a tres agencias de inteligencia rusas»: elServicio Federal de Seguridad de la Federación Rusa(FSB), elServicio de Inteligencia Exterior de la Federación Rusa(SVR) y laDirección General del Estado Mayor de las Fuerzas Armadas de la Federación Rusa(GRU).', 'La fecha del artículo es: 22/12/2024 Sectores víctima de «actores» estatales rusos.']
","['El Centro Criptológico Nacional señala siete grupos de ciberguerra rusos operan contra UcraniaKindelán','En este sentido, el informe reseña una «creciente hostilidaden el campo del ciberespacio por parte degrupos prorrusos»','Asimismo, apunta a que la citada invasión rusa «ha tenido un profundo impacto en las operaciones del ciberespacio, no solo por las campañas involucradas directamente en el conflicto, sino también por la utilización de la temática en numerosas campañas de phishing».']",0.95,0.85,0.9,¡Sí! La respuesta está exacta con respecto a la información dada en el contexto.,0.8,0.85,0.9,"Sí

La respuesta proporcionada es fiel al contexto dado, ya que:

1. Menciona el grupo asociado al Servicio Federal de Seguridad (FSB) ruso.
2. Indica que son siete grupos de ciberguerra rusos los que operan contra Ucrania.
3. Relaciona estas actividades con la invasión rusa a Ucrania.

Estas afirmaciones coinciden con las declaraciones dadas en el contexto, específicamente del artículo del 12/11/2023 y el del 22/12/2024.",0.6666666666666666,0.5948260984034441
Que es ElEscuadrón de Zapadores Paracaidistas (EZAPAC),"El Escuadrón de Zapadores Paracaidistas (EZAPAC) es una unidad de élite del Ejército del Aire y el Espacio, localizada en la base aérea de Alcantarilla (Murcia). Adiestrada para las misiones más arriesgadas como golpes de mano, neutralización de objetivos, rescate de pilotos en territorio hostil, ataques aéreos a tierra y combate en áreas densamente pobladas.","El Escuadrón de Zapadores Paracaidistas (EZAPAC) es la unidad de élite por excelencia del Ejército del Aire y del Espacio, certificada por la OTAN para misiones de máxima dificultad. Ubicada en la base aérea de Alcantarilla (Murcia), está adiestrada para misiones de alto riesgo y recientemente ha incorporado el micro-UAV Black Hornet 3 para inteligencia. Su curso de ingreso es uno de los más exigentes de las Fuerzas Armadas.","['La fecha del artículo es: 21/02/2025 ElEscuadrón de Zapadores Paracidistas(EZAPAC) es la unidad de élite por excelencia del Ejército del Aire y el Espacio.', 'La fecha del artículo es: 11/03/2025 Escuadrón de Zapadores Paracaidistas (EZAPAC) ha liderado el ejercicio SAO C del Ejército del Aire y del EspacioEjercito del Aire y del Espacio  12/03/2025Actualizada  04:30 ElEscuadrón de Zapadores Paracaidistas (EZAPAC)ha concluido con éxito elejercicio SAO C, un intenso programa de entrenamiento paracaidista táctico que se desarrolló del 10 al 28 de febrero, según ha informado elEjército del Aire y del Espacio.', 'La fecha del artículo es: 31/01/2025 Una de las unidades más recientes en experimentarlos e incorporarlos ha sido elEscuadrón de Zapadores Paracaidistas (EZAPAC)del Ejército del Aire y del Espacio, la unidad de operaciones especiales de esta institución.', 'La fecha del artículo es: 21/02/2025 Prueba de adaptación al medio acuático de aspirantes a boinas verdes del Ejército del Aire y del EspacioEjército del Aire y del Espacio  22/02/2025Actualizada  04:30 Marchas forzadas con cargas pesadas; fase de adaptación al medio acuático; saltos en paracaídas; prácticas de desarrollo del combatiente, incluidas maniobras nocturnas; exigentes ejercicios de tiro... son solo algunas de las durísimas pruebas que conlleva el riguroso proceso de selección y formación delEscuadrón de Zapadores Paracaidistas(EZAPAC),unidad de élitedel Ejército del Aire y del Espacio.', 'La fecha del artículo es: 11/03/2025 El EZAPAC ha liderado el entrenamiento táctico paracaidista de unidades de Operaciones EspecialesEjército del Aire y del Espacio  El Ejército del Aire ha subrayado que el ejercicio SAO C ha reforzado la preparación operativa de las unidades participantes, «consolidando al EZAPAC como una de las unidades de élite más capacitadas a nivel nacional e internacional en el uso del paracaidismo como método deinserciónen escenarios de alta exigencia».', 'La fecha del artículo es: 11/03/2025 El EZAPAC también realizó un entrenamiento especializado para sus para-rescatadores (PJ), conlanzamientos al aguajunto con embarcaciones, simulando misiones derescate de pilotosen caso de eyección o emergencia en alta mar.', 'La fecha del artículo es: 31/01/2025 La EZAPAC es una unidad de élite del Ejército del Aire localizada en labase aérea de Alcantarilla(Murcia) y adiestrada para las misiones más arriesgadas comogolpes de mano,neutralización de objetivos,rescate de pilotos en territorio hostil,ataques aéreos a tierra, y combate en áreas densamente pobladas.', 'La fecha del artículo es: 11/10/2024 Vehículo del 2º Grupo de Artillería de Campaña (GACAPAC) del Batallón de Zapadores VI de Paracaidistas (BRIPAC).']
","['ElEscuadrón de Zapadores Paracidistas(EZAPAC) es la unidad de élite por excelencia del Ejército del Aire y el Espacio.','Marchas forzadas con cargas pesadas; fase de adaptación al medio acuático; saltos en paracaídas; prácticas de desarrollo del combatiente, incluidas maniobras nocturnas; exigentes ejercicios de tiro... son solo algunas de las durísimas pruebas que conlleva el riguroso proceso de selección y formación delEscuadrón de Zapadores Paracaidistas(EZAPAC)']",0.95,0.95,0.9,Sí,0.8,0.8,0.9,"Sí

La respuesta proporcionada es fiel al contexto dado, ya que contiene información correcta sobre:

1. La ubicación de la unidad (base aérea de Alcantarilla, Murcia).
2. Las misiones para las que está adiestrada (golpes de mano, neutralización de objetivos, rescate de pilotos en territorio hostil, ataques aéreos a tierra y combate en áreas densamente pobladas).

No obstante, la respuesta podría ser considerada más completa si se incluyera mención al EZAPAC como unidad de élite del Ejército del Aire y el Espacio, y a su participación en ejercicios de paracaidismo táctico, aunque esto no es estrictamente necesario para ser considerada correcta.",1.0,0.9118759912819911
¿Qué es el Q-SLAM-40?,"Es un sistema dron merodeador desarrollado por una empresa española, Arquimea.","El Q-SLAM-40 es un sistema dron merodeador desarrollado por la empresa española Arquimea. Está diseñado para operaciones de corto alcance de protección, vigilancia, reconocimiento o evaluación de daños. Una de sus ventajas es la rapidez de su despliegue y su difícil detección debido a su pequeño tamaño y silencioso motor.","['La fecha del artículo es: 02/01/2025 Q-SLAM-40 es un sistema dron merodeador desarrollado por una empresa española, ArquimeaKindelán  Fuerzas Armadas 03/01/2025Actualizada  04:30 Q-SLAM-40es un sistemadron merodeadordesarrollado por una empresa española, Arquimea.', 'La fecha del artículo es: 02/01/2025 Así es Q-SLAM-40, el dron merodeador que fabrica EspañaKindelán  Una de sus ventajas es larapidez de su despliegue.', 'La fecha del artículo es: 02/01/2025 Armada española Adolfo Garrido Q-SLAM-40 es operable en un entornosin GPSen modo de vuelo pilotado.', 'La fecha del artículo es: 12/01/2025 De un solo uso y el más ligero del mercado, el C-90 es un desarrollo propio presentado en 1983 para destruir carros de combate y objetivos reforzados (bunkers, etc.) que se ha mantenido actualizado por la constante inversión en I+D de la empresa.', 'La fecha del artículo es: 10/01/2025 Encuéntranos en:', 'La fecha del artículo es: 05/01/2025 Encuéntranos en:', 'La fecha del artículo es: 28/01/2025 Encuéntranos en:', 'La fecha del artículo es: 22/01/2025 Encuéntranos en:']
","['Q-SLAM-40 es un sistema dron merodeador desarrollado por una empresa española,','Q-SLAM-40 es operable en un entornosin GPSen modo de vuelo pilotado.']",0.9,0.9,0.9,"¡Sí! La respuesta es completamente fiel al contexto, ya que se ajusta de manera exacta a las características del sistema Q-SLAM-40 descritas en el texto.",0.8,0.8,0.8,"Sí

Esta respuesta se ajusta correctamente al contexto proporcionado, ya que menciona que Q-SLAM-40 es un sistema dron merodeador desarrollado por la empresa española Arquimea. La fecha del artículo dado en el contexto (02/01/2025) coincide con la respuesta dada.",1.0,0.5202514691332965
