user_input,response,reference,retrieved_contexts,reference_context
Que modelo quiere el ejercito del aire para sustituir a los F18,"El Ejército del Aire está considerando diferentes opciones para sustituir a los F-18, incluyendo el F-35, pero también ha abierto la posibilidad de buscar otras opciones como el Dassault Rafaleo o el KF-21 Boramae surcoreano.","El Ejército del Aire está considerando el F35 como una opción para sustituir a parte de sus cazas F18, pero también está abierto a otras opciones como el Dassault Rafale francés o el KF-21 Boramae surcoreano. El Ejército del Aire busca un avión que cumpla con las características necesarias para sustituir a los F18, y también está explorando opciones de entrenadores avanzados. El Jefe del Estado Mayor del Aire (JEMA) ha declarado que la situación estaría controlada hasta casi el 2035 con los programas de adquisición ya en marcha.","['La fecha del articulo es: 1733180400.0 Loscazas F18del Ejército del Aire y el Espacio empiezan a atisbar el final de su vida operativo y, como es lógico, se ha comenzado a diseñar el plan demodernización del ala de combate. Un plan que, de momento, se ha distribuido en tres escalones diferenciados. Dos de ellos ya se encuentran en marcha, pero el tercero permanece todavía en el aire, pese a que hay unprograma de estudio en marcha desde hace al menos dos años. El primero de esos escalones era resolver la situación de los cazas F18 del Ala 46, de la base aérea de Gando (Gran Canaria), comprados de segunda mano a la Marina estadounidense hace varias décadas. Para ello se aprobó en junio de 2022 el denominado programa Halcón, que incluye la compra de 20 cazas Eurofighter Typhoon de la Tranche 4, la versión más moderna o evolucionada que en ese momento en el mercado. El segundo escalón era sustituir a una parte de los cazas F18 que están operativos en la Península (tanto en el Ala 12 de Torrejón de Ardoz como en el Ala 15 de Zaragoza). En septiembre de 2023 se dio luz verde al programa Halcón II, para la compra de otras 25 unidades del caza Eurofighter Typhoon de Tranche o evolución más moderna disponible en el mercado. Pero la compra de estas últimas 25 unidades no son suficientes para reponer los 60 cazas F18 que en estos momentos están prestando en servicio en la Península. Para el resto de esas unidades por sustituir, existe un programa denominado ""Avión sustituto del AV-8B y C-15M"", es decir, para sustituir a los cazas Harrier AV-8B de la Armada y al resto de cazas F18 del Ejército del Aire y el Espacio, con una bolsa económica asociada de 6.500 millones. El único modelo en el mercado que cumple los requisitos es elF35, con sus variantes A (despegue y aterrizaje convencional) y B (despegue y aterrizaje convencional y vertical). No hay tiempo de desarrollar otro avión de esas características, por lo que se debe optar por comprar los F35 para ambos ejércitos, o comprar F35 sólo para la Armada y otra opción para el Aire, o que la Armada renuncie a su ala embarcada y comprar otra aeronave para el Aire. Este martes, el Ejército del Aire se ha abierto a buscar una opción más allá del caza estadounidense. Así lo ha hecho elJefe del Estado Mayor del Aire (JEMA), general del Aire Francisco Braco, durante un desayuno informativo con medios de comunicación, en el que ha recordado que con los programas lanzados en estos momentos la situación estaría controlada hasta casi el año 2035. ""Nosotros en el Ejército del Aire y el Espacio siempre hemos tenido dos flotas de aviones, ¿Por qué? Por si se encuentra un fallo estructural en una de las aeronaves y hay que dejarlas en tierra. ¿Es que Francia o Corea del Sur no están construyendo aviones?"", se ha preguntado, dejando la puerta abierta a que en un futuro se pueda apostar por una evolución del momento delDassault Rafaleo por el caza de quinta generaciónKF-21 Boramaesurcoreano. El JEMA también ha hablado de otro de los programas pendientes, como el que buscasustituto a los actuales cazas F5 Northrop, que cada vez están más cerca de acabar su ciclo de vida operativo, y que se emplean como entrenadores avanzados en la base de Talavera la Real (Badajoz), sirviendo de paso fundamental de formación a los pilotos que posteriormente van a dar el salto a los cazas F18 o el Eurofighter Typhoon. Según ha explicado, la intención del Gobierno es invertir en la industria nacional, pero España sola no puede fabricar un entrenador avanzado. ""El tema depende del retorno. Compramos este entrenador pero ¿a cambio de qué?Estamos en esa fase de ¿y yo qué saco?"", ha dicho el máximo responsable del Aire, que ha vuelto a situar la terna de finalistas en elHurjetde Turquía, elM-346italiano y elT-50surcoreano. El general Braco ha explicado también la cuestión de lasunidades compradas del A400M–se adquirieron 27 unidades para que la planta ensambladora se ubicase en Sevilla pero no se necesitaban, según los cálculos iniciales, más de 14 unidades– ""es un problema que está por encima de mí"", aunque se abrió a la posibilidad de que llegue alguna unidad más. Si cae alguno más, pues bienvenido sea"", ha dicho. El JEMA no ha entrado en detalle sobre la investigación que está llevando a cabo la CITAAM (Comisión para la Investigación Técnica de Accidentes de Aeronaves Militares) sobre eltrágico accidente de un caza F18 a principios del pasado mes de octubre en Teruel, en el que perdió la vida el teniente coronel Pablo Estrada Martín, que estaba destinado en el Ala 12 de Torrejón de Ardoz, pero si ha hablado de los análisis preliminares. Según ha explicado, la principal teoría en la que se está trabajando en estos momentos es que un ave de grandes dimensiones colisionara en vuelo con la aeronave, provocando el catastrófico accidente. Encuéntranos en:', 'La fecha del articulo es: 1735426800.0 Un avión TAI Hürjet que podría sustituir al F-5 españolEl Debate  Ejército del Aire y del Espacio Madrid29/12/2024Actualizada  04:30 Los pilotos de caza españoles del siglo XXI se adiestrarán muy probablemente a los mandos de un avión turco, elTAI Hürjet. Así lo tiene planeado el Gobierno después de varios años de evaluación de distintas opciones internacionales para sustituir a los vetustos F-5, el avión estadounidense en el que se han formado nuestros pilotos militares «Top Gun» durante más de medio siglo. Unos días antes de las vacaciones de Navidad, la secretaria de Estado de Defensa,Amparo Valcárce, firmó unmemorando de entendimientoentre España y Turquía para desarrollar un sistema de entrenamiento avanzado para pilotos de caza. La firma por parte turca la realizó la embajadora de Turquía en España,Nüket Küçükel Ezberci, en nombre de la Secretaría de Industrias de Defensa turca. Según el corto comunicado oficial, el interés de ambos países es avanzar en un programa de desarrollo de un sistema de entrenamiento avanzado y no solo en una mera adquisición, lo que beneficiaría directamente a la industria española. Por el momento, no se han revelado detalles del programa industrial ni las empresas que podrían estar involucradas, así como tampoco el monto económico de la operación. El secretario de Industrias de Defensa turco, Haluk Görgün, resaltó en sus redes sociales que la firma del acuerdo representa un paso histórico y enfatizó «la importancia de la cooperación entre aliados y países amigos», y la «visión común» que comparten ambas naciones. Para la industria aeronáutica turca representa un enorme éxito, ya que constituye elprimer contrato de exportacióndel Hürjet, un aparato todavía en fase de desarrollo, después de la fracasada campaña en Malasia. La adquisición de unsustituto del F-5era una de las prioridades del Ejército del Aire y del Espacio español que llevaba casi una década evaluando distintosaviones de entrenamiento a reacciónante la carencia de una opción de este tipo de la multinacional europea Airbus.  La decisión, estratégica y de repercusiones significativas a largo plazo, enfrenta un doble desafío. Por una parte, mantener la alta calidad de la formación de nuestros pilotos -los más experimentados de que dispone la fuerza aérea española- y, a la vez, reducir los costes de mantenimiento y operación de esta nueva familia de aeronaves. La secretaria de Estado de Defensa, Amparo Valcárcel, con la embajadora de Turquía en España, Nüket Küçükel EzberciEl Debate  Las fuentes oficiales no han ampliado detalles del contrato, que se prevé se firme en elprimer trimestre de 2025. Sin embargo, algunos expertos afirman que el Ejército del Aire español necesitaríaal menos 24 unidadesdel Hürjet para sustituir a los F-5 (AE-9 designación española), de los que la española CASA -posteriormente integrada dentro de Airbus- llegó a fabricar bajo licencia 70 unidades, modernizándolos después a laversión F-5BM. De ellos, solo se encuentran en servicio 19 que operan en la base aérea de Talavera de la Real (Badajoz) encuadrados en elAla 23 (Escuadrón 231)de Escuela de Caza y Ataque. Los planes del Ejército del Aire es dar de baja los F-5BM biplaza alrededor del año2030cuando debería estar plenamente operativo y en servicio su sustituto. Durante 2023, el Consejo de Ministros autorizó más de 87,5 millones para mantener lacapacidad operativa de los F-5entrenadores, incluida la modernización de su aviónica y sostenimiento. La decisión de España de optar por la opción turca, frente a otros competidores estadounidenses (T-7A Red Hawkde Boeing y Saab), italianos (M-346 Masterde Leonardo), o surcoreanos (KT-1de Korean Aerospace Industries), representa un paso estratégico importante para la industria de Defensa española que busca reforzar surelación militar con Ankara-miembro de la OTAN y clave en Oriente Medio -, país que también adquirió en 2023 un portaaviones de diseño español(TCG Andolu), y trabaja en la construcción de un nuevobuque militar anfibioal que concurren los astilleros públicos de Navantia. En un encuentro con periodistas especializados, el jefe del Estado Mayor del Aire (JEMA), general del AireFrancisco Braco, reconoció que llevaban más de seis meses de conversaciones con la parte turca para fijar un importante retorno industrial para las empresas españolas. «En ese punto esta la negociación», recalcó el JEMA. El Ministerio de Defensa se ha limitado a señalar que el proyecto contará con «participación industrial de ambos países» pero según distintas fuentes el acuerdo incluye la posibilidad de ensamblar o fabricar partes en territorio español. Fuentes periodísticas afirman que España propuso como compensación económica que la Fuerza Aérea de Ankara adquiera al menos 6 de los13 aviones de transporte A400Mde los que se quiere deshacer. Asimismo, empresas como Airbus –que al no lograr apoyo financiero tuvo que abandonar su propuesta de nuevo avión de entrenamiento denominado AFJT que presentó en 2020- o Indra podrían jugar un papel crucial en la integración de sistemas, simuladores y en la personalización del avión para adecuarse a las necesidades de nuestro Ejército del Aire. En la actualidad, la compañía sevillana Airtificial, proveedor tradicional de Airbus, ha firmado desde 2023 tres contratos con el fabricante del entrenador turco, Turkish Aerospace Industries (TAI), por valor conjunto de unos 12 millones de euros para la fabricación de distintos componentes. El último, de 2,5 millones, para el suministro de31 «sticks» de vuelopara dos modelos de la Fuerza Aérea turca, el Hürjet y el caza de combate de quinta generación. Otra área de cooperación con la industria española sería el motor. Actualmente utiliza unF404-102 turbofáncon postcombustión de General Electric, de la misma familia que utiliza el F-18 y cuyo mantenimiento en España lo realiza la empresa vasca ITP Aero. El Ejército del Aire español ya ha tenido oportunidad de probar y ver en acción uno de los prototipos del Hürjet, llamado así en homenaje a Vecihi Hürkuş, el as de la aviación de caza turca, ingeniero y pionero de la aviación que construyó el primer avión de Turquía. En julio de este año, el fabricante trasladó un aparato a labase aérea de Torrejón de Ardozpara mostrar sus capacidades. Asimismo, una amplia delegación española ha visitado la fábrica en Ankara donde conoció la evolución del aparato. Diseñado para combate ligero y entrenamiento a reacción con asiento en tándem, el proyecto del Hürjet se inició en 2017 con financiación privada. Al año siguiente, el Gobierno turco firmó un acuerdo con TAI convirtiéndolo en un programa público. En 2022 se aprobó el lote 0 de producción de cuatro unidades, y el 25 de abril del año siguiente, 2023, se realizó el vuelo inaugural. En julio de 2024 su primer vuelo transónico, alcanzando una velocidad deMach 0.9a una altitud de 30.000 pies, y al mes siguiente, agosto, el prototipo realizó con éxito su vuelo número 100, acumulando un total de 118 horas de vuelo. Según los planes de la empresa, cuatro unidades de la Fase 0 serán entregados a finales de 2025 y otros 12 de la Fase 1 en 2028.  La empresa tiene como objetivo fabricar 100 unidades para Turquía y otras 300 más para el mercado internacional para mediados de 2030. En julio de 2024, el Hürjet efectuó su primer vuelo transónico, alcanzando una velocidad de Mach 0.9El Debate  Se prevé que el Hürjet cuente con capacidades que no tiene el F-5 comoreabastecimiento de combustible, fly-by-wire con limitación de parámetros, unidad de potencia auxiliar incorporada, cabina compatible con gafas de visión nocturna, pantalla de visualización frontal y un sistema de visualización integral en el casco. Integrará sistemas de armas avanzados y la posibilidad de incorporar armamento guiado, como misiles aire-aire y aire-tierra, y bombas de precisión, algo que lo diferencia de otros entrenadores de su clase. Las autoridades turcas tienen entre sus planes diseñar, asimismo, una versión naval para utilizar desde portaaviones y portaaeronaves, lo que permitiría, en el caso español, contar con un sustituto de losHarrierde despegue vertical frente al F-35 estadounidense. El caza F-5, fabricado por la empresa estadounidense Northrop en la década de los años 60, ha sido hasta ahora el pilar de entrenamiento avanzado de muchas generaciones de pilotos de caza españoles y que luego pasaron a los mandos de los aviones más avanzados como losF-18y losEurofighters, siendo reconocidos por su pericia y destreza. Temas Crónicas castizas Gustavo Morales Casa Real El Debate Ejército de Tierra Alonso Palacios El Debate El Debate © 2023 eldebate.com']","['Este martes, el Ejército del Aire se ha abierto a buscar una opción más allá del caza estadounidense.','Ante esta situación, el Gobierno puede optar por tres opciones.']"
Qué relación tiene Andalucía con los proyectos de defensa,"Andalucía juega un papel fundamental en el presente y futuro de la industria de defensa, tanto a nivel nacional como europeo, gracias a su capacidad estratégica para participar en grandes proyectos clave. La región cuenta con importantes instalaciones industriales y tecnológicas, así como una sólida red de empresas que contribuyen al desarrollo de sistemas innovadores para la defensa nacional y europea. Andalucía quiere estar en todos los proyectos clave y se compromete a fortalecer su posición como referente en el ámbito de la defensa y la seguridad.","Andalucía tiene un papel fundamental en la industria de defensa, tanto a nivel nacional como europeo. La región busca participar en todos los proyectos clave del sector y cuenta con instalaciones industriales y tecnológicas, además de una sólida red de empresas que contribuyen al desarrollo de sistemas innovadores para la defensa. La Junta de Andalucía está comprometida con el crecimiento de la industria de defensa como motor económico y tecnológico.","['La fecha del articulo es: 1733266800.0 El consejero de Industria, Energía y Minas de la Junta de Andalucía, Jorge Paradela Gutiérrez, destacó durante el I Foro LiberDefensa el papel fundamental quela región andaluza juega en el presente y futuro de la industria de defensa, tanto a nivel nacional como europeo. ""Andalucía tiene un peso en el presente y el futuro de la industria de defensa a nivel nacional y europeo"", afirmó, poniendo en valor la capacidad estratégica de la comunidad autónoma para participar en los grandes proyectos del sector. Paradela subrayó que Europa atraviesaun momento de incertidumbredebido a los cambios geopolíticos y económicos, lo que hace aún más relevante la participación activa de las regiones en iniciativas clave. ""Andalucía quiere estar en todos los proyectos clave"", señaló, remarcando el compromiso de la Junta de Andalucía con el crecimiento de la industria de defensa como motor económico y tecnológico. Durante su intervención, Paradela también abordó uno de los principales desafíos del sector:la escasez de profesionales capacitados para cubrir las necesidades de una industria en pleno crecimiento. ""Todos los sectores dicen que no encuentran gente cualificada"", apuntó, haciendo un llamado a la colaboración entre instituciones y empresas para impulsar la formación especializada que permita cubrir esta demanda. El consejero concluyó su participación destacando la importancia de fortalecer la competitividad de la industria andaluza a través de la innovación, la cooperación internacional y la integración en los grandes proyectos europeos. La Junta de Andalucía, aseguró,seguirá trabajando para consolidar su posición como referente en el ámbito de la defensa y la seguridad. El papel de Andalucía en el ámbito de la defensa no es nuevo, pero sus esfuerzos porliderar en este sector estratégicocobran especial relevancia en el contexto actual. La región alberga importantes instalaciones industriales y tecnológicas, además de contar con una sólida red de empresas que contribuyen al desarrollo de sistemas innovadores para la defensa nacional y europea. Encuéntranos en:', 'La fecha del articulo es: 1734476400.0 ElMinisterio de Defensaquiere anular el convenio de colaboración que ha firmado en las últimas horasuna de las principales asociaciones demilitaresen activo de lasFuerzas Armadascon la empresaDesokupa, especializada en la recuperación de inmuebles okupados de forma ilegal, y que también está expandiendo su mercado con la realización de cursos relacionados con la defensa personal, los primeros auxilios y los guías caninos. Son precisamente para facilitar económicamente el acceso a estos últimoscursospara lo que laAsociación de Tropa y Marinería Española(ATME), con casi 4.000 afiliados y con representación en el Consejo de Personal de las Fuerzas Armadas (COPERFAS), ha firmado el acuerdo de formación con la empresa. Sus asociados se verían beneficiados conun descuento del 50 por ciento del precio, además de teneracceso preferente a posibles ofertas de trabajo. En un escueto comunicado, el departamento que dirigeMargarita Roblesdice que ""la asesoría jurídica del Ministerio de Defensa ha emitido un informe por el que queda demostrada lanulidad del acuerdo de servicios formativosentre la Asociación de Tropa y Marinería Española (ATME) y Desokupa, por falta de legitimidad de la asociación y por el propio objeto del acuerdo"". ""Tras estudiar los extremos del citado convenio de colaboración, se ha acordado requerir, a los firmantes, para la anulación del referido acuerdo procediendo, en caso contrario, a laimpugnación jurisdiccional del mismo y a la apertura del correspondiente expediente"", continúa el texto enviado por Defensa a los medios de comunicación, en el que queda claro que no tendrán problemas en acudir a los tribunales para tratar de anularlo. ATME había firmado este convenio de formación buscando conseguir una mejor reintegración en el mercado laboral civil de los militares de la Escala de Tropa y Marinería que, una vez que no han conseguido dar el salto a la carrera profesional, se ven obligados a abandonar el servicio activo en las Fuerzas Armadas a los 45 años de edad. Un acuerdo más entre los que tiene con otras academias o entidades. Encuéntranos en:']","['El consejero de Industria, Energía y Minas de la Junta de Andalucía, Jorge Paradela Gutiérrez, destacó durante el I Foro LiberDefensa el papel fundamental quela región andaluza juega en el presente y futuro de la industria de defensa, tanto a nivel nacional como europeo.','El papel de Andalucía en el ámbito de la defensa no es nuevo, pero sus esfuerzos porliderar en este sector estratégicocobran especial relevancia en el contexto actual.','Paradela subrayó que Europa atraviesaun momento de incertidumbredebido a los cambios geopolíticos y económicos, lo que hace aún más relevante la participación activa de las regiones en iniciativas clave.']"
Que problemas tiene ATME con su convenio con Desokupa,"La Asociación de Tropa y Marinería Española (ATME) tiene problemas con su convenio con Desokupa debido a la falta de legitimidad de la asociación y por el propio objeto del acuerdo, según informe de asesoría jurídica del Ministerio de Defensa. El Ministerio de Defensa ha requerido la anulación del convenio y, en caso de no cumplirse, ha decidido impugnar el mismo y abrir un expediente.","La Asociación de Tropa y Marinería Española (ATME) tiene un conflicto con el Ministerio de Defensa por un convenio de formación firmado con Desokupa. El Ministerio exige la anulación del acuerdo argumentando falta de legitimidad y nulidad del objeto del convenio, mientras que ATME se niega a ceder ante las presiones y ha contratado un bufete de abogados para defender su postura. ATME argumenta que el convenio se enmarca dentro de sus objetivos y beneficia a sus asociados.","['La fecha del articulo es: 1734476400.0 ElMinisterio de Defensaquiere anular el convenio de colaboración que ha firmado en las últimas horasuna de las principales asociaciones demilitaresen activo de lasFuerzas Armadascon la empresaDesokupa, especializada en la recuperación de inmuebles okupados de forma ilegal, y que también está expandiendo su mercado con la realización de cursos relacionados con la defensa personal, los primeros auxilios y los guías caninos. Son precisamente para facilitar económicamente el acceso a estos últimoscursospara lo que laAsociación de Tropa y Marinería Española(ATME), con casi 4.000 afiliados y con representación en el Consejo de Personal de las Fuerzas Armadas (COPERFAS), ha firmado el acuerdo de formación con la empresa. Sus asociados se verían beneficiados conun descuento del 50 por ciento del precio, además de teneracceso preferente a posibles ofertas de trabajo. En un escueto comunicado, el departamento que dirigeMargarita Roblesdice que ""la asesoría jurídica del Ministerio de Defensa ha emitido un informe por el que queda demostrada lanulidad del acuerdo de servicios formativosentre la Asociación de Tropa y Marinería Española (ATME) y Desokupa, por falta de legitimidad de la asociación y por el propio objeto del acuerdo"". ""Tras estudiar los extremos del citado convenio de colaboración, se ha acordado requerir, a los firmantes, para la anulación del referido acuerdo procediendo, en caso contrario, a laimpugnación jurisdiccional del mismo y a la apertura del correspondiente expediente"", continúa el texto enviado por Defensa a los medios de comunicación, en el que queda claro que no tendrán problemas en acudir a los tribunales para tratar de anularlo. ATME había firmado este convenio de formación buscando conseguir una mejor reintegración en el mercado laboral civil de los militares de la Escala de Tropa y Marinería que, una vez que no han conseguido dar el salto a la carrera profesional, se ven obligados a abandonar el servicio activo en las Fuerzas Armadas a los 45 años de edad. Un acuerdo más entre los que tiene con otras academias o entidades. Encuéntranos en:', 'La fecha del articulo es: 1734562800.0 Lapolémica y la lucha internaparecen servidas en el seno delMinisterio de Defensa. La firma de un convenio de formación de una de las principales asociaciones de militares en activo conDesokupa, la empresa especializada en la recuperación de inmuebles okupados de forma ilegal, y que también realiza cursos de defensa personal, primeros auxilios y guías caninos, podría acabar en los tribunales. LaAsociación de Tropa y Marinería Española(ATME), una de las asociaciones profesionales de militares en activo con un mayor número de socios –cerca de los 4.000– y con representación en el Consejo de las Fuerzas Armadas (COPERFAS), ha anunciado este jueves que no admite las presiones del Ministerio de Defensa y que va a mantener su convenio con la mencionada empresa, incluso con tribunales de por medio si hace falta. El departamento deMargarita Roblesemitió este miércoles un comunicadoexigiendo a ATME que anulase de forma inmediata su acuerdo con Desokupa. ""La asesoría jurídica del Ministerio de Defensa ha emitido un informe por el que queda demostrada lanulidad del acuerdo de servicios formativosentre ATME y Desokupa, por falta de legitimidad de la asociación y por el propio objeto del acuerdo"", decía el comunicado. El mismo amenazaba también con que el Ministerio de Defensa estaba dispuesto a acabar con ese convenio en los tribunales. ""Tras estudiar los extremos del citado convenio de colaboración, se ha acordado requerir, a los firmantes, para la anulación del referido acuerdo procediendo, en caso contrario, a laimpugnación jurisdiccional del mismo y a la apertura del correspondiente expediente"", añadía el departamento de Margarita Robles. La respuesta de ATME a lo que considera una ""ilegítima injerencia"" del Ministerioa su funcionamiento como asociación ha sido contundente: ""El hecho de que nuestra asociación esté compuesta por militares no significa que se encuentre sometida a las órdenes de Defensa.La asociación no cumple órdenes, cumple con su objeto, definido por la normativa citada y sus Estatutos y, por supuesto, cumple con su compromiso de velar por los intereses de sus asociados"". La asociación de militares dice que están ""muy tranquilos"" porque saben que ""el principio de autotutela que reviste al Ministerio no es de aplicación en este convenio"" y se preguntan cómo es posible que la asesoría jurídica del Ministerio de Defensa pueda hacer análisis sobre el mismo ""cuandoni siquiera han tenido acceso al convenio"" ""ATME no va a renunciar a ningún acuerdo de los firmadosy que se enmarcan dentro del objeto de esta asociación, dentro de la legalidad, y que redunden en beneficio de sus socios y de la escala de tropa y marinería a la que representa"", mantiene la asociación, que advierte que ""promoverá de forma activa aquellas acciones judiciales que sean pertinentes en respuesta al ataque sufrido a nuestra independencia"", para lo que ya han contratado al bufete Acuña & Moya Abogados. ""En el caso que nos ocupa, ATME ha suscrito un convenio con una entidad privada que ofrece una formación a la que puede acceder la totalidad de la ciudadanía, así como anteriormente se han firmado decenas de acuerdos de este tipo. ¿Qué problema tiene el Ministerio de Defensa con que nuestros asociados puedan disfrutar de un descuento en dicha formación? Es algo que deberá explicar el Ministerio"", prosiguen desde la asociación. Encuéntranos en:']","['El departamento deMargarita Roblesemitió este miércoles un comunicadoexigiendo a ATME que anulase de forma inmediata su acuerdo con Desokupa.','""ATME no va a renunciar a ningún acuerdo de los firmadosy que se enmarcan dentro del objeto de esta asociación, dentro de la legalidad, y que redunden en beneficio de sus socios y de la escala de tropa y marinería a la que representa"", mantiene la asociación, que advierte que ""promoverá de forma activa aquellas acciones judiciales que sean pertinentes en respuesta al ataque sufrido a nuestra independencia""']"
Que es el proyecto del hub logístico e industrial de Defensa de Aragón,"El proyecto del ""hub logístico e industrial de Defensa"" en Aragón busca impulsar un ecosistema transversal del sector de la Defensa en la región, fomentando la formación, investigación, emprendimiento, logística, industria e infraestructuras, y contribuyendo a la ampliación de la base industrial y tecnológica española de la Defensa.","El proyecto del hub logístico e industrial de Defensa en Aragón busca convertir a la región en un centro crucial para la industria de defensa en España. Este proyecto, de carácter público-privado, impulsará un ecosistema del sector en torno a la formación, investigación, emprendimiento, logística, industria e infraestructuras. El Ministerio de Defensa apoya esta iniciativa y se ha comprometido a facilitar la instalación de empresas en la región.","['La fecha del articulo es: 1733871600.0 ElGobierno deAragónquiere aprovechar la fuerte implantación de lasFuerzas Armadasen la región y su situación estratégica en el territorio nacional para convertirse en una ubicación crucial para la industria de Defensa en España. ElMinisterio de Defensanecesita la implicación de los territorios para fomentar una industria de defensa nacional que debería dar un salto cuantitativo y cualitativo en los próximos años. La necesidad de entenderse ha provocado que la buena sintonía reinara este miércoles en el Ministerio de Defensa en el encuentro que han mantenido la ministra,Margarita Robles, y su equipo, con una delegación aragonesa encabezada por el presidente regional,Jorge Azcón, y la alcaldesa de Zaragoza,Natalia Chueca. Un acto para lanzar la creación de ungran ‘hub logístico e industrial de Defensa’ en Aragón. El proyecto aspira a impulsar un ecosistema transversal del sector de la Defensa en la comunidad autónoma, de carácter público-privado, en torno a la formación, investigación, emprendimiento, logística, industria e infraestructuras, contribuyendo a laampliación de la base industrial y tecnológica española de la Defensa y a la de la propia región. Un proyecto que podría generar un importante número de empleo de alta calidad. Azcón y Chueca han pedido a Defensa una participación activa del departamento en la puesta en marcha de este hub a través de suasesoramiento, acompañamiento y apoyo institucional, algo a lo queRobles ha respondido afirmativamente. De hecho, se ha comprometido a visitar en próximas fechas Aragón para, en palabras de Azcón, ""contarle a las industrias de Defensa cuáles son las potencialidades y cuáles son las fortalezas"" de la comunidad. ""Vamos a seguir estrechando el contacto con las industrias, con las empresas que se dedican a fabricar productos de Defensa, para decirles que en Aragón van a tener un sitio idóneo donde poder desarrollar su actividad"", ha explicado Azcón tras su reunión con Robles, y ha puesto como ejemplo a empresas comoInstalaza y Escribano M&E, de las que ha dicho que se les van a ponertodas las facilidades para ampliar sus instalacionesen Zaragoza y Binéfar (Huesca). De igual modo, el presidente aragonés ha anunciado que su comunidad autónoma participará por primera vez en laFeria Internacional de Defensa (FEINDEF), la feria más importante del sector en nuestro país, que se celebra cada dos años y que tendrá lugar el próximo mes de mayo en el recinto ferial de IFEMA de Madrid. Un evento para el queya han reservado espacio más de 400 empresas nacionales e internacionales. Encuéntranos en:', 'La fecha del articulo es: 1733180400.0 Jorge Azcón,presidente del Gobierno de Aragón—comunidad muy activa en el rol de atraer a la industria de defensa en su región— inauguró el bloque sobre cohesión territorial con su ponencia ""La industria de Defensa como garantía de cohesión territorial"" y ha dado las gracias a Libertad Digital por hacer un evento para hablar de un tema de este calibre con tanta valentía. Azcón destacó la capacidad de Aragón en la industria de defensa, así como ha afirmado que ""en Aragón lo que ofrecemos desde el punto de vista de la defensa es logística, industria, tecnología y experiencia en el ejército"", pues ""hablar del ejército en Aragón es hablar de la Academia Militar, la Brigada Aragón, etc."". Azcón también abordó el caso de Inditex que va a crear 1500 puestos de trabajo en Aragón, haciendo unllamamiento a que las industrias aumenten su presencia en esta comunidadautónoma. ""Aragón es la región de Europa en la que mayores inversiones tecnológicas se van a hacer"", subrayando que la operación va a contar con la presencia de empresas como Microsoft, Blackstone, etc. #LiberdefensaLD| Jorge Azcón, presidente de Aragón, sobre Zaragoza como punto estratégico.pic.twitter.com/oEzZeVcQUQ La mesa redonda posterior ""La Defensa, eje de crecimiento y empleo"" fue moderada porJavier Arias Borque, periodista yresponsable de Defensa del Grupo Libertad Digital, que analizó cómo ""invertir en industria de defensa no es solo invertir en defensa nacional, sino invertir en riqueza y creación de empleo para nuestro país"", ya que esta industria ofrece un empleo de calidad, por lo que se requiere de una industria adaptada a las nuevas tecnologías que están revolucionando los sistemas militares, así como la necesidad de modernizar y ampliar la capacidad de las Fuerzas Armadas para garantizar la seguridad y competitividad de España dentro de un contexto europeo más tenso. La mesa contó con la participación deJorge Paradela Gutiérrez, Consejero de Industria, Energía y Minas de la Junta de Andalucía, yAlfonso Martínez, Presidente en España de QUEST GLOBAL. Uno de los temas que se trata en la actualidad es cómo las comunidades autónomas pueden apoyar a las empresas en este proceso. A través de diversos mecanismos, las administraciones regionales juegan un papel fundamental para fomentar el crecimiento de la industria y, a su vez, apoyar la creación de empleo y la innovación tecnológica.Paradelaha comunicado que a pesar de que ""Europa está viviendo un momento de incertidumbre, Andalucía tiene un peso en el presente y el futuro de la industria de defensa a nivel nacional y europeo"",ya que el 30% de la facturación agregada está en Andalucía, además de contar con centros tecnológicos y activos industriales como Airbus, Indra o AirTech. #LiberdefensaLD| Jorge Paradela (Consejero de Industria, Energía y Minas de la Junta de Andalucía) 📌 Andalucía, referente en aeronáutica y defensa naval.pic.twitter.com/cF8SSO8z5Z Además, se ha abordado como la industria necesitará nuevas implantaciones industriales para satisfacer la creciente demanda. Esto incluyetanto la construcciónde nuevas infraestructurascomo la modernizaciónde las existentes, lo que plantea oportunidades para las regiones más desfavorecidas y contribuye a la cohesión territorial.Martínez ha señalado que es necesario ""hacer una visión estratégica y una industrial de la defensa para tener una cohesión territorial"". Aunque ha hecho hincapié en que ""el reto que abre la oportunidad para la cohesión territorial es el de las personal y el talento"", donde se quiere aumentar un 2% el empleo de estos técnicos en los próximos años. ""Todos los sectores dicen que no encuentran gente cualificada"", por lo que desde la Junta de Andalucía,Paradela ha anunciado que hay 50.000 plazas más de FP en la comunidad,además de desarrollar una FP dual, que ha tenido en cuenta las necesidades reales para desarrollar el sector de manera paulatina. Respecto al FCAS y otras iniciativas europeas, ha afirmado que ""Andalucía quiere estar en todos los proyectos clave"". Durante este bloque sobre cohesión territorial, se ha destacado que España está en camino a alcanzar el 2% del PIB en 2030 para la defensa. Este incremento supone unaduplicación del presupuestoy un crecimiento cercano al 5% de las inversiones, lo cual representa un reto significativo para la industria española. El bloque sobre cohesión territorial subraya que, en tiempos de recesión económica, la defensa puede actuar como una herramienta anticíclica, impulsando la actividad económica en diversas regiones y creando empleo estable en sectores clave como la ingeniería y la tecnología, ya que como ha indicado Martínez: ""Genera un empleo de muchísima calidad– ingenieros, técnicos especialistas– y estable"".Martínez ha concluido que""esta es la España de Isabel Díaz Ayuso y la realidad económica"", ya que las comunidades tienen una responsabilidad en subir sueldos para convertir estas carreras en atractivas y animar a la gente a que se forme. Encuéntranos en:']","['Un acto para lanzar la creación de ungran ‘hub logístico e industrial de Defensa’ en Aragón.' 'El proyecto aspira a impulsar un ecosistema transversal del sector de la Defensa en la comunidad autónoma, de carácter público-privado, en torno a la formación, investigación, emprendimiento, logística, industria e infraestructuras, contribuyendo a laampliación de la base industrial y tecnológica española de la Defensa y a la de la propia región. Un proyecto que podría generar un importante número de empleo de alta calidad','De hecho, se ha comprometido a visitar en próximas fechas Aragón para, en palabras de Azcón, ""contarle a las industrias de Defensa cuáles son las potencialidades y cuáles son las fortalezas"" de la comunidad.']"
Que ha pasado con los dos buques de guerra rusos que navegaron por aguas cerca de España,"No tengo información sobre el destino final de los dos buques de guerra rusos que navegaron por aguas cerca de España. No saben qué ha pasado con la fragata ""Yelnya"". Solo se menciona que una de las embarcaciones, la ""Almirante Gorshkov"", fue controlada y monitoreada por la fragata F-102 Almirante Juan de Borbón.","Una fragata de la Armada Española, la F-102 Almirante Juan de Borbón, controló el tránsito de la fragata ""Almirante Gorshkov"" de la Marina Rusa por la costa norte de España. El control se inició en Pontevedra, tras la misión de un buque portugués, y finalizó cuando una fragata francesa relevó a la española. El destino del buque de reabastecimiento ""Yelnya""no se menciona en los textos.","['La fecha del articulo es: 1734562800.0 La actividad de los buques de guerra rusos en aguas de responsabilidad española en las últimas semanas está siendo frenética. La Marina rusa está en constante movimiento entre su salida al mar por el Mar Mediterráneo Oriental, a través del Mar Negro, cerca de su base naval en Siria, cuyo futuro es más bien incierto tras la caída del Régimen sitio, y la que tiene en el norte de Europa a través del Mar Báltico. Si hace sólo unas semanas fue lafragata F-83 Numancia la que tuvo que controlar el tránsito de dos buques de guerra rusos por toda la costa española, desde las Islas Baleares hasta la frontera sur con Portugal, ahora le ha tocado el turno a lafragata F-102 Almirante Juan de Borbón, que ha tenido que controlar eltránsito de una embarcación de la Marina rusa por toda la costa norte española. Fuentes del Estado Mayor de la Defensa han explicado que la embarcación rusa controlada ha sido lafragata ""Almirante Gorshkov"", una de las dos embarcaciones que fueron contraladas en la otra esquina peninsular la pasada semana, pero no han explicado qué ha pasado con elbuque de reabastecimiento ""Yelnya"", la otra de las embarcaciones de la Marina rusa que bordeó la Península por el sur. El control y monitorización de esta embarcación comenzó en la provincia de Pontevedra, a la altura de la desembocadura del río Miño, tras cubrir la misión que venía realizando un buque de la Marina de Portugal, a la altura de la desembocadura del río Miño, y prosiguió durante su tránsito por toda la cornisa cantábrica hasta que la embarcación española fue sustituida por otra de la Marina Nacional francesa. La fragata F102 Almirante Juan de Borbón ha realizado este seguimiento siguiendo órdenes del Mando Operativo Marítimo (MOM), el órgano de la estructura operativa de las Fuerzas Armadas, subordinado al Jefe de Estado Mayor de la Defensa (JEMAD), responsable, a su nivel, del planeamiento, conducción y seguimiento de las operaciones permanentes de vigilancia y seguridad de los espacios marítimos de soberanía, responsabilidad e interés nacional. Encuéntranos en:', 'La fecha del articulo es: 1734303600.0 Losbuques de la Armada españolasiguen controlando de cerca el paso de las embarcaciones rusas por aguas españolas o en sus cercanías. El último ejemplo de ello ha tenido lugar en los últimos días, en los que lafragata F-83 Numanciaha estado controlando lanavegación de dos buques de guerra rusosque navegan por aguas próximas a España y a sus áreas de responsabilidad marítima. Fuentes del Estado Mayor de la Defensa han informado de que ese seguimiento se inició hace unos días, cuando las dos embarcaciones rusas, que provenían del Mar Mediterráneo Oriental, fueronlocalizadas al sur de las Islas Baleares. La F-83 Navarra siguió su rumbo bordeando todo el sur peninsular hasta que abandonaron la Zona Económica Exclusiva (ZEE) española en lafrontera marítima con Portugal. Fue, en ese momento, cuando el buque español transfirió la responsabilidad de controlar y monitorizar a las dos embarcaciones -lafragata ""Almirante Gorshkov""ybuque de reabastecimiento ""Yelnya""- a una embarcación de la Marina portuguesa. Esta última, si como todo parece, el destino de los buques rusos es el Mar Báltico, volverá a dar el relevo a una embarcación española a la altura de Galicia. La fragata Numancia ha realizado este seguimiento siguiendo órdenes del Mando Operativo Marítimo (MOM), el órgano de la estructura operativa de las Fuerzas Armadas, subordinado al Jefe de Estado Mayor de la Defensa (JEMAD), responsable, a su nivel, del planeamiento, conducción y seguimiento de las operaciones permanentes de vigilancia y seguridad de los espacios marítimos de soberanía, responsabilidad e interés nacional. ""Las Operaciones de Presencia, Vigilancia y Disuasión son una herramienta eficaz para mantener una vigilancia de los espacios de soberanía, lo que permite detectar anticipadamente amenazas y facilitar una respuesta inmediata y viable ante una potencial crisis"", han explicado desde el Estado Mayor de la Defensa. Encuéntranos en:']","['lafragata F-83 Numancia la que tuvo que controlar el tránsito de dos buques de guerra rusos por toda la costa española','Fuentes del Estado Mayor de la Defensa han informado de que ese seguimiento se inició hace unos días, cuando las dos embarcaciones rusas, que provenían del Mar Mediterráneo Oriental, fueronlocalizadas al sur de las Islas Baleares.','Fuentes del Estado Mayor de la Defensa han explicado que la embarcación rusa controlada ha sido lafragata ""Almirante Gorshkov"", una de las dos embarcaciones que fueron contraladas en la otra esquina peninsular la pasada semana']"
Qué acuerdo de 4.000 millones hay entre Airbus y Defensa,El acuerdo es de 4000 millones de euros para la compra de Eurofighter Typhoon,"Entre el 18/12/2024 y el 22/12/2024, el Ministerio de Defensa y Airbus firmaron un acuerdo para la compra de 25 cazas Eurofighter Typhoon del programa Halcón II. Este acuerdo tiene un valor de 4.000 millones de euros e incluye simuladores, motores, repuestos y el mantenimiento de los cazas de los programas Halcón I y II. Estos cazas están destinados a sustituir a parte de los F-18 operativos en la península.","['La fecha del artículo es: 1734649200.0 La firma de los dos programas Halcón para modernizar la flota de cazas del Ejército del Aire y el Espacio ya está hecha. La ministra de Defensa,Margarita Robles, ha formalizado este viernes en la sede deAirbusel segundo de los contratos, por los que se recibirán25 cazas Eurofighter Typhoon de la Tranche 4, la más moderna o evolucionada que hay en estos momentos en el mercado, por una cantidad de 4.000 millones de euros. Si elprograma Halcón I–cuyas primeras unidades ya están siendo ensambladas– se componía de 20 unidades este caza para sustituir a los cazas F-18 Hornet del Ala 46, con sede en la base de Gando (Gran Canaria), elprograma Halcón IIque se acaba de firmar está destinado a sustituir a una parte de los cazas F-18 que sirven en la Península, exactamente, en el Ala 12 (Torrejón de Ardoz, Madrid) y Ala 15 (Zaragoza). La entrada en servicio de estos nuevos aparatosaumentará hasta 115 la flota de Eurofighter Typhoonque estarán en servicio en nuestro país, pues a los 45 que llegarán fruto de los dos programas Halcón habrá que sumar los 70 aparatos de diferentes evoluciones (Tranche 1, Tranche 2 y Tranche 3) que ya están operativos tanto en el Ala 11 (Morón de la Frontera, Sevilla) como en el Ala 14 (Albacete). Entre lasmejoras tecnológicasque tendrán estos nuevos aparatos frente a los que ya están en servicio en estos momentos destacada una aviónica más avanzada, la instalación de un radar de barrido electrónico (E-Scan), sistemas de armas mejorados capaces de operar los misiles Brimstone III (aire-tierra) y Full Meteor (aire-aire), además de nuevos sensores y una conectividad mejorada. La bolsa económica de los 4.000 millones de euros,aprobada por el Consejo de Ministros en el mes de septiembre de 2023, no sólo incluye los 25 aparatos, sino también dossimuladores de última generacióncon toda su infraestructura,motores y múltiples piezas de recambio, así como elmantenimiento habitual de los cazas. Un paquete que no sólo es para las unidades del programa Halcón II, sino que también incluye a los 20 cazas del programa Halcón I. Durante la firma, Margarita Robles ha mantenido que ""el compromiso del Gobierno de España con la inversión en Defensa es inequívoco"", que esta adquisición es ""un refuerzo de las capacidades para el Ejército de Aire y del Espacio, en unos momentos muy complicados en los que la modernización es esencial"" y que, además, ""nos permite cumplir con nuestros compromisos en la UE y la OTAN, así como gozar de una elevada consideración y ser valorado como un socio fiable y serio"". La firma de este contrato vuelve a poner de relieve que el Ministerio de Defensa todavía tieneun gran reto pendiente en lo que a la renovación de cazas de combate se refiere. Un reto que empieza a convertirse poco a poco en un quebradero de cabeza. El Halcón II sólo sirve para sustituir a una parte de los 60 cazas F-18 Hornet que están en servicio en la Península, pero no a todas las unidades. Para el resto de esas unidades por sustituir, existe un programa dentro del departamento de Margarita Robles denominado ""Avión sustituto del AV-8B y C-15M"", es decir, para sustituir a los cazas Harrier AV-8B de la Armada y al resto de cazas F18 del Ejército del Aire y el Espacio. El mismo tiene una bolsa económica asociada que asciende a 6.500 millones de euros. Teniendo en cuenta que no hay tiempo material para desarrollar un avión desde cero que cumpla con esas características, parece que la única opción es ver qué hay en el mercado en estos momentos. Y en éste, elúnico modelo que cumple los requisitos es elF35, con su variantes A (despegue y aterrizaje convencional) y B (despegue y aterrizaje convencional y vertical), fabricado por la empresa estadounidense Lockheed Martin. Ante esta situación,el Gobierno puede optar por tres opciones. La primera es comprar el F35 en variantes A y B para ambos ejércitos. La segunda es que se compre el F35B para la Armada y otra aeronave para el Ejército del Aire y el Espacio. La tercera es que la Armada pierda buena parte de su capacidad de proyección de la Fuerza, pierda su Ala embarcada, y sólo se compre un caza para el Ejército del Aire y el Espacio. A principios de diciembre, durante un desayuno informativo con medios de comunicación, el Jefe del Estado Mayor del Aire (JEMA), general del Aire Francisco Braco,deslizó la posibilidad de que el Ejército del Aire no sólo piense en los F35para sustituir al resto de cazas F18, y abrió la posibilidad a cazas de fabricación francesa o surcoreana, como pueden ser el Dassault Rafale o el KF-21 Boramae. Encuéntranos en:', 'La fecha del artículo es: 1734735600.0 ElEjército del Aire y el Espaciotiene en estos momentos, como todas lasFuerzas Armadas, varias asignaturas pendientes en su proceso continuado de modernización. Una de ellas es la de dotarse de unnuevo entrenador avanzado para el Ala 23de Talavera la Real (Badajoz), donde se adiestran los pilotos de caza que van a dar el salto a los aparatos de primer nivel en servicio como el Eurofighter Typhoon y el F-18 Hornet. Ahora mismo se utiliza el F5 Northrop, un pequeño avión de combate supersónico bimotor diseñado en Estados Unidos en los años 60, pero construidos bajo licencia por la española CASA (actualmente dentro de Airbus). Pese a que han recibido varias modernizaciones, tanto estructurales como de sistemas, la veintena de unidades en servicio se van acercando de forma peligrosa al final de su vida operativa. Es por ello que los responsables del Ejército del Aire y el Espacio llevan tiemposondeando el mercado para ver qué aeronave podría sustituira estos F5 Northrop, una vez que quedó descartada la posibilidad de diseñar un nuevo avión desde cero por falta de tiempo. Cuatro modelos se han colocado en estos tiempos como los que podían tener más posibilidades: el T-50 surcoreano, el M-346 italiano, el TAI Hürjet turco y el Boeing T-7A Red Hawk. Hace unas semanas, el Jefe del Estado Mayor del Aire (JEMA), general del Aire Francisco Braco, durante un desayuno informativo con los medios de comunicación, dijo quese estaba en la recta final de la decisión sobre la adquisición del entrenador avanzado. ""El tema depende del retornoindustrial. Compramos este entrenador pero ¿a cambio de qué?Estamos en esa fase de ¿y yo qué saco?"", añadió. En este contexto, elMinisterio de Defensaanunció este viernes la firma de unconveniode colaboración con laSecretaría de Industria de Defensa turca, ""un memorando para desarrollar unsistema de entrenamiento avanzado para pilotos de caza del Ejército del Airecon participación industrial de España y Turquía"". Un acuerdo sellado en la Embajada turca en Madrid entre la secretaria de Estado de Defensa, Amparo Valcarce, y la embajadora turca. Un convenio que podría poner de manifiesto que elTAIHürjetserá el próximo entrenador avanzado del Ejército del Aire y el Espacio en sustitución del F5 Northrop y que las compensaciones industriales para España por realizar esta adquisición ya estarían relativamente acordadas. El TAI Hürjet es unavión de combate ligero supersónico monomotor. Tiene una longitud de 13,6 metros, una envergadura de 9,5 metros y una altura de 5,1 metros. Puede operar hasta los 45.000 pies de altura, alcanzar una velocidad de 1.4 Match y portar una carga de pago de unas 6.000 libras (unos 2.700 kilogramos). Bajo sus alas puede montar diferente tipo de armamento. Sus especificaciones indican que puede portarmisiles aire-aireAIM-9X y Göktug, así comomisiles guiados por láserLGK-82. Puede llevarbombas de fabricación turcade diferentes tipos, como las de guiado Téber-82, HGK-3, HGK-83 y LGK-82, bombas de pequeño diámetro (SDB) para ataque a tierra o bombas en miniatura. También puede llevar un cañón de 20mm. Encuéntranos en:']","['La ministra de Defensa,Margarita Robles, ha formalizado este viernes en la sede deAirbusel segundo de los contratos, por los que se recibirán25 cazas Eurofighter Typhoon de la Tranche 4, la más moderna o evolucionada que hay en estos momentos en el mercado, por una cantidad de 4.000 millones de euros.','el programa Halcón II que se acaba de firmar está destinado a sustituir a una parte de los cazas F-18 que sirven en la Península.']"
La princesa Leonor y la Escuela Naval militar,"La Princesa de Asturias, Leonor de Borbón, ha ingresado en la Escuela Naval Militar de Marín (Pontevedra) como Guardiamarina de Primera para completar su formación militar. Esta es una oportunidad única para ella como heredera de la Corona y parte del plan especial de tres años creado especialmente para ella. Ha comenzado su segundo año de formación en el tercer curso de la academia.","El 29 de agosto de 2024, la Princesa Leonor de Borbón ingresó en la Escuela Naval Militar de Marín (Pontevedra) para iniciar su segundo año de formación militar. Este año comparte clase con los futuros oficiales de la Armada y la Infantería de Marina, y tiene el rango de Guardiamarina de Primera. El capitán de navío Pedro Cardona Suanzes es su tutor personal durante su estancia en la academia.","['La fecha del articulo es: 1724882400.0 La Princesa Leonor de Borbón ha ingresado en la Escuela Naval Militar, donde comenzará su segundo año de formación militar, dentro del plan especial de tres años que se ha creado para ella como heredera de la Corona. La Princesa de Asturias comienza en el tercer curso de la academia, con el rango de Guardiamarina de Primera. Así queda reflejado en el uniforme con el que ha acudido su primer día al centro. Leonor de Borbón ha sido recibida a las puertas del centro por el comandante-director de la Escuela Naval Militar, capitán de navío Pedro Cardona Suanzes. El capitán de navío ha renunciado al ascenso para dirigir la academia durante la estancia de la heredera de la Corona y hacer de tutor personal durante los meses que Leonor de Borbón esté en ella. A su llegada al centro militar, la Princesa de Asturias ha saludado a los oficiales que forman parte de la dirección de la academia. La Princesa de Asturias ha pasado a firmar en el libro de honor de la Escuela Naval Militar de Marín (Pontevedra) acompañada por el comandante-director. “Hoy me incorporo, con gran ilusión, a esta Escuela Naval Militar para continuar con mi formación castrense. Estoy segura de que aquí tendré la oportunidad de aprender mucho y compartir muchas experiencias importantes junto a mis compañeros de promoción"", ha escrito la heredera de la Corona. A continuación, la Princesa de Asturias ha ido conociendo las diferentes instalaciones del centro castrense, donde recibirá su formación militar durante los próximos meses. Leonor de Borbón conociendo las instalaciones de la Escuela Naval Militar de Marín (Pontevedra). Encuéntranos en:', 'La fecha del articulo es: 1736550000.0 La Princesa de Asturias, Leonor de Borbón, ha zarpado este sábado en el XCVII crucero de instrucción del Juan Sebastián Elcano, el buque-escuela de la Armada española. El viaje de Leonor de Borbón en este buque-escuela será el colofón a su año de formación militar en la Academia Naval Militar. La Princesa de Asturias recibe su gran bautismo de fuego marinero acompañada por otros 75 guardiamarinas de primera de la Academia Naval Militar. Además de los 76 guardiamarinas de primera, a bordo del Juan Sebastián Elcano van otros 170 militares (entre tripulación y profesores), que completarán las clases prácticas de los futuros oficiales de la Armada con clases teóricas. El XCVII crucero de instrucción de la Armada se prolongará durante seis meses, aunque la Princesa de Asturias tan sólo realizará cinco meses a bordo. Hará en avión el trayecto entre Estados Unidos y España. Los Reyes de España, como el resto de familiares de los guardiamarinas embarcados, han acudido a despedir al Juan Sebastián Elcano. Felipe VI, vestido con el uniforme de almirante general de la Armada, ha subido al Juan Sebastián Elcano para dedicar unas palabras de ánimo a los guardiamarinas embarcados. La reina Letizia también ha subido a bordo del buque-escuela de la Armada española. Los familiares de los guardiamarinas embarcados que han acudido a la despedida han dedicado muchas muestras de afecto a los Reyes de España. La ministra de Defensa, Margarita Robles, ha llegado tarde al acto de despedida del Juan Sebastián Elcano y ha sido abucheada por los familiares de los guardiamarinas. La niebla ha impedido aterrizar al Falcon en el que viajaba Robles en Cádiz y ha sido desviado a la base aérea de Morón. Desde la localidad sevillana ha ido en coche hasta Cádiz, llegando con 10 minutos de retraso al acto. La Princesa de Asturias, Leonor de Borbón, y sus compañeros, se despiden de sus familias al inicio de la navegación del Juan Sebastián Elcano para iniciar su XCVII crucero de instrucción. Felipe VI y la reina Letizia despiden al Juan Sebastián Elcano, que en este viaje lleva a la Princesa de Asturias a bordo. El Rey utiliza la cámara de su teléfono móvil para inmortalizar la salida a mar del Juan Sebastián Elcano con la princesa Leonor a bordo. Los Reyes, abrazados, contemplan al Juan Sebastián Elcano poner rumbo a América con la Princesa de Asturias a bordo. La reina Letizia se ha mostrado visiblemente emocionada durante todo el acto. El Juan Sebastián Elcano, buque-escuela de la Armada, hizo su primer viaje de instrucción en 1928. Desde entonces, ha sido modernizado en varias ocasiones. En este crucero de instrucción\xa0se van a recorrer 17.000 millas náuticas, con 140 días de mar, parada en 14 puertos y visita a 8 países americanos diferentes. Dos horas antes de la ceremonia de despedida del Elcano, los guardiamarinas han acudido a la Iglesia de la Virgen del Carmen en San Fernando. La visita a la Iglesia de la Virgen del Carmen de San Fernando es una de las tradiciones que tienen los guardiamarinas antes de poner rumbo a su crucero de instrucción. Los guardiamarinas han asistido a una misa en la Iglesia de la Virgen del Carmen en San Fernando, donde se ha pedido que les acompañe una\xa0buena mar y buenos vientos. Concluida la misa, los guardiamarinas se han hecho una foto grupal con La Galeona, una advocación de la Virgen\xa0del Carmen. Como es tradición, los guardiamarinas han procesionado con La Galeona hasta el muelle, ya que esta advocación de la Virgen del Carmen les va a acompañar embarcada durante su crucero de instrucción. Encuéntranos en:']","['La Princesa Leonor de Borbón ha ingresado en la Escuela Naval Militar, donde comenzará su segundo año de formación militar','La Princesa de Asturias, Leonor de Borbón, ha zarpado este sábado en el XCVII crucero de instrucción del Juan Sebastián Elcano, el buque-escuela de la Armada española.']"
Desfile militar,"El desfile militar se llevó a cabo el 12 de octubre en la Plaza de Neptuno, con la presencia del Rey y la Princesa Leonor, quien llevaba el uniforme de gala de la Armada. El acto incluyó homenajes a la bandera y a los caídos por España, así como pasos desfile de diferentes unidades militares.","El 12 de octubre de 2024 se celebró el desfile militar por el Día de la Fiesta Nacional, aunque la lluvia causó la suspensión del desfile aéreo y los saltos paracaidistas. Felipe VI y la Princesa Leonor rindieron homenaje a la bandera y a los caídos. A pesar de la lluvia, hubo un desfile terrestre con diversas unidades y vehículos militares.","['La fecha del artículo es: 1728684000.0 La Princesa de Asturias, Leonor de Borbón, ha participado en el desfile de la Fiesta Nacional del 12 de Octubre con el uniforme de gala de la Armada. El uniforme de gala de la Armada está compuesto por una levita o guerrera azul marino, conocida popularmente como la de los “14 botones"",\xa0sobre camisa blanca de manga larga y cuello vuelto semirígido, acompañado por un pantalón largo azul marino. El uniforme de gala de la Armada incluye también un gorro femenino de color blanco, corbata negra de nudo, zapato de color negro, calcetines o medias negras y guantes blancos. En el torso, desde el hombre derecho hasta la cadera izquierda, llevaba la banda azul celestre de la Real Orden de Carlos III. La Princesa de Asturias ha compartido dos condecoraciones en el pecho con su padre, Felipe VI. Se ha tratado de la Gran Cruz de la Orden de Carlos III y la Cruz al Mérito Militar. El uniforme de Leonor de Borbón también incluía el cordón dorado que la identifica como estudiante de la Escuela Naval Militar de Marín (Pontevedra). Encuéntranos en:', 'La fecha del artículo es: 1728684000.0 La Familia Real (a excepción de la infanta Sofía, que no ha podido acudir al desfile) ante la bandera de España durante el desfile por el día de la Fiesta Nacional realizando el saludo protocolario a la enseña nacional. El acto ha comenzado pocos minutos después de la llegada de los Reyes de España a la Plaza de Neptuno, donde se encontraba la Tribuna Real. Ha sido el momento de escuchar el Himno Nacional en su versión larga, como corresponde por protocolo cuando está presente el Monarca, acompañado por 21 salvas de honor. Tras esto, Felipe VI ha pasado revista al batallón de honores de la Guardia Real. El Rey y la Princesa Leonor se dirigían\xa0a rendir homenaje a la bandera y a los caídos por España anta la atenta mirada de Pedro Sánchez. Felipe VI,que portaba el uniforme de capitán general del Ejército de Tierra y la\xa0Princesa Leonor\xa0han\xa0rendido homenaje a la bandera y a los caídos por España. El acto ha comenzado tras\xa0la llegada de los Reyes de España a la\xa0Tribuna Real. Ha sido el momento de escuchar el Himno Nacional en su versión larga, como corresponde por protocolo cuando está presente el Monarca, con las correspondientes salvas de honor. El Rey y la Princesa Leonor han rendido homenaje a la bandera y a los caídos por España. El momento de izar la enseña nacional y hacer un emotivo homenaje a los caídos por España. Felipe VI ha depositado una corona de flores en el monolito que representa a los fallecidos por España. Felipe VI pasando revista al batallón de honores de la Guardia Real.. Un VEC (Vehículo de Exploración de Caballería) del Regimiento de Caballería ‘Lusitania’ nº8\xa0 del Ejército de Tierra. Vehículo del 2º Grupo de Artillería de Campaña (GACAPAC) del Batallón de Zapadores VI de Paracaidistas (BRIPAC). Una de las diferentes versiones que prestan servicio del 8x8 Piraña de la Infantería de Marina. La Guardia Civil ha mostrado un blindado Lince -que prestó servicio en Afganistán- y un blindado URO VAMTAC con una escalinata en el techo para realizar intervenciones especiales. El Tercio Juan de Austria 3º de la Legión ha desfilado con Killo, un carnero un borrego de seis años que ya desfiló ante su Majestad el Rey en Granada con motivo del Día de las Fuerzas Armadas (DIFAS) de 2023. La Legión desfiló a los 124 pasos por minuto habituales, en vez de a su cadencia habitual de 160 pasos por minuto. Regimiento América Nº66 de Cazadores de Montaña. La sección canina de la Unidad Militar de Emergencias (UME). Batallón de Guardia Civil a su paso por el palco real donde se encontraba el Jefe del Estado. Tras la enseña nacional, han desfilado también las banderas de las Naciones Unidas, Portugal, Eslovaquia, Eslovenia y República Checa. El Escuadrón\xa0de Sables de la Guardia Civil a su paso por la tribuna de autoridades. Un detalle de los caballos de la Guardia Real, como siempre, presentes en el desfile. El Escuadrón a caballo de la Policía Nacional ha sido el encargado de concluir el desfile. Sus agentes portaban el uniforme de gala. El regimiento Inmemorial del Rey n° 1 del ejército de tierra, desfilando bajo la lluvia que ha azotado este sábado la capital. Encuéntranos en:']","['La Familia Real (a excepción de la infanta Sofía, que no ha podido acudir al desfile) ante la bandera de España durante el desfile por el día de la Fiesta Nacional realizando el saludo protocolario a la enseña nacional.']"
A que ha sido obligado Feindef por parte de Defensa,"FeINDEF no fue obligado por parte del Ministerio de Defensa a no participar empresas israelíes, sino que es un compromiso político y institucional de la Fundación FEINDEF. La secretaria de Estado de Defensa, Amparo Valcarce, anunció que se hará boicot a las empresas israelíes debido a la postura política del gobierno español en relación con Palestina y Líbano.","Entre el 15/10/2024 y el 31/10/2024, Defensa obligó a Feindef a vetar a Israel y a sus empresas. No habrá participación institucional de Israel, ni de ninguna empresa israelí, en la feria debido al compromiso de España con la paz y seguridad en Palestina y Líbano y el respeto al Derecho Internacional humanitario.","['La fecha del artículo es: 1729634400.0 LainvasiónrusadeUcraniaprovocó un despertar en la vieja Europa. Puso freno a los continuos recortes de la inversión en Defensa, que había provocado que los ejércitos de muchos países, incluido los españoles, hubieran perdido algunas de sus capacidades y viesen erosionadas otras, y relanzó un nuevo ciclo inversor.Europase dio cuenta que las guerras tradicionales siguen existiendo y que deberedimensionarsuscapacidadesmilitares. El primer problema al que hubo que hacer frente fue a la incapacidad inicial de laindustriadeDefensaeuropea para satisfacer la demanda que había provocado el ataque de Vladimir Putin a la vecina Ucrania. Los centros de producción europeos llevaban años adaptados a los raquíticos presupuestos de Defensa y había que potenciarlos para que fuesen capaces de satisfacer el nuevo nivel de demanda, muy superior al que estaban acostumbrados. La multinacional europeaThalesha puesto este miércoles sobre la mesa losdatossobrelosesfuerzospropiosque ha realizado en los dos últimos años. La explicación ha corrido a cargo dePascaleSourisse, vicepresidenta ejecutiva de Desarrollo Internacional de la compañía, que ha visitado la capital de España acompañada por el vicepresidente ejecutivo para Europa, Marc Darmon. Los datos facilitados indican que han conseguidomultiplicarpor2,5lacapacidaddefabricaciónderadaresaéreosen la planta que tiene a las afueras de París (Francia), que hanmultiplicadopor4su capacidad de producirmunicionesde distinto calibre en las diferentes fábricas que tienen en territorio francés y de producirmisilesen sus instalaciones en Belfast (Irlanda del Norte), así como demultiplicarpor5la decohetesde70mmen su planta de Bélgica. Una parte de este armamento ha ido a parar directamente al teatro de operaciones ucraniano. ""TenemoscontratosconUcrania, pero también con países que compran equipamiento para luego ponerlo a disposición de Ucrania"", ha explicado Sourisse, que también ha destacado que otra parte de ese armamento fabricado en los dos últimos años ha ido a parar a cubrir lasnuevasnecesidadesdelospaíseseuropeos. MarcDarmonha recordado que en las actualidad es habitual que los países europeos compren una parte de su material fuera de Europa, en Estados Unidos, Israel o Corea del Sur, y ha planteado que en el futuro cercano ""esto debería cambiar"", para conseguir que el continente pueda avanzar en la ""soberaníaestratégica"" y de autoabastecerse en la mayor medida posible del material militar que necesita. Encuéntranos en:', 'La fecha del artículo es: 1730242800.0 La Feria Internacional de Defensa y Seguridad de España (FEINDEF), la mayor feria relacionada con la industria de Defensa que se celebra en nuestro país, está batiendo récord.Más de 400 empresas del sectorhan confirmado en las últimas semanas su presencia en la muestra, unas cifras muy superiores a la que con más de seis meses a la vista se habían comprometido en la anterior edición, celebrada en 2023, y marcada claramente por la invasión rusa de Ucrania. Los datos expuestos este miércoles por el presidente de la Fundación FEINDEF,Ángel Olivares, exsecretario de Estado de Defensa, indican que son exactamente 405 las empresas que ya tienen su espacio seleccionado, de las que130 van a acudir por primera vez y 131 son internacionales, lo que supone más del 32 por ciento de las confirmadas y un 25 por ciento más de las que lo eran en la pasada edición. ""En solo 4 ediciones nos hemos colocado entre las 10 ferias más importantes del mundo"", ha destacado Olivares, que ha precisado que ya se encuentrareservado el 96 por ciento de la superficie disponiblepara la feria (unos 50.000 metros cuadrados de exposición), que se va a celebrar los próximos días12, 13 y 14 de mayo de 2025en tres pabellones de IFEMA, el recinto ferial de Madrid. Elaspecto negativodel certamen lo ha anunciado la secretaria de Estado de Defensa,Amparo Valcarce, mano derecha de la ministra,Margarita Robles, que ha anunciado que se haráboicot a las empresas israelíes: ""No habrá participación institucional de Israel, ni de ninguna empresa israelí. España está comprometida con la paz y seguridad en Palestina y Líbano y el respeto al Derecho Internacional humanitario y FEINDEF no puede estar ajeno a ello"". FEINDEF, que tiene el apoyo institucional del Ministerio de Defensa desde sus inicios en 2019, es un evento bienal y esta nueva edición contará entre sus principales empresas patrocinadoras con seis de las grandes del sector de la Defensa en España:Airbus, Amper, Escribano, Grupo Oesía, Indra y Navantia. Encuéntranos en:']","['Más de 400 empresas del sectorhan confirmado en las últimas semanas su presencia en la muestra, unas cifras muy superiores a la que con más de seis meses a la vista se habían comprometido en la anterior edición, celebrada en 2023, y marcada claramente por la invasión rusa de Ucrania.','Elaspecto negativodel certamen lo ha anunciado la secretaria de Estado de Defensa,Amparo Valcarce, mano derecha de la ministra,Margarita Robles, que ha anunciado que se haráboicot a las empresas israelíes']"
Para que sirve la planta industrial de zaragoza,"La planta industrial de Zaragoza es destinada a la producción de propulsantes composita y explosivos CST-Cured, así como a la fabricación de subsistemas para misiles y municiones. Además, se incluye una planta industrial de alta capacidad para estos materiales y nuevas oficinas centrales.","La planta industrial de Instalaza en Zaragoza se centrará en investigación y desarrollo (I+D) en tecnologías avanzadas para misiones, la fabricación de subsistemas para misiles y municiones, y la producción de propulsantes y explosivos. Se espera que genere entre 100 y 120 empleos directos en su fase inicial, pudiendo alcanzar los 190 empleos al completarse la segunda etapa. El proyecto se espera que esté completado en 2027.","['La fecha del articulo es: 1735513200.0 La empresaInstalaza, especializada en defensa y con raíces en Zaragoza desde su fundación en 1943, ha confirmadouna inversión de 52 millones de eurosdestinada a construir y ampliar una nueva planta industrial en la capital aragonesa. Este proyecto,declarado de Interés Autonómicopor el Consejo de Gobierno, busca responder a las crecientes demandas del sector tanto en España como en mercados internacionales. El plan incluye la creación de una moderna planta industrial en las cercanías de Zaragoza y la ampliación de las actuales instalaciones. Más allá de la producción,el proyecto se centrará en investigación y desarrollo (I+D), con especial interés en tecnologías avanzadas para misiones y en la fabricación de subsistemas para misiles y municiones. Entre las novedades más destacadas se encuentra la construcción de una planta piloto para la fabricación de propulsantes composita y explosivos CST-Cured. A esto se suma la puesta en marcha de una planta industrial de alta capacidad para estos materiales, así como la creación de nuevas oficinas centrales y una planta dedicada a materias inertes. El proyecto se desarrollará en los terrenos del antiguo polvorín de Cadrete, al este de María de Huerva, en un espacio estratégicamente ubicado cerca de la autovía A-23. Esta localización facilita el acceso logístico y optimiza las operaciones de transporte y distribución. El proyecto, que arrancó en 2023 ytiene previsto completarse en 2027, se desarrollará en dos fases principales. En la primera, se priorizará la capacidad de diseño y fabricación de sistemas y subsistemas de misiles. La segunda fase se enfocará en la fabricación de propulsantes sólidos. Se estima queesta expansión generará entre 100 y 120 nuevos empleos directosen su fase inicial, cifra que podría ascender a 190 al completarse la segunda etapa. Actualmente, Instalaza emplea a 250 personas en sus instalaciones de Zaragoza, que incluyen una planta en el centro de la ciudad, dos más en la zona sur, un campo de maniobras, y un laboratorio balístico ubicado en el Campo de Maniobras de San Gregorio. Instalaza, que exporta el 75% de su producción a más de 35 países, se consolida comoun actor clave en el sector de la defensa. La compañía participa activamente en iniciativas como el programa operativo FEDER Aragón 2021-2027, beneficiándose de ayudas destinadas a la transformación digital y el desarrollo industrial. Además, la Declaración de Interés Autonómico (DIA) permitiráagilizar los trámites administrativos del proyecto, reduciendo significativamente los plazos para su implementación. Esta medida facilita que las fases de desarrollo y construcción avancen de manera más eficiente, garantizando que los objetivos establecidos se cumplan dentro de los tiempos previstos. Encuéntranos en:', ""La fecha del articulo es: 1736722800.0 La nueva fábrica de Instalaza se dedicará a la fabricación de nuevos productos, incluidos subsistemas de misilesMinisterio de Defensa  Madrid13/01/2025Actualizada  04:30 La industria española acelera el aumento de capacidades para hacer frente a lacreciente demandaque requiere el Ministerio de Defensa español y el mercado internacional. El último ejemplo es la compañía privada aragonesaInstalaza, creada en plenasegunda Guerra Mundial(1943) y que, después de muchos avatares, vive actualmente un renacer de oportunidades. La prueba es el anuncio de que ampliará de forma significativa sus capacidades productivas con la construcción de unanueva fábricaen elantiguo polvorín de Cadrete, una instalación militar situada al noreste de María de Hueva, y al suroeste de laCiudad Deportiva del Real Zaragoza, a unos nueve kilómetros de la capital aragonesa. La inversión prevista alcanzará los52 millones de eurosy ello permitirá, según fuentes oficiales, que la compañía doble su plantilla actual hasta cerca de los 250 trabajadores. La planta se dedicará a la fabricación de nuevos productos, incluidossubsistemas de misiles, una de las capacidades estratégica nacional identificadas por el Ministerio de Defensa española en su búsqueda de la autonomía estratégica. También incluirá una planta piloto para la fabricación de otrasmuniciones y componentes avanzados, así como 'propulsantes composite' (para por ejemplo cartuchos mixtos -acero/plástico o latón/plástico) yexplosivos 'cast-cured'-explosivos adheridos a plásticos-. Instalaciones de la compañía privada aragonesa Instalaza, creada en plena segunda Guerra MundialInstalaza  El proyecto comenzó a tomar forma en 2023 y la previsión es que esté finalizado en2027. Durante este período, se acometerá una primera fase centrada en la capacidad de diseño y fabricación de sistemas y subsistemas de misiles. En la segunda fase, se pondrá el foco en la capacidad de fabricación de otros propulsantes sólidos. En septiembre pasado, laDirección General de Armamento y Material (DGAM)adjudicó un programa coincidente del Ministerio de Defensa a una alianza industrial liderada por Instalaza para el desarrollo de un demostrador tecnológico de unmicromisil superficie-aire contra dronesy munición merodeadora. El grupo cuenta además con la participación de dos empresas españolas,SMS (Sistema de Misiles de España)yEscribano, además de con elINTA (Instituto Nacional de Técnica Aeroespacial)para ensayos y validación. El proyecto, financiado con cerca de un millón de euros, contempla el desarrollo de un demostrador tecnológico de micromisil S/A de empuje vectorial lanzado desde tuvo contra RPAS/Loitering con peso máximo de despegue por debajo de 200 kilos. El demostrador tecnológico (TRL6) debe estar completado en unplazo máximo de dos años, es decir en 2026. El misil debe contar con un calibre aproximado de 90 mm y un alcance máximo de 1,5 kilómetros connavegación con guiado inercialy capacidad de corrección trayectoria hacia el objetivo, sensor de proximidad para activación de vara y carga de fragmentación adecuada para objetivos aéreos. Instalaza ha fabricado más de dos millones de cohetes, además de medio millón de sistemas de disparos desde el hombroMinisterio de Defensa  Instalaza será responsable de la propulsión -lanzamiento y vuelo-; navegación FNC, mando y actuación; cabeza de guerra, espoleta y estructura metálica y el tubo lanzador, mientras que Escribano trabajará en el subsistema buscador y de detección (SAL) Sistema de Guiado por Láser Semiactivo). SMS, por su parte, será responsable de la ingeniería de sistemas y la integración final en plataformas. La vicepresidenta del Gobierno de Aragón,Mar Vaquero, anunció recientemente la declaración de interés autonómico de este proyecto y el pleno apoyo del ejecutivo regional. En el último Consejo de Gobierno del año, Vaquero especificó que la nueva fábrica contempla una creación de entre 10 y 15 puestos de trabajo en una primera fase y en una segunda unos 190 puestos directos. Según la compañía, una vez esté finalizada la nueva planta contigua a sus actuales instalaciones en Cadrete,duplicará la plantilla y también la capacidad de producción. «La intención cuando se pueda es abandonar el centro de trabajo que tienen en la calle Monreal en Zaragoza, pero de momento mantendrán esa ubicación», indicaron fuentes de la compañía a la prensa local. Históricamente, en el polvorín de Cadrete estaban los servicios de armas de la región y donde se encontraba una importanteacumulación de explosivos almacenados en túneles bajo tierra. Tenía su propio apeadero de tren. En 2005, el Ministerio de Defensa concedió a Instalaza su uso de terrenos e instalaciones del polvorín contiguo a las instalaciones de la empresa donde se fabrican sus productos estrella, elC-90,elalcotány lagranada de mano «Alhambra». En 2005 se hizo unaconcesión demanial de los terrenose instalaciones del antiguo «Polvorín de Cadrete» que se encuentra lindante con la compañía aragonesa Instalaza destinada en la fabricación de armamento. En este centro se fabrican sistemas de armas como el «C-90», el «Alcotán» y la granada de mano «Alhambra». Desde el inicio de la guerra de Ucrania, el Gobierno español adquirió numerosos sistemas portátiles lanzacohetes C-90Ejército de Tierra  La empresa cuenta con una planta en el centro de Zaragoza, así como dos más en las inmediaciones, en la zona sur, con cerca de 11.000 metros cuadrados. También tiene uncampo de maniobras y un laboratorio balístico, que se sitúa dentro del Campo de Maniobras de San Gregorio. Desde el punto de vista económico, está presente en más de 35 países y exporta aproximadamente el 75% de la producción. Según sus propios datos, la compañía de tecnología completamente española ha fabricado más de dos millones de cohetes, además de medio millón de sistemas de disparos desde el hombro, un millón de granadas de mano y otros 2,5 millones de fusil. Desde el inicio de laguerra de Ucrania, en junio de 2022, el Gobierno español adquirió numerosos sistemas portátileslanzacohetes C-90para ayudar a las tropas deVolodimir Zelenski, que los bautizaron como «el hispano», contras las fuerzas rusas.  De un solo uso y el más ligero del mercado, el C-90 es un desarrollo propio presentado en 1983 para destruir carros de combate y objetivos reforzados (bunkers, etc.) que se ha mantenido actualizado por la constante inversión en I+D de la empresa. La consejera de Economía del Gobierno aragonés ha aplaudido esta importante inversión que permitirá a Instalaza avanzar en proyectos de investigación y desarrollo de nuevas tecnologías en un sector tan importante como es el de defensa.  «Otro de los sectores emergentes en materia industrial es este. Presentamos recientemente ante elMinisterio de Defensay junto a laDelegación del Gobierno en Aragóny elAyuntamiento de Zaragoza, un proyecto para impulsar un 'hub' de defensa en colaboración con el clúster de aeronáutica y aeroespacial» al entender, dijo, que «Aragón tiene oportunidades por su tradición en materia de defensa» para ser referente en esta materia. De ahí, insistió en que sea «una buena noticia que una de las principales empresas aragonesas de este sector siga apostando por llevar a cabo nuevas inversiones» y «reúne todas las condiciones para que la declaremos de inversión de interés autonómico para que pueda ver aligerados los plazos y tener también el respaldo del Gobierno de Aragón». Temas Crónicas castizas Gustavo Morales Casa Real El Debate Ejército de Tierra Alonso Palacios El Debate El Debate © 2023 eldebate.com""]","['El plan incluye la creación de una moderna planta industrial en las cercanías de Zaragoza y la ampliación de las actuales instalaciones. Más allá de la producción,el proyecto se centrará en investigación y desarrollo (I+D), con especial interés en tecnologías avanzadas para misiones y en la fabricación de subsistemas para misiles y municiones.','La planta se dedicará a la fabricación de nuevos productos, incluidossubsistemas de misiles, una de las capacidades estratégica nacional identificadas por el Ministerio de Defensa española en su búsqueda de la autonomía estratégica.','Se estima queesta expansión generará entre 100 y 120 nuevos empleos directosen su fase inicial, cifra que podría ascender a 190 al completarse la segunda etapa.']"