user_input,response,reference,retrieved_contexts,reference_context,precision_mistral,recall_mistral,factual_correctness_mistral,faithfulness_mistral,precision_qwen2.5,recall_qwen2.5,factual_correctness_qwen2.5,faithfulness_qwen2.5,real_recall,similarity
Que modelo quiere el ejercito del aire para sustituir a los F18,"El ejército del aire está considerando opciones más allá del F-35 para reemplazar algunos de sus cazas F18. Se ha mencionado la posibilidad de utilizar cazas de fabricación francesa o surcoreana, como el Dassault Rafale o el KF-21 Boramae. Además, se está planificando un programa para sustituir a los cazas Harrier AV-8B y al resto de los cazas F18 del Ejército del Aire y el Espacio, con una bolsa económica asociada de 6.500 millones de euros.","El Ejército del Aire está considerando el F35 como una opción para sustituir a parte de sus cazas F18, pero también está abierto a otras opciones como el Dassault Rafale francés o el KF-21 Boramae surcoreano. El Ejército del Aire busca un avión que cumpla con las características necesarias para sustituir a los F18, y también está explorando opciones de entrenadores avanzados. El Jefe del Estado Mayor del Aire (JEMA) ha declarado que la situación estaría controlada hasta casi el 2035 con los programas de adquisición ya en marcha.","['La fecha del artículo es: 19/12/2024 A principios de diciembre, durante un desayuno informativo con medios de comunicación, el Jefe del Estado Mayor del Aire (JEMA), general del Aire Francisco Braco,deslizó la posibilidad de que el Ejército del Aire no sólo piense en los F35para sustituir al resto de cazas F18, y abrió la posibilidad a cazas de fabricación francesa o surcoreana, como pueden ser el Dassault Rafale o el KF-21 Boramae.', 'La fecha del artículo es: 11/12/2024 Hace menos de diez días, durante un encuentro con medios de comunicación, el mismo en el que se avanzó que elEjército del Aire contempla opciones más allá del F-35 para sustituir a una parte de sus cazas F18, el Jefe del Estado Mayor del Aire (JEMA), general del Aire Francisco Braco, ya avanzó que la hipótesis principal de la investigación del accidente se estaba centrando en un colisión frontal con un ave de grandes dimensiones.', 'La fecha del artículo es: 02/12/2024 Para el resto de esas unidades por sustituir, existe un programa denominado ""Avión sustituto del AV-8B y C-15M"", es decir, para sustituir a los cazas Harrier AV-8B de la Armada y al resto de cazas F18 del Ejército del Aire y el Espacio, con una bolsa económica asociada de 6.500 millones.', 'La fecha del artículo es: 19/12/2024 Para el resto de esas unidades por sustituir, existe un programa dentro del departamento de Margarita Robles denominado ""Avión sustituto del AV-8B y C-15M"", es decir, para sustituir a los cazas Harrier AV-8B de la Armada y al resto de cazas F18 del Ejército del Aire y el Espacio.', 'La fecha del artículo es: 02/12/2024 Loscazas F18del Ejército del Aire y el Espacio empiezan a atisbar el final de su vida operativo y, como es lógico, se ha comenzado a diseñar el plan demodernización del ala de combate.', 'La fecha del artículo es: 28/12/2024 Sin embargo, algunos expertos afirman que el Ejército del Aire español necesitaríaal menos 24 unidadesdel Hürjet para sustituir a los F-5 (AE-9 designación española), de los que la española CASA -posteriormente integrada dentro de Airbus- llegó a fabricar bajo licencia 70 unidades, modernizándolos después a laversión F-5BM.', 'La fecha del artículo es: 08/03/2025 HürjetKindelán  HürjetKindelán  La respuesta reside en que desde el Ejército del Aire y del Espacio se ve al avión de entrenamiento Hürjet bien posicionado para sustituir a losNorthrop/CASA F-5M, que opera laEscuela de Caza y Ataqueen Talavera la Real (Badajoz).', 'La fecha del artículo es: 20/12/2024 Es por ello que los responsables del Ejército del Aire y el Espacio llevan tiemposondeando el mercado para ver qué aeronave podría sustituira estos F5 Northrop, una vez que quedó descartada la posibilidad de diseñar un nuevo avión desde cero por falta de tiempo.']
","['Este martes, el Ejército del Aire se ha abierto a buscar una opción más allá del caza estadounidense.','Ante esta situación, el Gobierno puede optar por tres opciones.','Para el resto de esas unidades por sustituir, existe un programa dentro del departamento de Margarita Robles denominado ""Avión sustituto del AV-8B y C-15M"", es decir, para sustituir a los cazas Harrier AV-8B de la Armada y al resto de cazas F18 del Ejército del Aire y el Espacio.']",0.95,0.95,0.9,Sí,0.8,0.85,0.8,"Sí

La respuesta proporcionada se ajusta correctamente a las informaciones dadas en el contexto, cubriendo los puntos principales:

1. Se menciona que el Ejército del Aire está considerando opciones más allá del F-35 para reemplazar algunos cazas F18.
2. Se indica la posibilidad de utilizar cazas franceses o surcoreanos como el Dassault Rafale y KF-21 Boramae.
3. Se menciona el programa ""Avión sustituto del AV-8B y C-15M"" para reemplazar a los Harrier AV-8B de la Armada y al resto de cazas F18 del Ejército del Aire y el Espacio, con una bolsa económica asociada.
4. La cantidad económica del programa (6.500 millones) se incluye correctamente.

Por lo tanto, la respuesta es fiel a las informaciones proporcionadas en el contexto.",0.3333333333333333,0.9065818788084556
Qué relación tiene Andalucía con los proyectos de defensa,"Andalucía tiene una gran influencia en el ámbito de la defensa a nivel nacional e europeo. La región cuenta con importantes centros tecnológicos y activos industriales, como Airbus, Indra o AirTech. Además, Andalucía produce el 30% de las ventas agregadas de este sector, lo que demuestra su liderazgo en esta industria estratégica.","Andalucía tiene un papel fundamental en la industria de defensa, tanto a nivel nacional como europeo. La región busca participar en todos los proyectos clave del sector y cuenta con instalaciones industriales y tecnológicas, además de una sólida red de empresas que contribuyen al desarrollo de sistemas innovadores para la defensa. La Junta de Andalucía está comprometida con el crecimiento de la industria de defensa como motor económico y tecnológico.","['La fecha del artículo es: 03/12/2024 ""Andalucía tiene un peso en el presente y el futuro de la industria de defensa a nivel nacional y europeo"", afirmó, poniendo en valor la capacidad estratégica de la comunidad autónoma para participar en los grandes proyectos del sector.', 'La fecha del artículo es: 03/12/2024 ""Andalucía quiere estar en todos los proyectos clave"", señaló, remarcando el compromiso de la Junta de Andalucía con el crecimiento de la industria de defensa como motor económico y tecnológico.', 'La fecha del artículo es: 03/12/2024 El papel de Andalucía en el ámbito de la defensa no es nuevo, pero sus esfuerzos porliderar en este sector estratégicocobran especial relevancia en el contexto actual.', 'La fecha del artículo es: 02/12/2024 Paradelaha comunicado que a pesar de que ""Europa está viviendo un momento de incertidumbre, Andalucía tiene un peso en el presente y el futuro de la industria de defensa a nivel nacional y europeo"",ya que el 30% de la facturación agregada está en Andalucía, además de contar con centros tecnológicos y activos industriales como Airbus, Indra o AirTech.', 'La fecha del artículo es: 03/12/2024 El consejero de Industria, Energía y Minas de la Junta de Andalucía, Jorge Paradela Gutiérrez, destacó durante el I Foro LiberDefensa el papel fundamental quela región andaluza juega en el presente y futuro de la industria de defensa, tanto a nivel nacional como europeo.', 'La fecha del artículo es: 03/12/2024 La Junta de Andalucía, aseguró,seguirá trabajando para consolidar su posición como referente en el ámbito de la defensa y la seguridad.', 'La fecha del artículo es: 02/12/2024 #LiberdefensaLD| Jorge Paradela (Consejero de Industria, Energía y Minas de la Junta de Andalucía) 📌 Andalucía, referente en aeronáutica y defensa naval.pic.twitter.com/cF8SSO8z5Z Además, se ha abordado como la industria necesitará nuevas implantaciones industriales para satisfacer la creciente demanda.', 'La fecha del artículo es: 02/12/2024 El bloque sobre cohesión territorial subraya que, en tiempos de recesión económica, la defensa puede actuar como una herramienta anticíclica, impulsando la actividad económica en diversas regiones y creando empleo estable en sectores clave como la ingeniería y la tecnología, ya que como ha indicado Martínez: ""Genera un empleo de muchísima calidad– ingenieros, técnicos especialistas– y estable"".']
","['El consejero de Industria, Energía y Minas de la Junta de Andalucía, Jorge Paradela Gutiérrez, destacó durante el I Foro LiberDefensa el papel fundamental quela región andaluza juega en el presente y futuro de la industria de defensa, tanto a nivel nacional como europeo.','El papel de Andalucía en el ámbito de la defensa no es nuevo, pero sus esfuerzos porliderar en este sector estratégicocobran especial relevancia en el contexto actual.']",0.95,0.85,0.9,Sí,0.8,0.8,0.8,"Sí

Esta respuesta es fiel a la información proporcionada en el contexto. Se han incluido los aspectos clave:

1. La importancia de Andalucía en el ámbito de la defensa tanto a nivel nacional como europeo.
2. El 30% de las ventas agregadas del sector se realizan en Andalucía.
3. La presencia de importantes centros tecnológicos y empresas industriales como Airbus, Indra o AirTech.
4. La participación de Andalucía en proyectos clave de la industria de defensa.

Todos estos puntos están bien respaldados por el contexto proporcionado, por lo que la respuesta es correcta y fiel al contenido dado.",1.0,0.8838721695775578
Que problemas tiene ATME con su convenio con Desokupa,"ATME está teniendo problemas debido al acuerdo de formación con Desokupa, una empresa involucrada en la recuperación de inmuebles okupados y que también ofrece cursos de defensa personal, primeros auxilios y guías caninos. El Ministerio de Defensa quiere anular el convenio por falta de legitimidad de la asociación y el objeto del acuerdo. La Asociación de Tropa y Marinería Española (ATME), con representación en el Consejo de las Fuerzas Armadas, ha anunciado que mantendrá su convenio con Desokupa, incluso considerando ir a tribunales si es necesario.","La Asociación de Tropa y Marinería Española (ATME) tiene un conflicto con el Ministerio de Defensa por un convenio de formación firmado con Desokupa. El Ministerio exige la anulación del acuerdo argumentando falta de legitimidad y nulidad del objeto del convenio, mientras que ATME se niega a ceder ante las presiones y ha contratado un bufete de abogados para defender su postura. ATME argumenta que el convenio se enmarca dentro de sus objetivos y beneficia a sus asociados.","['La fecha del artículo es: 18/12/2024 ""La asesoría jurídica del Ministerio de Defensa ha emitido un informe por el que queda demostrada lanulidad del acuerdo de servicios formativosentre ATME y Desokupa, por falta de legitimidad de la asociación y por el propio objeto del acuerdo"", decía el comunicado.', 'La fecha del artículo es: 17/12/2024 En un escueto comunicado, el departamento que dirigeMargarita Roblesdice que ""la asesoría jurídica del Ministerio de Defensa ha emitido un informe por el que queda demostrada lanulidad del acuerdo de servicios formativosentre la Asociación de Tropa y Marinería Española (ATME) y Desokupa, por falta de legitimidad de la asociación y por el propio objeto del acuerdo"".', 'La fecha del artículo es: 05/02/2025 La misma ha sido anunciada en las últimas horas por laAsociación de Tropa y Marinería Española(ATME), una de las asociaciones profesionales con representación en el Consejo de Personal de lasFuerzas Armadas(COPERFAS) y que está enfrentada con el Ministerio de Defensa a cuenta de su polémico acuerdo de formación con la empresa Desokupa.', 'La fecha del artículo es: 18/12/2024 El departamento deMargarita Roblesemitió este miércoles un comunicadoexigiendo a ATME que anulase de forma inmediata su acuerdo con Desokupa.', 'La fecha del artículo es: 18/12/2024 La firma de un convenio de formación de una de las principales asociaciones de militares en activo conDesokupa, la empresa especializada en la recuperación de inmuebles okupados de forma ilegal, y que también realiza cursos de defensa personal, primeros auxilios y guías caninos, podría acabar en los tribunales.', 'La fecha del artículo es: 17/12/2024 ElMinisterio de Defensaquiere anular el convenio de colaboración que ha firmado en las últimas horasuna de las principales asociaciones demilitaresen activo de lasFuerzas Armadascon la empresaDesokupa, especializada en la recuperación de inmuebles okupados de forma ilegal, y que también está expandiendo su mercado con la realización de cursos relacionados con la defensa personal, los primeros auxilios y los guías caninos.', 'La fecha del artículo es: 18/12/2024 LaAsociación de Tropa y Marinería Española(ATME), una de las asociaciones profesionales de militares en activo con un mayor número de socios –cerca de los 4.000– y con representación en el Consejo de las Fuerzas Armadas (COPERFAS), ha anunciado este jueves que no admite las presiones del Ministerio de Defensa y que va a mantener su convenio con la mencionada empresa, incluso con tribunales de por medio si hace falta.', 'La fecha del artículo es: 18/12/2024 ""En el caso que nos ocupa, ATME ha suscrito un convenio con una entidad privada que ofrece una formación a la que puede acceder la totalidad de la ciudadanía, así como anteriormente se han firmado decenas de acuerdos de este tipo.']
","['El departamento deMargarita Roblesemitió este miércoles un comunicadoexigiendo a ATME que anulase de forma inmediata su acuerdo con Desokupa.','""ATME no va a renunciar a ningún acuerdo de los firmadosy que se enmarcan dentro del objeto de esta asociación, dentro de la legalidad, y que redunden en beneficio de sus socios y de la escala de tropa y marinería a la que representa"", mantiene la asociación, que advierte que ""promoverá de forma activa aquellas acciones judiciales que sean pertinentes en respuesta al ataque sufrido a nuestra independencia""']",0.8,0.85,0.95,Sí,0.8,0.8,0.9,"Sí

La respuesta proporcionada coincide con los puntos clave del contexto dado:

1. El conflicto entre ATME y el Ministerio de Defensa debido a un acuerdo de formación.
2. La intervención del Ministerio de Defensa por parte de su asesoría jurídica, que declaró la nulidad del acuerdo.
3. Los motivos para considerar la nulidad: falta de legitimidad de ATME y el objeto del acuerdo.
4. La decisión de ATME de mantener el convenio, incluso si es necesario ir a tribunales.

Estas son todas informaciones consistentes con los fragmentos proporcionados en el contexto, por lo que la respuesta es fiel al contenido dado.",0.5,0.9220547079416045
Que es el proyecto del hub logístico e industrial de Defensa de Aragón,Aragón quiere aprovechar la fuerte implantación de las Fuerzas Armadas en la región y su situación estratégica en el territorio nacional para convertirse en una ubicación crucial para la industria de defensa en España.,"El proyecto del hub logístico e industrial de Defensa en Aragón busca convertir a la región en un centro crucial para la industria de defensa en España. Este proyecto, de carácter público-privado, impulsará un ecosistema del sector en torno a la formación, investigación, emprendimiento, logística, industria e infraestructuras. El Ministerio de Defensa apoya esta iniciativa y se ha comprometido a facilitar la instalación de empresas en la región.","['La fecha del artículo es: 10/12/2024 Un acto para lanzar la creación de ungran ‘hub logístico e industrial de Defensa’ en Aragón.', ""La fecha del artículo es: 12/01/2025 Presentamos recientemente ante elMinisterio de Defensay junto a laDelegación del Gobierno en Aragóny elAyuntamiento de Zaragoza, un proyecto para impulsar un 'hub' de defensa en colaboración con el clúster de aeronáutica y aeroespacial» al entender, dijo, que «Aragón tiene oportunidades por su tradición en materia de defensa» para ser referente en esta materia."", 'La fecha del artículo es: 02/12/2024 Azcón destacó la capacidad de Aragón en la industria de defensa, así como ha afirmado que ""en Aragón lo que ofrecemos desde el punto de vista de la defensa es logística, industria, tecnología y experiencia en el ejército"", pues ""hablar del ejército en Aragón es hablar de la Academia Militar, la Brigada Aragón, etc."".', 'La fecha del artículo es: 10/12/2024 ElGobierno deAragónquiere aprovechar la fuerte implantación de lasFuerzas Armadasen la región y su situación estratégica en el territorio nacional para convertirse en una ubicación crucial para la industria de Defensa en España.', 'La fecha del artículo es: 10/12/2024 ""Vamos a seguir estrechando el contacto con las industrias, con las empresas que se dedican a fabricar productos de Defensa, para decirles que en Aragón van a tener un sitio idóneo donde poder desarrollar su actividad"", ha explicado Azcón tras su reunión con Robles, y ha puesto como ejemplo a empresas comoInstalaza y Escribano M&E, de las que ha dicho que se les van a ponertodas las facilidades para ampliar sus instalacionesen Zaragoza y Binéfar (Huesca).', 'La fecha del artículo es: 02/12/2024 #LiberdefensaLD| Jorge Azcón, presidente de Aragón, sobre Zaragoza como punto estratégico.pic.twitter.com/oEzZeVcQUQ La mesa redonda posterior ""La Defensa, eje de crecimiento y empleo"" fue moderada porJavier Arias Borque, periodista yresponsable de Defensa del Grupo Libertad Digital, que analizó cómo ""invertir en industria de defensa no es solo invertir en defensa nacional, sino invertir en riqueza y creación de empleo para nuestro país"", ya que esta industria ofrece un empleo de calidad, por lo que se requiere de una industria adaptada a las nuevas tecnologías que están revolucionando los sistemas militares, así como la necesidad de modernizar y ampliar la capacidad de las Fuerzas Armadas para garantizar la seguridad y competitividad de España dentro de un contexto europeo más tenso.', 'La fecha del artículo es: 12/01/2025 La prueba es el anuncio de que ampliará de forma significativa sus capacidades productivas con la construcción de unanueva fábricaen elantiguo polvorín de Cadrete, una instalación militar situada al noreste de María de Hueva, y al suroeste de laCiudad Deportiva del Real Zaragoza, a unos nueve kilómetros de la capital aragonesa.', 'La fecha del artículo es: 25/01/2025 El complejo «embalaje» de SpainSat NG-I: Envío a Cabo Cañaveral para su lanzamientoAirbus  El contratista principal del proyecto esAirbus Defence and Space.']
","['Un acto para lanzar la creación de ungran ‘hub logístico e industrial de Defensa’ en Aragón.','El proyecto aspira a impulsar un ecosistema transversal del sector de la Defensa en la comunidad autónoma, de carácter público-privado, en torno a la formación, investigación, emprendimiento, logística, industria e infraestructuras, contribuyendo a laampliación de la base industrial y tecnológica española de la Defensa y a la de la propia región. Un proyecto que podría generar un importante número de empleo de alta calidad','De hecho, se ha comprometido a visitar en próximas fechas Aragón para, en palabras de Azcón, ""contarle a las industrias de Defensa cuáles son las potencialidades y cuáles son las fortalezas"" de la comunidad.']",0.8,0.9,0.9,Sí,0.8,0.8,0.9,"Sí

La respuesta ""Aragón quiere aprovechar la fuerte implantación de las Fuerzas Armadas en la región y su situación estratégica en el territorio nacional para convertirse en una ubicación crucial para la industria de defensa en España"" es fiel al contexto proporcionado. Esto se puede ver en los siguientes puntos:

1. Menciona explícitamente que Aragón quiere aprovechar las Fuerzas Armadas implantadas en la región.
2. Hace referencia a su situación estratégica, como evidencia el artículo del 10/12/2024.
3. Establece un objetivo para convertirse en una ubicación crucial para la industria de defensa en España, lo que se puede deducir de las citas de Azcón y otras fuentes.

Por lo tanto, la respuesta es correcta y refleja precisamente el contenido del contexto proporcionado.",0.3333333333333333,0.8486711672851124
Que ha pasado con los dos buques de guerra rusos que navegaron por aguas cerca de España,"Hace unas semanas fue la fragata F-83 Numancia la que tuvo que controlar el tránsito de dos buques de guerra rusos. Ahora le ha tocado el turno a la fragata F-102 Almirante Juan de Borbón, que ha tenido que controlar el tránsito de una embarcación de la Marina rusa por toda la costa norte española.","Una fragata de la Armada Española, la F-102 Almirante Juan de Borbón, controló el tránsito de la fragata ""Almirante Gorshkov"" de la Marina Rusa por la costa norte de España. El control se inició en Pontevedra, tras la misión de un buque portugués, y finalizó cuando una fragata francesa relevó a la española. El destino del buque de reabastecimiento ""Yelnya""no se menciona en los textos.","['La fecha del artículo es: 15/12/2024 El último ejemplo de ello ha tenido lugar en los últimos días, en los que lafragata F-83 Numanciaha estado controlando lanavegación de dos buques de guerra rusosque navegan por aguas próximas a España y a sus áreas de responsabilidad marítima.', 'La fecha del artículo es: 18/12/2024 Si hace sólo unas semanas fue lafragata F-83 Numancia la que tuvo que controlar el tránsito de dos buques de guerra rusos por toda la costa española, desde las Islas Baleares hasta la frontera sur con Portugal, ahora le ha tocado el turno a lafragata F-102 Almirante Juan de Borbón, que ha tenido que controlar eltránsito de una embarcación de la Marina rusa por toda la costa norte española.', 'La fecha del artículo es: 09/03/2025 Defensa Alonso Palacios En los últimos dos años, la presencia de buques de guerra rusos en aguas de interés para España ha experimentado un notable incremento, derivado del conflicto en Ucrania y la reconfiguración de rutas marítimas por parte de la Armada rusa.', 'La fecha del artículo es: 15/12/2024 Losbuques de la Armada españolasiguen controlando de cerca el paso de las embarcaciones rusas por aguas españolas o en sus cercanías.', 'La fecha del artículo es: 09/03/2025 Así, a principios de enero, las fragatasVictoriayBlas de Lezo, así como el buque de acción marítimaTornado, realizaron el seguimiento de buques rusos durante su tránsito por espacios marítimos de interés para España en el mar de Alborán, golfo de Cádiz y la fachada atlántica.', 'La fecha del artículo es: 18/12/2024 La actividad de los buques de guerra rusos en aguas de responsabilidad española en las últimas semanas está siendo frenética.', 'La fecha del artículo es: 18/12/2024 Fuentes del Estado Mayor de la Defensa han explicado que la embarcación rusa controlada ha sido lafragata ""Almirante Gorshkov"", una de las dos embarcaciones que fueron contraladas en la otra esquina peninsular la pasada semana, pero no han explicado qué ha pasado con elbuque de reabastecimiento ""Yelnya"", la otra de las embarcaciones de la Marina rusa que bordeó la Península por el sur.', 'La fecha del artículo es: 09/03/2025 Y detrás de ellos,monitorizando y controlandoa ambos buques rusos, ha estado una fragata de la Armada española.']
","['lafragata F-83 Numancia la que tuvo que controlar el tránsito de dos buques de guerra rusos por toda la costa española','Fuentes del Estado Mayor de la Defensa han explicado que la embarcación rusa controlada ha sido lafragata ""Almirante Gorshkov"", una de las dos embarcaciones que fueron contraladas en la otra esquina peninsular la pasada semana']",0.9,0.9,0.9,Sí,0.8,0.8,0.8,"Sí

Esta respuesta se basa directamente en las partes del contexto que mencionan las acciones de las fragatas F-83 Numancia y F-102 Almirante Juan de Borbón, así como el control sobre buques rusos por aguas españolas. Los detalles proporcionados son consistentes con la información dada en los contextos de fechas 18/12/2024 y 9/3/2025.",1.0,0.7980641483769628
