user_input,response,reference,retrieved_contexts,reference_context,precision_mistral,recall_mistral,factual_correctness_mistral,faithfulness_mistral,real_recall,similarity,precision_qwen2.5,recall_qwen2.5,factual_correctness_qwen2.5,faithfulness_qwen2.5
Qué acuerdo de 4.000 millones hay entre Airbus y Defensa,"El gobierno de España ha adquirido 25 nuevos Eurofighters a través de un contrato con Airbus por valor de 4.000 millones de euros, que incluye la compra de los aviones, simuladores de última generación, motores, piezas de recambio y mantenimiento habitual.","Entre el 18/12/2024 y el 22/12/2024, el Ministerio de Defensa y Airbus firmaron un acuerdo para la compra de 25 cazas Eurofighter Typhoon del programa Halcón II. Este acuerdo tiene un valor de 4.000 millones de euros e incluye simuladores, motores, repuestos y el mantenimiento de los cazas de los programas Halcón I y II. Estos cazas están destinados a sustituir a parte de los F-18 operativos en la península.","['La fecha del artículo es: 1734649200.0 Acto de firma del contrato con Airbus para la adquisición de 25 nuevos Eurofighter.', 'La fecha del artículo es: 1734649200.0 Un paquete que no sólo es para las unidades del programa Halcón II, sino que también incluye a los 20 cazas del programa Halcón I. Durante la firma, Margarita Robles ha mantenido que ""el compromiso del Gobierno de España con la inversión en Defensa es inequívoco"", que esta adquisición es ""un refuerzo de las capacidades para el Ejército de Aire y del Espacio, en unos momentos muy complicados en los que la modernización es esencial"" y que, además, ""nos permite cumplir con nuestros compromisos en la UE y la OTAN, así como gozar de una elevada consideración y ser valorado como un socio fiable y serio"".', 'La fecha del artículo es: 1734735600.0 Es por ello que los responsables del Ejército del Aire y el Espacio llevan tiemposondeando el mercado para ver qué aeronave podría sustituira estos F5 Northrop, una vez que quedó descartada la posibilidad de diseñar un nuevo avión desde cero por falta de tiempo.', 'La fecha del artículo es: 1734649200.0 A principios de diciembre, durante un desayuno informativo con medios de comunicación, el Jefe del Estado Mayor del Aire (JEMA), general del Aire Francisco Braco,deslizó la posibilidad de que el Ejército del Aire no sólo piense en los F35para sustituir al resto de cazas F18, y abrió la posibilidad a cazas de fabricación francesa o surcoreana, como pueden ser el Dassault Rafale o el KF-21 Boramae.', 'La fecha del artículo es: 1734649200.0 La bolsa económica de los 4.000 millones de euros,aprobada por el Consejo de Ministros en el mes de septiembre de 2023, no sólo incluye los 25 aparatos, sino también dossimuladores de última generacióncon toda su infraestructura,motores y múltiples piezas de recambio, así como elmantenimiento habitual de los cazas.', 'La fecha del artículo es: 1734735600.0 Ahora mismo se utiliza el F5 Northrop, un pequeño avión de combate supersónico bimotor diseñado en Estados Unidos en los años 60, pero construidos bajo licencia por la española CASA (actualmente dentro de Airbus).', 'La fecha del artículo es: 1734649200.0 La firma de los dos programas Halcón para modernizar la flota de cazas del Ejército del Aire y el Espacio ya está hecha.', 'La fecha del artículo es: 1734649200.0 Al acto celebrado hoy han acudido también el jefe de Estado Mayor del Ejército del Aire y del Espacio, general del AireFrancisco Braco; el presidente de Airbus España,Francisco Javier Sánchez Segura, y los CEO de ‘Eurofighter’,Giancarlo Mezzanatto, y Eurojet,Ralf Breiling.']
","['La ministra de Defensa,Margarita Robles, ha formalizado este viernes en la sede deAirbusel segundo de los contratos, por los que se recibirán25 cazas Eurofighter Typhoon de la Tranche 4, la más moderna o evolucionada que hay en estos momentos en el mercado, por una cantidad de 4.000 millones de euros.','Un paquete que no sólo es para las unidades del programa Halcón II, sino que también incluye a los 20 cazas del programa Halcón I.']",0.95,0.95,0.9,Sí,0.5,0.6452956049838541,0.8,0.85,0.85,"Sí

La respuesta proporcionada parece ser fiel al contexto dado. Los puntos principales son correctos:

1. 25 nuevos Eurofighters adquiridos por Airbus.
2. Valor de la bolsa económica: 4.000 millones de euros.
3. Incluye aviones, simuladores y sus respectivas infraestructuras.
4. Mantenimiento habitual.

No se han presentado errores ni imprecisiones significativas en relación con el contexto proporcionado."
La princesa Leonor y la Escuela Naval militar,"La Princesa Leonor, conocida como la Heredera de la Corona Española, comenzó su segundo año de formación militar en la prestigiosa Escuela Naval Militar de Marín (Pontevedra). Durante su estancia allí, ha sido recibida con gran entusiasmo y ha conocido las instalaciones del centro, así como a los oficiales que formarán parte de su educación castrense durante los próximos meses. El capitán de navío Pedro Cardona Suanzes será su tutor personal en este proceso educativo.","El 29 de agosto de 2024, la Princesa Leonor de Borbón ingresó en la Escuela Naval Militar de Marín (Pontevedra) para iniciar su segundo año de formación militar. Este año comparte clase con los futuros oficiales de la Armada y la Infantería de Marina, y tiene el rango de Guardiamarina de Primera. El capitán de navío Pedro Cardona Suanzes es su tutor personal durante su estancia en la academia.","['La fecha del artículo es: 1724882400.0 La Princesa Leonor de Borbón ha ingresado en la Escuela Naval Militar, donde comenzará su segundo año de formación militar, dentro del plan especial de tres años que se ha creado para ella como heredera de la Corona.', 'La fecha del artículo es: 1724882400.0 Leonor de Borbón conociendo las instalaciones de la Escuela Naval Militar de Marín (Pontevedra).', 'La fecha del artículo es: 1724882400.0 La Princesa de Asturias ha pasado a firmar en el libro de honor de la Escuela Naval Militar de Marín (Pontevedra) acompañada por el comandante-director.', 'La fecha del artículo es: 1724882400.0 Leonor de Borbón ha sido recibida a las puertas del centro por el comandante-director de la Escuela Naval Militar, capitán de navío Pedro Cardona Suanzes.', 'La fecha del artículo es: 1724882400.0 “Hoy me incorporo, con gran ilusión, a esta Escuela Naval Militar para continuar con mi formación castrense.', 'La fecha del artículo es: 1724882400.0 A su llegada al centro militar, la Princesa de Asturias ha saludado a los oficiales que forman parte de la dirección de la academia.', 'La fecha del artículo es: 1724882400.0 A continuación, la Princesa de Asturias ha ido conociendo las diferentes instalaciones del centro castrense, donde recibirá su formación militar durante los próximos meses.', 'La fecha del artículo es: 1724882400.0 El capitán de navío ha renunciado al ascenso para dirigir la academia durante la estancia de la heredera de la Corona y hacer de tutor personal durante los meses que Leonor de Borbón esté en ella.']
","['La Princesa Leonor de Borbón ha ingresado en la Escuela Naval Militar, donde comenzará su segundo año de formación militar','La Princesa de Asturias, Leonor de Borbón, ha zarpado este sábado en el XCVII crucero de instrucción del Juan Sebastián Elcano, el buque-escuela de la Armada española.']",0.9,0.8,0.9,Sí,0.5,0.907565610133087,0.8,0.85,0.9,"Sí

La respuesta proporcionada es fiel al contexto dado, ya que menciona correctamente:
- La Princesa Leonor comenzando su segundo año de formación militar.
- La Escuela Naval Militar de Marín como lugar de la formación.
- El papel del capitán de navío Pedro Cardona Suanzes como tutor personal durante el tiempo que permanezca en la escuela.

No hay ninguna imprecisión o información incorrecta en la respuesta dada."
Desfile militar,"En el desfile militar, participaron unidades como el Regimiento de Caballería ‘Lusitania’ nº8 del Ejército de Tierra con un Vehículo de Exploración de Caballería, el 2º Grupo de Artillería de Campaña (GACAPAC) del Batallón de Zapadores VI de Paracaidistas (BRIPAC), y la Guardia Civil mostró un blindado Lince y un blindado URO VAMTAC. Además, desfilaron unidades como la Guardia Real con el Tercio Juan de Austria 3º de la Legión, Felipe VI pasó revista al batallón de honores, y también participó el Escuadrón de Sables de la Guardia Civil.","El 12 de octubre de 2024 se celebró el desfile militar por el Día de la Fiesta Nacional, aunque la lluvia causó la suspensión del desfile aéreo y los saltos paracaidistas. Felipe VI y la Princesa Leonor rindieron homenaje a la bandera y a los caídos. A pesar de la lluvia, hubo un desfile terrestre con diversas unidades y vehículos militares.","['La fecha del artículo es: 1728684000.0 Un VEC (Vehículo de Exploración de Caballería) del Regimiento de Caballería ‘Lusitania’ nº8\xa0 del Ejército de Tierra.', 'La fecha del artículo es: 1728684000.0 Vehículo del 2º Grupo de Artillería de Campaña (GACAPAC) del Batallón de Zapadores VI de Paracaidistas (BRIPAC).', 'La fecha del artículo es: 1728684000.0 El regimiento Inmemorial del Rey n° 1 del ejército de tierra, desfilando bajo la lluvia que ha azotado este sábado la capital.', 'La fecha del artículo es: 1728684000.0 La Guardia Civil ha mostrado un blindado Lince -que prestó servicio en Afganistán- y un blindado URO VAMTAC con una escalinata en el techo para realizar intervenciones especiales.', 'La fecha del artículo es: 1728684000.0 Felipe VI pasando revista al batallón de honores de la Guardia Real..', 'La fecha del artículo es: 1728684000.0 El Tercio Juan de Austria 3º de la Legión ha desfilado con Killo, un carnero un borrego de seis años que ya desfiló ante su Majestad el Rey en Granada con motivo del Día de las Fuerzas Armadas (DIFAS) de 2023.', 'La fecha del artículo es: 1728684000.0 Batallón de Guardia Civil a su paso por el palco real donde se encontraba el Jefe del Estado.', 'La fecha del artículo es: 1728684000.0 El Escuadrón\xa0de Sables de la Guardia Civil a su paso por la tribuna de autoridades.']
","['La Familia Real (a excepción de la infanta Sofía, que no ha podido acudir al desfile) ante la bandera de España durante el desfile por el día de la Fiesta Nacional realizando el saludo protocolario a la enseña nacional.','Un VEC (Vehículo de Exploración de Caballería)','El regimiento Inmemorial del Rey n° 1 del ejército de tierra, desfilando bajo la lluvia que ha azotado este sábado la capital.']",0.8,0.3,0.9,Sí,0.6666666666666666,0.5376881624517074,0.8,0.8,0.9,"No

Explicación de las inexactitudes:

1. La fecha 1728684000.0 no corresponde a ninguna fecha real conocida. Es probable que sea un error en la representación de fechas.

2. El VEC (Vehículo de Exploración de Caballería) mencionado pertenece al Regimiento de Caballería 'Lusitania' nº8, pero se repite la información sobre el 2º Grupo de Artillería de Campaña del Batallón de Zapadores VI de Paracaidistas.

3. El texto menciona que Killo, un carnero y un borrego de seis años desfiló en Granada con motivo del DIFAS de 2023. Sin embargo, esto no está en el contexto proporcionado, ya que no se mencionan animales ni eventos específicos de este tipo.

4. El Tercio Juan de Austria 3º de la Legión desfiló con un carnero llamado Killo, lo cual es información incorrecta según el texto original.

5. La presencia del Escuadrón de Sables de la Guardia Civil no se menciona en el contexto dado.

Por estas razones, la respuesta no es completamente fiel al contexto proporcionado."
A que ha sido obligado Feindef por parte de Defensa,"No hay participación institucional de Israel, ni de ninguna empresa israelí en FEINDEF.","Entre el 15/10/2024 y el 31/10/2024, Defensa obligó a Feindef a vetar a Israel y a sus empresas. No habrá participación institucional de Israel, ni de ninguna empresa israelí, en la feria debido al compromiso de España con la paz y seguridad en Palestina y Líbano y el respeto al Derecho Internacional humanitario.","['La fecha del artículo es: 1730242800.0 Elaspecto negativodel certamen lo ha anunciado la secretaria de Estado de Defensa,Amparo Valcarce, mano derecha de la ministra,Margarita Robles, que ha anunciado que se haráboicot a las empresas israelíes: ""No habrá participación institucional de Israel, ni de ninguna empresa israelí.', 'La fecha del artículo es: 1730156400.0 En esta situación, el departamento deMargarita Roblesha querido dar ungolpe de mano en Tess Defence, el consorcio español que tenían a partes iguales GDELS-Santa Bárbara Sistemas, Escribano M&E, SAPA Placencia e Indra, para darle el poder a esta última, sobre la que se quiere cimentar desde hace tiempo el campeón nacional de la industria de defensa.', 'La fecha del artículo es: 1730242800.0 FEINDEF, que tiene el apoyo institucional del Ministerio de Defensa desde sus inicios en 2019, es un evento bienal y esta nueva edición contará entre sus principales empresas patrocinadoras con seis de las grandes del sector de la Defensa en España:Airbus, Amper, Escribano, Grupo Oesía, Indra y Navantia.', 'La fecha del artículo es: 1729634400.0 MarcDarmonha recordado que en las actualidad es habitual que los países europeos compren una parte de su material fuera de Europa, en Estados Unidos, Israel o Corea del Sur, y ha planteado que en el futuro cercano ""esto debería cambiar"", para conseguir que el continente pueda avanzar en la ""soberaníaestratégica"" y de autoabastecerse en la mayor medida posible del material militar que necesita.', 'La fecha del artículo es: 1729634400.0 La multinacional europeaThalesha puesto este miércoles sobre la mesa losdatossobrelosesfuerzospropiosque ha realizado en los dos últimos años.', 'La fecha del artículo es: 1729634400.0 ""TenemoscontratosconUcrania, pero también con países que compran equipamiento para luego ponerlo a disposición de Ucrania"", ha explicado Sourisse, que también ha destacado que otra parte de ese armamento fabricado en los dos últimos años ha ido a parar a cubrir lasnuevasnecesidadesdelospaíseseuropeos.', 'La fecha del artículo es: 1730156400.0 Para ello,Indrase ha hecho con el 51 por ciento de las acciones de Tess Defence, mediante un acuerdo de adquisición de acciones de un 26,33 por ciento adicional al que ya poseía y que hasta ahora estaba en manos de GDELS-Santa Bárbara Sistemas, SAPA y Escribano.', 'La fecha del artículo es: 1729634400.0 Los datos facilitados indican que han conseguidomultiplicarpor2,5lacapacidaddefabricaciónderadaresaéreosen la planta que tiene a las afueras de París (Francia), que hanmultiplicadopor4su capacidad de producirmunicionesde distinto calibre en las diferentes fábricas que tienen en territorio francés y de producirmisilesen sus instalaciones en Belfast (Irlanda del Norte), así como demultiplicarpor5la decohetesde70mmen su planta de Bélgica.']
","['Elaspecto negativodel certamen lo ha anunciado la secretaria de Estado de Defensa,Amparo Valcarce, mano derecha de la ministra,Margarita Robles, que ha anunciado que se haráboicot a las empresas israelíes']",0.8,0.65,0.9,Sí,1.0,0.5705672280809612,0.8,0.85,0.9,"Sí

Esta respuesta está fiel al contexto proporcionado, ya que se refiere directamente a la declaración hecha por Amparo Valcarce sobre la no participación de Israel y sus empresas en FEINDEF. No contiene información contradictoria ni innecesaria con respecto al texto dado."
Para que sirve la planta industrial de Navantia,"La información proporcionada no especifica el propósito exacto de la planta industrial de Navantia. Sin embargo, según el contexto, se menciona que ""entre sus aportaciones tecnológicas, Navantia destaca elsistema de combate y controlde plataforma de Navantia Sistemas"" y también se hace referencia a un sistema de propulsión anaeróbico revolucionario desarrollado por Navantia llamado BEST-AIP. Por lo tanto, la planta industrial podría ser utilizada para la fabricación o producción de estos sistemas de combate y propulsión.","La planta industrial de Navantia se utiliza principalmente para el diseño y construcción de buques, como los submarinos de la clase S-80 y las fragatas F-110. También se encarga de la modernización, reparación y el desarrollo de sistemas tecnológicos para estos buques. Además, participa en proyectos internacionales de construcción naval","['La fecha del artículo es: 1741906800.0 El diseño de las corbetas es de última generación, maximizando la participación de Navantia, incorporando productos propios como el sistema de combate HAZEM, a través de la joint venture SAMINavantia, el sistema integrado de comunicaciones HERMESYS, el sistema de control de fuego DORNA, el Sistema Integrado de Control de Plataforma, el puente integrado MINERVA, motores propulsores bajo licencia MTU, grupos electrógenos diesel y reductoras bajo licencia Schelde.', 'La fecha del artículo es: 1736118000.0 A semejanza de Navantia, se ha especializado en varias líneas de negocio, además de defensa, como la construcción y mantenimiento de grandes cruceros y mercantes, y fabricación de infraestructuras renovables.', 'La fecha del artículo es: 1733180400.0 #LiberdefensaLD| Jorge Paradela (Consejero de Industria, Energía y Minas de la Junta de Andalucía) 📌 Andalucía, referente en aeronáutica y defensa naval.pic.twitter.com/cF8SSO8z5Z Además, se ha abordado como la industria necesitará nuevas implantaciones industriales para satisfacer la creciente demanda.', 'La fecha del artículo es: 1735167600.0 Por su parte, Llamas explicó que desde la adquisición de Palencia por Nammo en 2013, la planta ha experimentado unatransformación significativa, con inversiones de más de 25 millones de euros destinadas a modernizar sus instalaciones, incluida una nueva línea de fabricación de munición de calibres medios.', 'La fecha del artículo es: 1741820400.0 Entre sus aportaciones tecnológicas, Navantia destaca elsistema de combate y controlde plataforma de Navantia Sistemas, y unsistema de propulsión anaeróbico revolucionariodesarrollado por Navantia que aporta gran sigilo en inmersión, denominadoBEST-AIP.', 'La fecha del artículo es: 1736722800.0 La prueba es el anuncio de que ampliará de forma significativa sus capacidades productivas con la construcción de unanueva fábricaen elantiguo polvorín de Cadrete, una instalación militar situada al noreste de María de Hueva, y al suroeste de laCiudad Deportiva del Real Zaragoza, a unos nueve kilómetros de la capital aragonesa.', 'La fecha del artículo es: 1736118000.0 Armada | Navantia Alonso Palacios Según el comunicado por los astilleros españoles, «en virtud del acuerdo, la filial británica de Navantia gestionará lascapacidades industriales de Harland & Wolffaplicando su experiencia en construcción naval, gestión de programas complejos y transferencia de conocimiento» «Navantia UK valora positivamente el compromiso del Gobierno británico con el programa de construcción naval FSS y garantiza su ejecución y el fortalecimiento de las capacidades industriales locales, de acuerdo con las necesidades de construcción naval y del mercado de defensa de Reino Unido», agregó la declaración de la empresa española.', 'La fecha del artículo es: 1733871600.0 ""Vamos a seguir estrechando el contacto con las industrias, con las empresas que se dedican a fabricar productos de Defensa, para decirles que en Aragón van a tener un sitio idóneo donde poder desarrollar su actividad"", ha explicado Azcón tras su reunión con Robles, y ha puesto como ejemplo a empresas comoInstalaza y Escribano M&E, de las que ha dicho que se les van a ponertodas las facilidades para ampliar sus instalacionesen Zaragoza y Binéfar (Huesca).']
","['El diseño de las corbetas es de última generación, maximizando la participación de Navantia, incorporando productos propios como el sistema de combate HAZEM, a través de la joint venture SAMINavantia, el sistema integrado de comunicaciones HERMESYS, el sistema de control de fuego DORNA, el Sistema Integrado de Control de Plataforma, el puente integrado MINERVA, motores propulsores bajo licencia MTU, grupos electrógenos diesel y reductoras bajo licencia Schelde.']",0.95,0.95,0.9,Sí,1.0,0.5956747133078033,0.6,0.8,0.8,"No

La respuesta proporcionada no se ajusta del todo al contexto dado, ya que:

1. La pregunta original pide evaluar la fidelidad de una respuesta específica que no está presente en el texto proporcionado.
2. No se menciona ninguna planta industrial o información sobre su propósito exacto.

En cambio, el contexto habla principalmente sobre las tecnologías desarrolladas por Navantia y posibles futuras inversiones en infraestructura. Aunque la información sobre los sistemas de combate y propulsión es correcta según el texto proporcionado, no se hace referencia a ningún propósito para una planta industrial específica.

Por lo tanto, la respuesta dada no es fiel al contexto dado."
¿Está Alemania reforzando su defensa?,Alemania ha experimentado una profunda transformación desde la invasión rusa a gran escala en Ucrania en 2022 para enfocar sus fuerzas armadas y espera un aumento de inversión en gasto nacional en defensa tras las elecciones. Ha relajado las reglas que limitan el nivel de deuda en su país para autorizar un aumento de gasto en defensa inmediato.,"Sí, Alemania está reforzando su defensa. Desde la invasión a gran escala de Ucrania en 2022, Alemania ha experimentado una profunda transformación en la forma de enfocar sus fuerzas armadas. La presidenta de la Comisión Europea, Ursula von der Leyen, ha llamado a hacer un esfuerzo colectivo para lanzar la Defensa europea.","['La fecha del artículo es: 1741647600.0 De todos modos, la conservadora alemana ha subrayado quela parte principal del plan recae en los hombros de los Estados miembros, que son los que deben elevar el gasto nacional en Defensa y recuperar los niveles de inversión de hace décadas.', 'La fecha del artículo es: 1741820400.0 Desde la invasión a gran escala de Ucrania por parte del presidente ruso Vladimir Putin en 2022, Alemania ha experimentado una profunda transformación en la forma de enfocar sus fuerzas armadas.', 'La fecha del artículo es: 1741647600.0 Europa está llamada a hacerse cargo en mayor medida de su propia defensa.', 'La fecha del artículo es: 1741647600.0 La presidenta de la Comisión Europea,Ursula von der Leyen, ha avisado este martes de que Europa vivía hasta ahora en un momento de ""déficit de seguridad"", una ""ilusión que ha terminado"", por lo que ha llamado a hacer un esfuerzo colectivo para lanzar la Defensa europea en la que los Estados miembros disparen elgasto militar por encima del 3 por ciento del PIB, una cifra que estáen consonancia con el debate abierto en el seno de la OTAN.', 'La fecha del artículo es: 1741820400.0 Las fuerzas armadas alemanas prosiguieron su rearme, pero siguieron sufriendo graves carencias de personal el año pasado, según un informe presentado el martes al Parlamento del país.', 'La fecha del artículo es: 1741906800.0 Si finalmente se selecciona el Eurofighter, Airbus Defence y otros proveedores alemanes también se beneficiarían.', 'La fecha del artículo es: 1741906800.0 La medida subraya el compromiso de Suecia de mejorar las capacidades defensivas de Ucrania en una guerra que se ha prolongado hasta su tercer año, destacando un esfuerzo internacional más amplio para proporcionar a Kiev armamento sofisticado.', 'La fecha del artículo es: 1741647600.0 Disparar el gasto en Defensa o preservar intacto el Estado del Bienestar, eje medular de todo el ideal europeo.']
","['Desde la invasión a gran escala de Ucrania por parte del presidente ruso Vladimir Putin en 2022, Alemania ha experimentado una profunda transformación en la forma de enfocar sus fuerzas armadas.']",0.8,0.9,0.9,Sí,1.0,0.8743123487205379,0.8,0.85,0.8,"No

La razón para considerar que la respuesta no es del todo fidel a la información proporcionada en el contexto es porque la respuesta menciona ""la relajación de las reglas que limitan el nivel de deuda"" y ""un aumento de gasto en defensa inmediato tras las elecciones"". Sin embargo, ninguna de estas afirmaciones se encuentran explícitamente en el contexto proporcionado. Aunque la transformación de las fuerzas armadas alemanas ha sido mencionada, no hay información sobre cambios recientes en las reglas presupuestarias ni respecto a un aumento inmediato del gasto en defensa tras elecciones específicas.

Los puntos principales que se encuentran consistentes con el contexto son:
- La transformación de las fuerzas armadas alemanas debido a la invasión rusa a Ucrania.
- El llamado a aumentar el gasto militar por encima del 3% del PIB.
- Las carencias de personal en las fuerzas armadas alemanas.

Por lo tanto, la respuesta es incompleta y contiene elementos que no están respaldados por los datos proporcionados."
