user_input,response,reference,retrieved_contexts,reference_context,precision_mistral,recall_mistral,factual_correctness_mistral,faithfulness_mistral,precision_qwen2.5,recall_qwen2.5,factual_correctness_qwen2.5,faithfulness_qwen2.5,real_recall,similarity
Qué acuerdo de 4.000 millones hay entre Airbus y Defensa,"El acuerdo es para la adquisición de 25 cazas Eurofighter Typhoon de la Tranche 4 por un valor de 4.000 millones de euros, incluyendo dos simuladores de última generación con toda su infraestructura, motores y múltiples piezas de repuesto, así como el mantenimiento habitual de los cazas.","Entre el 18/12/2024 y el 22/12/2024, el Ministerio de Defensa y Airbus firmaron un acuerdo para la compra de 25 cazas Eurofighter Typhoon del programa Halcón II. Este acuerdo tiene un valor de 4.000 millones de euros e incluye simuladores, motores, repuestos y el mantenimiento de los cazas de los programas Halcón I y II. Estos cazas están destinados a sustituir a parte de los F-18 operativos en la península.","['La fecha del artículo es: 19/12/2024 La ministra de Defensa,Margarita Robles, ha formalizado este viernes en la sede deAirbusel segundo de los contratos, por los que se recibirán25 cazas Eurofighter Typhoon de la Tranche 4, la más moderna o evolucionada que hay en estos momentos en el mercado, por una cantidad de 4.000 millones de euros.', 'La fecha del artículo es: 19/12/2024 La bolsa económica de los 4.000 millones de euros,aprobada por el Consejo de Ministros en el mes de septiembre de 2023, no sólo incluye los 25 aparatos, sino también dossimuladores de última generacióncon toda su infraestructura,motores y múltiples piezas de recambio, así como elmantenimiento habitual de los cazas.', 'La fecha del artículo es: 19/12/2024 La ministra de Defensa, Margarita Robles, durante el acto de firma del contrato con Airbus para la adquisición de 25 nuevos EurofighterMinisterio de Defensa  La ministra ha enfatizado la magnífica calidad de la industria de defensa española, que «nos permite cumplir con nuestros compromisos en el marco de la UE y la OTAN, así como gozar de una elevada consideración y ser valorado como un socio fiable y serio».', 'La fecha del artículo es: 19/12/2024 Acto de firma del contrato con Airbus para la adquisición de 25 nuevos Eurofighter.', 'La fecha del artículo es: 19/12/2024 El Gobierno aprobó en septiembre de 2023 la producción de las 25 aeronaves, que se sumaron a un contrato anterior por otro lote de 20 cazas.', 'La fecha del artículo es: 20/12/2024 En este contexto, elMinisterio de Defensaanunció este viernes la firma de unconveniode colaboración con laSecretaría de Industria de Defensa turca, ""un memorando para desarrollar unsistema de entrenamiento avanzado para pilotos de caza del Ejército del Airecon participación industrial de España y Turquía"".', 'La fecha del artículo es: 19/12/2024 Un paquete que no sólo es para las unidades del programa Halcón II, sino que también incluye a los 20 cazas del programa Halcón I. Durante la firma, Margarita Robles ha mantenido que ""el compromiso del Gobierno de España con la inversión en Defensa es inequívoco"", que esta adquisición es ""un refuerzo de las capacidades para el Ejército de Aire y del Espacio, en unos momentos muy complicados en los que la modernización es esencial"" y que, además, ""nos permite cumplir con nuestros compromisos en la UE y la OTAN, así como gozar de una elevada consideración y ser valorado como un socio fiable y serio"".', 'La fecha del artículo es: 19/12/2024 Al acto celebrado hoy han acudido también el jefe de Estado Mayor del Ejército del Aire y del Espacio, general del AireFrancisco Braco; el presidente de Airbus España,Francisco Javier Sánchez Segura, y los CEO de ‘Eurofighter’,Giancarlo Mezzanatto, y Eurojet,Ralf Breiling.']
","['La ministra de Defensa,Margarita Robles, ha formalizado este viernes en la sede deAirbusel segundo de los contratos, por los que se recibirán25 cazas Eurofighter Typhoon de la Tranche 4, la más moderna o evolucionada que hay en estos momentos en el mercado, por una cantidad de 4.000 millones de euros.','Un paquete que no sólo es para las unidades del programa Halcón II, sino que también incluye a los 20 cazas del programa Halcón I.']",0.8,0.9,0.9,Sí,0.8,0.85,0.8,"Sí

La respuesta proporcionada coincide con la información ofrecida en el contexto, incluyendo los detalles sobre el número de cazas (25), el tipo (Eurofighter Typhoon de la Tranche 4), el valor del contrato (4.000 millones de euros) y lo que se incluye en el paquete (dos simuladores de última generación con toda su infraestructura, motores y piezas de repuesto).",1.0,0.8417561371933161
La princesa Leonor y la Escuela Naval militar,"La Princesa Leonor de Borbón ha ingresado en la Escuela Naval Militar, donde comenzará su segundo año de formación militar, dentro del plan especial de tres años que se ha creado para ella como heredera de la Corona.","El 29 de agosto de 2024, la Princesa Leonor de Borbón ingresó en la Escuela Naval Militar de Marín (Pontevedra) para iniciar su segundo año de formación militar. Este año comparte clase con los futuros oficiales de la Armada y la Infantería de Marina, y tiene el rango de Guardiamarina de Primera. El capitán de navío Pedro Cardona Suanzes es su tutor personal durante su estancia en la academia.","['La fecha del artículo es: 28/08/2024 La Princesa Leonor de Borbón ha ingresado en la Escuela Naval Militar, donde comenzará su segundo año de formación militar, dentro del plan especial de tres años que se ha creado para ella como heredera de la Corona.', 'La fecha del artículo es: 28/08/2024 Leonor de Borbón conociendo las instalaciones de la Escuela Naval Militar de Marín (Pontevedra).', 'La fecha del artículo es: 28/08/2024 Leonor de Borbón ha sido recibida a las puertas del centro por el comandante-director de la Escuela Naval Militar, capitán de navío Pedro Cardona Suanzes.', 'La fecha del artículo es: 28/08/2024 La Princesa de Asturias ha pasado a firmar en el libro de honor de la Escuela Naval Militar de Marín (Pontevedra) acompañada por el comandante-director.', 'La fecha del artículo es: 28/08/2024 El capitán de navío ha renunciado al ascenso para dirigir la academia durante la estancia de la heredera de la Corona y hacer de tutor personal durante los meses que Leonor de Borbón esté en ella.', 'La fecha del artículo es: 28/08/2024 A su llegada al centro militar, la Princesa de Asturias ha saludado a los oficiales que forman parte de la dirección de la academia.', 'La fecha del artículo es: 28/08/2024 La Princesa de Asturias comienza en el tercer curso de la academia, con el rango de Guardiamarina de Primera.', 'La fecha del artículo es: 28/08/2024 “Hoy me incorporo, con gran ilusión, a esta Escuela Naval Militar para continuar con mi formación castrense.']
","['La Princesa Leonor de Borbón ha ingresado en la Escuela Naval Militar, donde comenzará su segundo año de formación militar','La Princesa de Asturias, Leonor de Borbón, ha zarpado este sábado en el XCVII crucero de instrucción del Juan Sebastián Elcano, el buque-escuela de la Armada española.']",0.9,0.9,0.9,Sí,0.9,0.9,0.9,"Sí

La respuesta proporcionada es fiel al contexto dado, ya que menciona correctamente:

1. La entrada de Leonor de Borbón en la Escuela Naval Militar.
2. Que comenzará su segundo año de formación militar.
3. Se refiere a la planificación especial de tres años creada para ella.
4. Menciona que es heredera de la Corona.

Todos estos elementos concuerdan con el contexto proporcionado, por lo que la respuesta es precisa y fiable.",0.5,0.8833911551316558
Desfile militar,"Un desfile militar se refiere a una exhibición pública y formal en honor al ejército o la fuerza policial, donde participan soldados y vehículos militares. En este contexto, se menciona el paso de varios regimientos, como el Inmemorial del Rey n°1, Tercio Juan de Austria 3º de la Legión, Escuadrón de Sables de la Guardia Civil, Batallón de Guardia Civil, VEC del Regimiento de Caballería ‘Lusitania’ nº8 y Regimiento América Nº66 de Cazadores de Montaña. Además, se menciona a Felipe VI pasando revista al batallón de honores de la Guardia Real.","El 12 de octubre de 2024 se celebró el desfile militar por el Día de la Fiesta Nacional, aunque la lluvia causó la suspensión del desfile aéreo y los saltos paracaidistas. Felipe VI y la Princesa Leonor rindieron homenaje a la bandera y a los caídos. A pesar de la lluvia, hubo un desfile terrestre con diversas unidades y vehículos militares.","['La fecha del artículo es: 11/10/2024 El regimiento Inmemorial del Rey n° 1 del ejército de tierra, desfilando bajo la lluvia que ha azotado este sábado la capital.', 'La fecha del artículo es: 11/10/2024 El Tercio Juan de Austria 3º de la Legión ha desfilado con Killo, un carnero un borrego de seis años que ya desfiló ante su Majestad el Rey en Granada con motivo del Día de las Fuerzas Armadas (DIFAS) de 2023.', 'La fecha del artículo es: 11/10/2024 El Escuadrón\xa0de Sables de la Guardia Civil a su paso por la tribuna de autoridades.', 'La fecha del artículo es: 11/10/2024 Batallón de Guardia Civil a su paso por el palco real donde se encontraba el Jefe del Estado.', 'La fecha del artículo es: 11/10/2024 Un VEC (Vehículo de Exploración de Caballería) del Regimiento de Caballería ‘Lusitania’ nº8\xa0 del Ejército de Tierra.', 'La fecha del artículo es: 11/10/2024 La Guardia Civil ha mostrado un blindado Lince -que prestó servicio en Afganistán- y un blindado URO VAMTAC con una escalinata en el techo para realizar intervenciones especiales.', 'La fecha del artículo es: 11/10/2024 Regimiento América Nº66 de Cazadores de Montaña.', 'La fecha del artículo es: 11/10/2024 Felipe VI pasando revista al batallón de honores de la Guardia Real..']
","['La Familia Real (a excepción de la infanta Sofía, que no ha podido acudir al desfile) ante la bandera de España durante el desfile por el día de la Fiesta Nacional realizando el saludo protocolario a la enseña nacional.','Un VEC (Vehículo de Exploración de Caballería)','El regimiento Inmemorial del Rey n° 1 del ejército de tierra, desfilando bajo la lluvia que ha azotado este sábado la capital.']",0.8,0.65,0.9,Sí,0.8,0.85,0.85,"Sí

La respuesta proporcionada es fiel al contexto dado, ya que menciona correctamente todos los elementos relevantes:

1. Se describe un desfile militar público.
2. Se enumera la participación de varios regimientos y unidades militares (Regimiento Inmemorial del Rey n° 1, Tercio Juan de Austria 3º de la Legión, Escuadrón de Sables de la Guardia Civil, Batallón de Guardia Civil, VEC del Regimiento de Caballería ‘Lusitania’ nº8 y Regimiento América Nº66 de Cazadores de Montaña).
3. Se incluye el hecho de que Felipe VI pasó revista al batallón de honores de la Guardia Real.

La respuesta captura los elementos esenciales del desfile sin añadir información no presentada en el contexto proporcionado, por lo tanto, se considera fiel a este último.",0.6666666666666666,0.6499464137989854
Que ha pasado con Feindef y las empresas israelis,"La secretaria de Estado de Defensa, Amparo Valcarce, anunció que se haría boicot a las empresas israelíes en respuesta al anuncio negativo del certamen. No habrá participación institucional de Israel ni de ninguna empresa israelí. La edición FEINDEF 2024 tendrá seis grandes empresas patrocinadoras españolas: Airbus, Amper, Escribano, Grupo Oesía, Indra y Navantia. Marc Darmon ha planteado que los países europeos deberían comprar más material militar en Europa para avanzar hacia la ""soberanía estratégica"" y autoabastecerse lo máximo posible del material militar necesario. Indra se hizo con el 51% de las acciones de Tess Defence mediante un acuerdo de adquisición de acciones adicionales al que ya poseía.","Entre el 15/10/2024 y el 31/10/2024, Defensa obligó a Feindef a vetar a Israel y a sus empresas. No habrá participación institucional de Israel, ni de ninguna empresa israelí, en la feria debido al compromiso de España con la paz y seguridad en Palestina y Líbano y el respeto al Derecho Internacional humanitario.","['La fecha del artículo es: 29/10/2024 FEINDEF, que tiene el apoyo institucional del Ministerio de Defensa desde sus inicios en 2019, es un evento bienal y esta nueva edición contará entre sus principales empresas patrocinadoras con seis de las grandes del sector de la Defensa en España:Airbus, Amper, Escribano, Grupo Oesía, Indra y Navantia.', 'La fecha del artículo es: 29/10/2024 Elaspecto negativodel certamen lo ha anunciado la secretaria de Estado de Defensa,Amparo Valcarce, mano derecha de la ministra,Margarita Robles, que ha anunciado que se haráboicot a las empresas israelíes: ""No habrá participación institucional de Israel, ni de ninguna empresa israelí.', 'La fecha del artículo es: 26/10/2024 Se trata de un nuevo departamento que tiene un carácter estratégico, y que nace con la misión de articular la industria en un momento particularmente complejo de la situación internacional, especialmente tras la invasión de Rusia a Ucrania.', 'La fecha del artículo es: 29/10/2024 Encuéntranos en:', 'La fecha del artículo es: 22/10/2024 Encuéntranos en:', 'La fecha del artículo es: 27/10/2024 Encuéntranos en:', 'La fecha del artículo es: 17/10/2024 Encuéntranos en:', 'La fecha del artículo es: 28/10/2024 Encuéntranos en:']
","['Elaspecto negativodel certamen lo ha anunciado la secretaria de Estado de Defensa,Amparo Valcarce, mano derecha de la ministra,Margarita Robles, que ha anunciado que se haráboicot a las empresas israelíes']",0.95,0.95,0.9,Sí,0.8,0.85,0.9,"Sí

La respuesta proporcionada es fiel al contexto dado, ya que:

1. Menciona correctamente que Amparo Valcarce, secretaria de Estado de Defensa, anunció el boicot a las empresas israelíes.
2. Indica claramente que no habrá participación institucional ni empresarial de Israel en la edición 2024.
3. Enumera correctamente los seis patrocinadores españoles mencionados: Airbus, Amper, Escribano, Grupo Oesía, Indra y Navantia.

No se encuentra ninguna imprecisión o información incorrecta en la respuesta proporcionada basada en el contexto dado.",1.0,0.7156037511111369
Para que sirve la planta industrial de Navantia,"La planta industrial de Navantia sirve para la producción de materiales avanzados y equipos relacionados con sus actividades en construcción naval, defensa y energía renovable. También se utiliza para mejorar las capacidades tecnológicas y de gestión de la empresa.","La planta industrial de Navantia se utiliza principalmente para el diseño y construcción de buques, como los submarinos de la clase S-80 y las fragatas F-110. También se encarga de la modernización, reparación y el desarrollo de sistemas tecnológicos para estos buques. Además, participa en proyectos internacionales de construcción naval","['La fecha del artículo es: 05/01/2025 Armada | Navantia Alonso Palacios Según el comunicado por los astilleros españoles, «en virtud del acuerdo, la filial británica de Navantia gestionará lascapacidades industriales de Harland & Wolffaplicando su experiencia en construcción naval, gestión de programas complejos y transferencia de conocimiento» «Navantia UK valora positivamente el compromiso del Gobierno británico con el programa de construcción naval FSS y garantiza su ejecución y el fortalecimiento de las capacidades industriales locales, de acuerdo con las necesidades de construcción naval y del mercado de defensa de Reino Unido», agregó la declaración de la empresa española.', 'La fecha del artículo es: 05/01/2025 A semejanza de Navantia, se ha especializado en varias líneas de negocio, además de defensa, como la construcción y mantenimiento de grandes cruceros y mercantes, y fabricación de infraestructuras renovables.', 'La fecha del artículo es: 05/01/2025 Navantia aporta fundamentalmente transferencia tecnológica «Astillero 4.0» y experiencia en la gestión.', 'La fecha del artículo es: 12/03/2025 Entre sus aportaciones tecnológicas, Navantia destaca elsistema de combate y controlde plataforma de Navantia Sistemas, y unsistema de propulsión anaeróbico revolucionariodesarrollado por Navantia que aporta gran sigilo en inmersión, denominadoBEST-AIP.', 'La fecha del artículo es: 29/12/2024 A esto se suma la puesta en marcha de una planta industrial de alta capacidad para estos materiales, así como la creación de nuevas oficinas centrales y una planta dedicada a materias inertes.', 'La fecha del artículo es: 13/03/2025 El diseño de las corbetas es de última generación, maximizando la participación de Navantia, incorporando productos propios como el sistema de combate HAZEM, a través de la joint venture SAMINavantia, el sistema integrado de comunicaciones HERMESYS, el sistema de control de fuego DORNA, el Sistema Integrado de Control de Plataforma, el puente integrado MINERVA, motores propulsores bajo licencia MTU, grupos electrógenos diesel y reductoras bajo licencia Schelde.', 'La fecha del artículo es: 12/01/2025 Según la compañía, una vez esté finalizada la nueva planta contigua a sus actuales instalaciones en Cadrete,duplicará la plantilla y también la capacidad de producción.', ""La fecha del artículo es: 09/03/2025 En esta misma operación, la 'Álvaro de Bazán'""]
","['El diseño de las corbetas es de última generación, maximizando la participación de Navantia, incorporando productos propios como el sistema de combate HAZEM, a través de la joint venture SAMINavantia, el sistema integrado de comunicaciones HERMESYS, el sistema de control de fuego DORNA, el Sistema Integrado de Control de Plataforma, el puente integrado MINERVA, motores propulsores bajo licencia MTU, grupos electrógenos diesel y reductoras bajo licencia Schelde.']",0.95,0.85,0.9,Sí,0.8,0.8,0.8,"Sí

Esta respuesta es fiel a la información proporcionada en el contexto, ya que se basa correctamente en los puntos clave:

1. La planta industrial sirve para producir materiales avanzados y equipos relacionados con las actividades de Navantia.

2. Se menciona que la planta ayudará a mejorar las capacidades tecnológicas y de gestión de la empresa.

3. El contexto indica que esta nueva planta duplicará la plantilla y la capacidad de producción de Navantia, lo cual coincide con el punto de la respuesta sobre la duplicación de la plantilla.

4. La información relacionada con la construcción naval, defensa y energía renovable también se alinea con los puntos presentados en el contexto.

Por lo tanto, la evaluación es que la respuesta es completamente fiel al contexto proporcionado.",1.0,0.7413388026398254
¿Está Alemania reforzando su defensa?,"Alemania ha experimentado una profunda transformación en la forma de enfocar sus fuerzas armadas desde la invasión a gran escala de Ucrania por parte del presidente ruso Vladimir Putin en 2022, y se espera que ese aumento de la inversión sea lo que espera de Alemania tras las elecciones de este domingo.","Sí, Alemania está reforzando su defensa. Desde la invasión a gran escala de Ucrania en 2022, Alemania ha experimentado una profunda transformación en la forma de enfocar sus fuerzas armadas. La presidenta de la Comisión Europea, Ursula von der Leyen, ha llamado a hacer un esfuerzo colectivo para lanzar la Defensa europea.","['La fecha del artículo es: 25/03/2025 Alemania acaba de llegar a un pacto histórico para aumentar el gasto en defensa, pero en España descartan incrementarlo.', 'La fecha del artículo es: 26/02/2025 La multinacional alemana de armamentoRheinmetallestá replanificando su estrategia en un contexto marcado por la necesidad europea de aumentar su inversión en defensa y la crisis que atenaza al mercado del automóvil en toda Europa y particularmente enAlemania.', 'La fecha del artículo es: 10/03/2025 De todos modos, la conservadora alemana ha subrayado quela parte principal del plan recae en los hombros de los Estados miembros, que son los que deben elevar el gasto nacional en Defensa y recuperar los niveles de inversión de hace décadas.', 'La fecha del artículo es: 12/07/2024 Seguiremos impulsando y perfeccionando esta innovación fabricada en Alemania para poder ofrecer a la Fuerza Aérea alemana una solución asequible con el rendimiento que necesita para maximizar los efectos y multiplicar la potencia de su flota de cazas para la década de 2030», afirmóMichael Schoellhorn, CEO de Airbus Defence and Space.', 'La fecha del artículo es: 09/03/2025 Pero la alta funcionarios alemana también puso en valor las medidas ya aprobadas, incluyendo el instrumento de 150.000 millones y, por supuesto, los 600.000 millones en espacio fiscal que Bruselas da a los países para disparar el gasto en Defensa a través de la activación de las cláusulas de escape.', 'La fecha del artículo es: 12/03/2025 Las fuerzas armadas alemanas prosiguieron su rearme, pero siguieron sufriendo graves carencias de personal el año pasado, según un informe presentado el martes al Parlamento del país.', 'La fecha del artículo es: 12/03/2025 Desde la invasión a gran escala de Ucrania por parte del presidente ruso Vladimir Putin en 2022, Alemania ha experimentado una profunda transformación en la forma de enfocar sus fuerzas armadas.', 'La fecha del artículo es: 17/02/2025 Ese aumento de la inversión es lo que espera de Alemania tras las elecciones de este domingo: señala que cree que las reglas que limitan el nivel de deuda en su país se relajarán paraautorizar un aumento de gasto en defensa ""inmediato"".']
","['Desde la invasión a gran escala de Ucrania por parte del presidente ruso Vladimir Putin en 2022, Alemania ha experimentado una profunda transformación en la forma de enfocar sus fuerzas armadas.']",0.8,0.7,0.9,Sí,0.8,0.85,0.9,"Sí

La respuesta está fiel al contexto proporcionado, ya que menciona:

1. La transformación de las fuerzas armadas alemanas desde la invasión a Ucrania.
2. Las expectativas post-elecciones para un aumento en el gasto militar.

Ambos puntos son consistentes con los detalles proporcionados en el contexto dado.",1.0,0.817807558296503
